,title,href,tag,summary
0,Omicron variant in Europe earlier than thought,/news/world-europe-59473131,Europe,The new Covid-19 variant is found in Dutch samples taken before it was reported by South Africa.
1,Global markets fall after Moderna Omicron warning,https://www.bbc.com/news/business-59426353,Business,
2,Quest begins to drill Antarctica's oldest ice,https://www.bbc.com/news/science-environment-59475410,Science & Environment,
3,The benefits of constant job-hunting,https://www.bbc.com/worklife/article/20211129-should-you-job-hunt-constantly,Worklife,
4,The UK isle where native ponies roam,https://www.bbc.com/travel/article/20211129-the-scottish-isle-where-native-ponies-roam,Travel,
5,Booster campaign to be put 'on steroids' - government,/news/live/59473695,UK,Boris Johnson wants all eligible adults in England to be offered a booster jab by the end of January to tackle Omicron.
6,IS man guilty of genocide in Yazidi murder trial,/news/world-europe-59474616,Europe,Taha al-Jumailly is jailed by a German court for crimes including the murder of a young Yazidi girl.
7,Mike Pence calls for curtailed abortion rights,/news/world-us-canada-59480917,US & Canada,The former vice-president speaks on the eve of the most important abortion case in years at the top US court.
8,Premier League: Newcastle v Norwich & Leeds v Crystal Palace,/sport/live/football/58961656,Football,Follow live text updates as Newcastle host Norwich and Leeds entertain Crystal Palace in the Premier League.
9,Women's World Cup qualifying: England 6-0 Latvia - White breaks goal record,/sport/live/football/57028066,Football,Follow live text commentary as England host Latvia in 2023 Women's World Cup qualifying.
10,Man City face player 'emergency' - Guardiola,/sport/football/59481660,Football,Manchester City manager Pep Guardiola says the club are in an 'emergency' situation and he is down to his final 14 or 15 players for the Premier League trip to Aston Villa.
11,The man who volunteered to be imprisoned in Auschwitz,/reel/video/p0b711n3/the-man-who-volunteered-to-be-imprisoned-in-auschwitz,,
12,The innovations that will change flight forever,/reel/video/p0b1w4l0/meeting-aviation-s-carbon-challenge,,
13,Is a vegan diet healthier than eating meat and dairy?,/reel/video/p0b5x2z7/is-a-vegan-diet-healthier-than-eating-meat-and-dairy-,,
14,How long until your car drives itself?,https://www.bbc.com/future/article/20211126-how-driverless-cars-will-change-our-world,Future,Driverless vehicles will change our world in surprising ways
15,The 19th-Century master of maximalism,https://www.bbc.com/culture/article/20211125-why-we-still-love-original-anti-minimalist-william-morris,Designed,How the legendary William Morris is inspiring today's artists and designers
16,A new hope for the Great Barrier Reef?,https://www.bbc.com/travel/article/20211128-can-indigenous-knowledge-save-the-reef,Travel,"""Everybody learns how to have more respect for the land and sea"""
17,Should you skip the Great Resignation?,https://www.bbc.com/worklife/article/20211124-why-not-quitting-might-be-great-for-your-career,Worklife,Staying at your job could pay better career dividends than ever
18,10 TV shows to watch this December,https://www.bbc.com/culture/article/20211126-10-tv-shows-to-watch-this-december,Culture,Sex and the City is back and a bestselling crime thriller has been adapted
19,Why France is making this woman a national hero,https://www.bbc.com/news/world-europe-59468682,Europe,France is honouring the US-born 20th Century singer and activist Josephine Baker
20,The lowdown on the most powerful space telescope,https://www.bbc.com/news/science-environment-59419110,Science & Environment,It's one of the grand scientific undertakings of our times
21,The bustling hidden world of hedgerows,/future/article/20211125-britains-ancient-fortresses-for-nature,,
22,The living architecture of India,/future/article/20211117-how-indias-living-bridges-could-transform-architecture,,
23,A neglected protein-rich 'superfood',/future/article/20210420-the-protein-rich-superfood-most-europeans-wont-eat,,
24,Life after Twitter: What's next for Jack Dorsey?,/news/technology-59471636,Technology,"The last time the tech visionary left Twitter, he set up another company now worth $100bn."
25,Adele announces Las Vegas residency,/news/entertainment-arts-59473984,Entertainment & Arts,
26,New global effort to map 'Wood Wide Web',/news/science-environment-59473960,Science & Environment,
27,Australian bank pays out over charging dead people,/news/59470666,Business,
28,WHO warns of very high global risk from Omicron,/news/world-59468155,World,
29,"More work needed to create green jobs, report says",/news/business-59430224,Business,
30,Rules tightened over racist language in films,/news/entertainment-arts-59473980,Entertainment & Arts,
31,"Storm Arwen brings snow, waves and winds",/news/uk-england-59457581,England,
32,Fire-eaters and dancers at Dakar cultural carnival,/news/world-africa-59450598,Africa,
33,Spellbinding photo of Welsh lighthouse wins award,/news/in-pictures-59403205,In Pictures,
34,Africa's top shots: Air kisses and date picking,/news/world-africa-59415582,Africa,
35,Photographer sorry for 'small eyes' Dior picture,/news/world-asia-china-59397737,China,
