,title,href,tag,summary
0,Russia planning prolonged drone attacks - Zelensky,/news/world-europe-64146813,Europe,Ukraine's president says Moscow aims to exhaust his country with a prolonged wave of drone strikes.
1,NFL player collapses on field during primetime game,/news/world-us-canada-64149300,US & Canada,
2,McCarthy struggling for Speaker vote support,/news/world-us-canada-64145106,US & Canada,
3,Liverpool’s top-four hopes hit by Brentford defeat,/sport/football/64092654,Football,
4,The people living in multiple timelines,https://www.bbc.com/future/article/20221124-the-people-living-in-multiple-timelines,Future,
5,More MEPs could lose immunity in EU bribery probe,/news/world-europe-64146807,Europe,EU parliament bids to lift immunity of two more MEPs in Qatar-linked corruption investigation.
6,Four dead after Australia helicopters collide,/news/world-australia-64142696,Australia,"Two UK citizens died in the crash, which occurred as one aircraft was taking off and the other landing."
7,Teenager charged over New York NYE machete attack,/news/world-us-canada-64146815,US & Canada,Trevor Bickford is accused of attacking three officers near Times Square during new year celebrations.
8,Mourners gather to pay respects to Pele at Santos,/sport/football/64145207,Football,"Thousands of mourners pay their respects to Brazil legend Pele who is lying in state at the stadium of his former club, Santos."
9,Kyogo denies Rangers Old Firm comeback victory,/sport/football/64092615,Football,Kyogo Furuhashi's late equaliser denies Rangers a famous Old Firm comeback victory and preserves Celtic's nine-point lead in the Scottish Premiership.
10,Brady books play-off spot and Packers stay alive,/sport/american-football/64142434,American Football,Tom Brady steers the Tampa Bay Buccaneers to their divisional title and the New York Giants end their play-off drought.
11,What does dying really feel like?,/reel/video/p0c59rmr/what-does-dying-really-feel-like-,,
12,Why pleasure is key to losing weight,/reel/video/p0brtrb1/why-pleasure-is-key-to-losing-weight,,
13,Why the Dutch don't say sorry,/reel/video/p0d1dqv3/why-the-dutch-don-t-say-sorry,,
14,An answer to India's flower waste,https://www.bbc.com/future/article/20221208-fleather-the-vegan-leather-made-of-indias-flower-waste,Future,How a start-up is turning flower waste from temples into vegan wallets and bags
15,Is this Italy's purest fruit?,https://www.bbc.com/travel/article/20221213-citron-the-exquisite-fruit-that-brings-rabbis,Travel,It's the most ancient and aromatic of all citrus fruits
16,How to build astonishing self-control,https://www.bbc.com/worklife/article/20230103-how-to-strengthen-willpower,Worklife,The thinking tweaks that can boost your willpower
17,The clothing that reveals racial truths,https://www.bbc.com/culture/article/20221229-the-colonial-clothing-that-reveals-hidden-truths-about-race,Culture,Dress codes shown in colonial art can tell us a lot about race and identity
18,Twitter probe after '400 million hacked' claim,/news/technology-64109777,Technology,Politicians and celebrities are said to be affected but the scale of the data breach is unverified.
19,'My house and village are falling into the sea',/news/uk-england-norfolk-63822899,Norfolk,A nurse says she is heartbroken that nothing can be done to save her house from coastal erosion.
20,"Earth, Wind & Fire drummer dies aged 67",/news/entertainment-arts-64148843,Entertainment & Arts,Child drumming prodigy White was one of the early members of the band with several of his brothers.
21,In defence of real Christmas trees,/future/article/20221213-why-christmas-trees-may-be-good-for-the-environment,,
22,What would a green World Cup look like?,/future/article/20221206-what-would-a-green-world-cup-look-like,,
23,The Alpine villages powered by streams,/future/article/20221129-the-alpine-villages-producing-their-own-power,,
24,Armchair shark detectives needed,/news/uk-wales-64042449,Wales,"Volunteers are needed to help identify sharks, skates and rays as part of a conservation project."
25,How can esports keep growing in 2023?,/news/entertainment-arts-64002012,Entertainment & Arts,
26,US demands Covid tests for visitors from China,/news/world-asia-china-64111492,China,
27,All solar system's planets visible in night sky,/news/science-environment-64082159,Science & Environment,
28,Sound Of 2023: Cat Burns writing songs to help fans,/news/entertainment-arts-64002162,Entertainment & Arts,
29,UK Covid checks on China arrivals under review,/news/uk-64116416,UK,
30,How a 'loan scam' led to Indian tycoon's downfall,/news/world-asia-india-64073467,India,
31,Striking photos from around the world this year,/news/in-pictures-63875897,In Pictures,
32,In pictures: The outlandish world of Vivienne Westwood,/news/entertainment-arts-64122710,Entertainment & Arts,
33,The UK year in pictures,https://www.bbc.co.uk/news/in-pictures-63917651,News,
34,Africa's top shots of 2022: Carnivals and tugs of war,/news/world-africa-64028772,Africa,
35,US winter storm in pictures,/news/in-pictures-64074758,In Pictures,
