,title,href,tag,summary
0,"Ukraine punches through key Russian line, generals claim",/news/world-europe-66702244,Europe,Kyiv says its troops are gaining momentum in what continues to be a lengthy and bloody counter-offensive.
1,Ukraine's defence minister dismissed by Zelensky,https://www.bbc.com/news/world-europe-66702893,Europe,
2,Teacher suicide exposes parent bullying in S Korea,https://www.bbc.com/news/world-asia-66655572,Asia,
3,Gen Z's new pro-union push,https://www.bbc.com/worklife/article/20230831-the-gen-zers-leading-a-new-pro-union-push,Worklife,
4,The Killer is a boring disappointment ★★☆☆☆,https://www.bbc.com/culture/article/20230903-the-killer-is-a-boring-disappointment,Culture,
5,One dead at Burning Man during heavy rain,/news/world-us-canada-66700006,US & Canada,Thousands of people remain stuck at the event in Nevada and could remain so for several more days.
6,Biden pledges Florida support in wake of storm damage,/news/world-us-canada-66699306,US & Canada,"But politics overshadowed his visit to Florida, where Governor Ron DeSantis snubbed Mr Biden's visit."
7,'What he always wanted': Hunt for lost McCartney bass,/news/entertainment-arts-66700300,Entertainment & Arts,Paul McCartney changed music history playing iconic Höfner guitar - but it hasn't been seen since 1969.
8,'Big-moment player Rice delivers on every level',/sport/football/66703157,Football,"Big players deliver the big moments to decide the big games and Arsenal's Declan Rice did that on every level against Manchester United, writes Phil McNulty."
9,'Verstappen achievement momentous but Ferrari the story at Monza',/sport/formula1/66702580,Formula 1,"Max Verstappen fought to a record 10th consecutive F1 victory but Ferrari's best performance of 2023 made them the story at Monza, says Andrew Benson."
10,Sancho made 'a scapegoat' after being dropped,/sport/football/66703343,Football,"Jadon Sancho says he is ""a scapegoat"" after Manchester United boss Erik ten Hag said he was dropped for Sunday's loss to Arsenal because of poor training performance."
11,The science of synchronising two brains,/reel/video/p0gb61p0/the-science-of-synchronising-two-brains,,
12,Why did the British government spy on King Edward VIII?,/reel/video/p0g9zzqc/why-did-the-british-government-spy-on-king-edward-viii-,,
13,Four ways to understand the multiverse,/reel/video/p0g9hhcg/four-ways-to-understand-the-multiverse,,
14,The road that's the '8th World Wonder',https://www.bbc.com/travel/article/20230903-the-karakoram-highway-the-road-thats-the-eighth-world-wonder,Travel,"It's a road trip of dreams, yet few have ever heard of it or how it came to be"
15,Mulligan 'has never been better',https://www.bbc.com/culture/article/20230902-maestro-review-bradley-coopers-bernstein-biopic-is-a-hit,Culture,Stars shine in Bradley Cooper's Bernstein biopic Maestro
16,Why unhappy workers can't quit,https://www.bbc.com/worklife/article/20230828-workers-are-quiet-quitting-and-only-employers-can-stop-it,Worklife,"Stuck in bad jobs without a choice to move on, many workers are leaning out"
17,Do animals dream like we do?,https://www.bbc.com/future/article/20230901-the-animals-that-dream-just-like-humans-do,Future,Humans aren't alone in dreamland
18,The new generation taking over from Asia’s richest man,https://www.bbc.com/news/world-asia-india-66643831,India,"Mukesh Ambani, who heads a $220-billion empire, plans to hand over the reins to his children"
19,Why Henry Ford imported a Cotswold cottage to US,https://www.bbc.com/news/uk-england-gloucestershire-66546779,Gloucestershire,In 1930 the billionaire picked a limestone home in Chedworth as his souvenir of England
20,How to do less... but get more done,https://www.bbc.co.uk/ideas/videos/how-to-do-less-but-get-more-done/p083cjq1,Ideas,"These tips will help you focus, get stuff done, and know when to log off"
21,Our mini ally in the climate fight?,/future/article/20230829-the-bacteria-that-can-capture-carbon,,
22,"A 100,000-year tomb for nuclear waste",/future/article/20230824-the-descent-to-the-worlds-first-waste-nuclear-fuel-storage-site,,
23,What is the greenest funeral option?,/future/article/20230821-how-to-plan-a-sustainable-funeral,,
24,'We carried our heritage with us',/news/in-pictures-66594398,In Pictures,Five refugee women share personal photographs revealing lives before war and conflict.
25,US singer-songwriter Jimmy Buffett dies aged 76,/news/entertainment-arts-66694147,Entertainment & Arts,
26,Brain fog after Covid linked to blood clots - study,/news/health-66658257,Health,
27,New tech boosts Dutch drive for sustainable farming,https://www.bbc.co.uk/news/business-66461769,Business,
28,"Flags, football and figure skating: Africa's top shots",/news/world-africa-66670677,Africa,
29,Google's search for an AI future as it turns 25,/news/technology-66659361,Technology,
30,Bake Off scraps national weeks after criticism,/news/entertainment-arts-66689042,Entertainment & Arts,
31,In pictures: Rare blue supermoon around the world,/news/in-pictures-66662857,In Pictures,
32,Is wildlife photo a ghostly face or a fish?,/news/science-environment-66604630,Science & Environment,
33,In pictures: Hurricane Idalia brings destruction,/news/in-pictures-66664539,In Pictures,
34,Wrestlers grapple in gravy at annual charity event,/news/uk-england-lancashire-66645681,Lancashire,
35,Photographer documents 'UFO town dreamland',/news/uk-wales-66619326,Wales,
