,title,href,tag,summary
0,Leak reveals top politicians secretly helped Uber,/news/business-62057321,Business,Emmanuel Macron is among leaders who helped the ride-hailing company disrupt new markets.
1,Protesters 'will occupy palace until leaders go',/news/world-asia-62111900,Asia,
2,Canada's internet outage caused by 'maintenance',/news/world-us-canada-62110358,US & Canada,
3,I needed to weather storm after Australia - Djokovic,/sport/tennis/62116635,Tennis,
4,Trump ally Bannon willing to testify at Jan 6 hearing,/news/world-us-canada-62117137,US & Canada,
5,Fifteen shot dead in South Africa bar,/news/world-asia-62111893,Africa,"The victims are believed to be between 19 and 35 years old, with several more in a critical condition."
6,Russian rockets kill 15 in housing block - Ukraine,/news/world-europe-62113185,Europe,Many are also feared to be trapped in the rubble of the apartment block in eastern Ukraine.
7,Djokovic recovers against Kyrgios to win Wimbledon,/sport/tennis/62109725,Tennis,Novak Djokovic underlines his recent dominance at Wimbledon with a composed fightback against Nick Kyrgios to win a fourth straight title.
8,England win third T20 despite fine Suryakumar ton,/sport/cricket/62114765,Cricket,England hold on for a consolation victory in the third Twenty20 against India despite Suryakumar Yadav's sensational century at Trent Bridge.
9,France underline credentials by thrashing Italy,/sport/football/62109410,Sport,Grace Geyoro scores a hat-trick as France show why they are among the Euro 2022 favourites by thrashing Italy in their Group D opener in Rotherham.
10,Clouds lift at Ferrari as Leclerc claims statement win,/sport/formula1/62116156,Formula 1,"Thing finally came together for Ferrari in Austria, allowing Charles Leclerc to deliver one of the most convincing victories of the season, writes Andrew Benson."
11,The ‘special relationship’ between Reagan and Thatcher,/reel/video/p0ckm40m/the-special-relationship-between-reagan-and-thatcher,,
12,The incredible humans who've evolved to thrive underwater,/reel/video/p0cjtl2v/south-east-asia-s-extraordinary-freedivers,,
13,The artist redefining erotic photography,/reel/video/p0chfw1m/yushi-li-s-new-take-on-erotic-photography,,
14,The silent danger of deep gum disease,https://www.bbc.com/future/article/20220707-why-bad-teeth-are-harmful-to-your-health,Future,Half of over-30s have an oral disease that can go undiagnosed for decades
15,The greatest prequel ever made?,https://www.bbc.com/culture/article/20220708-how-better-call-saul-bettered-breaking-bad,Culture,How genius TV drama Better Call Saul improved on its forebear Breaking Bad
16,The empire the Aztecs couldn't conquer,https://www.bbc.com/travel/article/20220710-the-empire-the-aztecs-couldnt-conquer,Travel,"They were a powerful political force, yet they were still nearly lost to history"
17,Could you get a digital nomad visa?,https://www.bbc.com/worklife/article/20220707-the-digital-nomad-visas-luring-workers-overseas,Worklife,Why 25-plus countries are moving to let travelling workers put down roots
18,The ancient material that cools homes,https://www.bbc.com/future/article/20220705-the-sustainable-cities-made-from-mud,Future Planet,The case for building cities with mud
19,The joys of steam cooking,https://www.bbc.co.uk/food/collections/steam_cooking,Food,How to create light and flavourful meals using a basket steamer
20,The rise and fall of Prime Minister Boris Johnson,https://www.bbc.com/news/in-pictures-62085538,In Pictures,The photographs that capture the rise and fall of the British prime minister
21,Why the world's tallest trees are dying,/future/article/20220623-the-genetic-power-of-ancient-trees,,
22,The promise of a world without roads,/future/article/20220621-what-if-roads-went-underground,,
23,The English town that welcomed the dark,/future/article/20220614-the-crusade-for-darker-night-skies,,
24,TV star Lauren Goodger announces death of baby,/news/uk-england-essex-62112884,Essex,"Ms Goodger, 35, said she is ""broken"" after the death of two-day-old Lorena."
25,"Logging, fishing and hunting 'driving extinction'",/news/science-environment-62094405,Science & Environment,
26,Security warning after sale of stolen Chinese data,/news/technology-62097594,Technology,
27,Zero Covid holds danger for China's Xi,/news/world-asia-china-62046521,China,
28,Sri Lanka: 'I can’t afford milk for my babies',/news/world-asia-62032761,Asia,
29,The video game prescribed by doctors to treat ADHD,https://www.bbc.co.uk/news/business-62060542,Business,
30,Call for higher welfare farming for Parma ham pigs,/news/science-environment-62065102,Science & Environment,
31,"Africa's top shots: Flutters, waves and tears",/news/world-africa-62076142,Africa,
32,Beaches and landscapes of an English summer,/news/in-pictures-61785703,In Pictures,
33,Return of Africa's most fashionable horse race,/news/world-africa-62020414,Africa,
34,Pride at 50: Rare photos of early marches,/news/in-pictures-61813459,In Pictures,
35,Have teenage kicks changed over the years?,/news/entertainment-arts-61968340,Entertainment & Arts,
