,title,href,tag,summary
0,Barriers up in Shanghai as China Covid protests spread,/news/live/world-asia-63776816,China,The demonstrations are an unprecedented challenge to President Xi Jinping's strict zero-Covid rules.
1,Shocking protests are huge challenge for China's leaders,https://www.bbc.com/news/world-asia-china-63772365,China,
2,Woman phoned father as mudslide hit Italian island,https://www.bbc.com/news/world-europe-63773421,Europe,
3,'The next Messi' - Musiala destined for greatness,https://www.bbc.com/sport/football/63776700,World Cup,
4,The first Asian settlement in the US,https://www.bbc.com/travel/article/20221127-saint-malo-the-first-asian-settlement-in-the-us,Travel,
5,Attacks on energy grid may be genocide - Ukraine,/news/world-europe-63773654,Europe,"The prosecutor-general tells the BBC Russian attacks are aimed at ""the full Ukrainian nation""."
6,Clashes in Brussels after Morocco beat Belgium,/news/world-europe-63776276,Europe,Police use water cannon and tear gas to deal with unrest in the centre of Brussels on Sunday.
7,William and Kate set out green credentials in US,/news/uk-63760468,UK,The Prince and Princess of Wales will travel to Boston for the Earthshot environmental prizes.
8,Germany score late for crucial draw against Spain,/sport/football/63692161,Football,A late Germany equaliser against Spain boosts their chances of qualifying for the World Cup last 16.
9,'We do not need boos to know we didn't play well',/sport/football/63775273,Football,"England's players do not ""need fans to boo"" them to know they have not played well, says forward Marcus Rashford."
10,'A fear of losing' - Pressure on below-par Belgium,/sport/football/63776291,Football,"Belgium show ""a fear of losing"" and ""haven't been the best Belgium yet"", says boss Roberto Martinez after a World Cup defeat by Morocco."
11,Iran complain to Fifa over flag change post by US,https://www.bbc.com/sport/football/63776093,World Cup,Iran's football federation complains to Fifa after the United States removed the emblem of the Islamic Republic from the country's flag in social media posts
12,The 'invisible man' who is key to Brazil's hopes,https://www.bbc.com/sport/football/63770741,World Cup,Gilberto Silva on why Casemiro could hold the key to his nation's World Cup hopes in Qatar
13,How do the World Cup tables look?,https://www.bbc.com/sport/football/world-cup/table,World Cup,Will your team make it to the Last 16? Check out the group standings from the 2022 Fifa World Cup
14,Inside the world of South Korean male beauty pageants,/reel/video/p0dh9qfr/inside-the-world-of-south-korean-male-beauty-pageants,,
15,The Vikings who became French and conquered Europe,/reel/video/p0djqf6t/the-surprising-viking-origin-of-normandy,,
16,My identity crisis of growing up mixed race in Austria,/reel/video/p0dh56jv/oachkatzlschwoaf-the-word-that-s-impossible-to-say,,
17,North Africa's Covid 'black hole',https://www.bbc.com/future/article/20221124-the-vaccine-hesitancy-in-north-africas-covid-black-hole,Future,The fight against Covid-19 is stalling in the west of the Sahara desert
18,The films reckoning with abusive men,https://www.bbc.com/culture/article/20221123-weinstein-drama-she-said-and-the-films-taking-on-abusive-men,Culture,Weinstein drama She Said and how Hollywood has responded to his downfall
19,Africa's stunning 80km safari train,https://www.bbc.com/travel/article/20221122-zimbabwes-stunning-80km-safari-train,Travel,"The ""Elephant Express"" offers visitors an utterly unique experience"
20,'A recipe for stress and burnout',https://www.bbc.com/worklife/article/20221123-how-flexibility-made-managers-miserable,Worklife,How the shift to flexibility made middle managers miserable
21,Rolls-Royce tests a jet engine running on hydrogen,https://www.bbc.com/news/business-63758937,Business,"The firm, together with easyJet, is trying out hydrogen instead of jet fuel in a jet engine"
22,"Museum closes 'racist, sexist and ableist' display",https://www.bbc.com/news/uk-63772864,UK,The Wellcome Collection says its Medicine Man display will end after a 15-year run
23,Could 300-year-old wheat feed a changing planet?,https://www.bbc.com/news/science-environment-63457903,Science & Environment,Scientists are searching through a museum's wheat collection to find the crop of the future
24,Should air miles schemes be scrapped?,/future/article/20221122-should-we-get-rid-of-air-miles-for-climate-change,,
25,The floating solar revolution,/future/article/20221116-the-floating-solar-panels-that-track-the-sun,,
26,The doctors prescribing 'blue' therapy,/future/article/20221108-the-doctors-prescribing-blue-therapy,,
27,Why Trump isn't returning to Twitter (for now),/news/technology-63725948,Technology,How the former US president might lose money if he starts tweeting.
28,Covid protests grip China's major cities,/news/world-asia-63771109,China,
29,Jeffrey Epstein victims sue several major banks,/news/business-63750504,Business,
30,Matt Hancock finishes third on I'm A Celebrity,/news/entertainment-arts-63634455,Entertainment & Arts,
31,Colossal dinosaur heading for London display,/news/science-environment-63741208,Science & Environment,
32,iPhone maker apologises after protests at plant,/news/business-63739562,Business,
33,Has Matt Hancock got the forgiveness he wanted?,/news/entertainment-arts-63653325,Entertainment & Arts,
34,Africa's top shots: Fan fashion and fighting fires,/news/world-africa-63741555,Africa,
35,In pictures: King Charles hosts first state visit,/news/in-pictures-63714611,In Pictures,
36,Historic images show 'how we used to live' in city,/news/uk-england-tyne-63674925,Tyne & Wear,
37,"Africa's top shots: Silk, beads and gold beauty queens",/news/world-africa-63661322,Africa,
38,Inside the floating polar research laboratory,/news/uk-england-essex-63628208,Essex,
