,title,href,tag,summary
0,'Bombogenesis' snowstorm pummels US East Coast,/news/world-us-canada-60177979,US & Canada,"Packing hurricane-force winds, the storm has triggered blizzard warnings and left thousands without power."
1,PM mulls bigger troop offer amid Ukraine crisis,/news/uk-60185733,UK,
2,England beat West Indies to level T20 series - reaction,/sport/live/cricket/56549274,Cricket,
3,The truckers shutting down Canada's capital,/news/world-us-canada-60164561,US & Canada,
4,NFL legend Brady expected to retire,/sport/american-football/60185291,American Football,
5,Why Germany isn't sending weapons to Ukraine,/news/world-europe-60155002,Europe,Germany's refusal to arm Ukraine has puzzled and angered some allies. Here's what's behind it.
6,"At 80, Italy president stays on amid successor row",/news/world-europe-60183929,Europe,Sergio Mattarella agreed to stay on after ruling parties failed to find a compromise candidate.
7,Joni Mitchell wants songs off Spotify in Covid row,/news/world-60177933,Entertainment & Arts,The singer asks that her songs are removed from the platform in protest against Covid misinformation.
8,Barcelona sign winger Traore from Wolves,/sport/football/60185112,European Football,Barcelona complete the signing of winger Adama Traore on loan from Wolves for the rest of the season.
9,Newcastle set to sign Lyon's Guimaraes,/sport/football/60185105,Football,Newcastle United are set to sign Lyon midfielder Bruno Guimaraes after the two clubs agreed a deal in principle.
10,Nadal eyes 21st title against Medvedev,/sport/tennis/60181937,Tennis,Rafael Nadal aims to win a record 21st Grand Slam title when he plays Russian second seed Daniil Medvedev in the Australian Open final.
11,What the rise of 'anti-work' means,https://www.bbc.com/worklife/article/20220126-the-rise-of-the-anti-work-movement,Worklife,Fed up workers are asking a big question: what's the purpose of work?
12,The voyage to the world's deepest shipwreck,https://www.bbc.com/future/article/20220121-the-dive-to-find-the-worlds-deepest-shipwreck,Future,"More than 75 years after sinking, the wreck of the the USS Johnston was finally located"
13,Driving Canada's toughest road,https://www.bbc.com/travel/article/20220124-driving-canadas-toughest-road,Travel,"It's so difficult, you get a certificate if you complete it"
14,The man who trained a young Osama Bin Laden to fight,/reel/video/p0bkqjgf/a-portrait-of-osama-bin-laden-as-a-young-man,,
15,The surprising truth about drinking milk,/reel/video/p08phq81/should-we-be-drinking-milk-,,
16,The spy who infiltrated Auschwitz and tried to warn the world,/reel/video/p0b711n3/the-man-who-volunteered-to-be-imprisoned-in-auschwitz,,
17,How humans are changing evolution,https://www.bbc.com/future/article/20220125-how-humans-are-changing-evolution,Future,Our species is creating new evolutionary forces that are reshaping life
18,The rebirth of Cuba's abandoned city,https://www.bbc.com/travel/article/20220123-matanzas-the-rebirth-of-cubas-abandoned-cultural-hub,Travel,"After decades of slumber, the former cultural hub is reawakening"
19,Why people settle for romantic partners,https://www.bbc.com/worklife/article/20220124-why-people-arent-as-picky-in-love-as-they-think,Worklife,The surprising truth about how we pursue relationships
20,10 films to watch this February,https://www.bbc.com/culture/article/20220127-10-films-to-watch-this-february,Culture,"Including a space disaster movie, a Kanye West documentary and Jackass' return"
21,News quiz: Damon Albarn prefers which artist to Taylor Swift?,https://www.bbc.com/news/world-60159718,World,How closely have you been paying attention to the headlines?
22,Ukraine crisis: Putin's geopolitical jigsaw,https://www.bbc.com/news/world-europe-60152007,Europe,Invasion or fear strategy: the Russian leader keeps everyone guessing
23,How to save hundreds on your food shop,https://www.bbc.co.uk/food/articles/food_waste_recipes,Food,The average UK family household spends about £700 a year on food that is thrown away
24,How a desert city holds back its sand,/future/article/20220125-how-dubai-is-pushing-back-its-encroaching-deserts,,
25,The 'outrageous' green plan for coal,/future/article/20220118-the-environmental-case-for-buying-a-coal-mine,,
26,The rhino that became an icon for peace,/future/article/20220111-the-rhinos-bringing-peace-in-india,,
27,Will the Highway Code update improve road safety?,https://www.bbc.co.uk/news/business-59997523,Business,The revamped code is designed to make the roads safer for users who are more at risk.
28,Scientist's 'once-in-a-lifetime' new insect find,/news/uk-england-cambridgeshire-60154018,Cambridgeshire,
29,Tiny Manchester theatre in national TV spotlight,/news/entertainment-arts-60126052,Entertainment & Arts,
30,Apple unveils AirTag safety guide amid stalker fears,/news/technology-60164847,Technology,
31,Period changes after Covid jab are short-lived,/news/health-60139091,Health,
32,Unvaccinated US patient denied a heart transplant,/news/world-us-canada-60132765,US & Canada,
33,Musk's SpaceX rocket on collision course with moon,/news/science-environment-60148543,Science & Environment,
34,Africa's top shots: Weighty matters and cartwheels,/news/world-africa-60156013,Africa,
35,In Pictures: Holocaust Memorial Day,/news/in-pictures-60154892,In Pictures,
36,Photos show lockdown life for shielding residents,/news/uk-england-tyne-60125941,Tyne & Wear,
37,Ghostly monkey among new Mekong area species,/news/world-asia-60106144,Asia,
38,The aurora hunters who chase the Northern Lights,/news/uk-scotland-highlands-islands-60028525,Highlands & Islands,
