,title,href,tag,summary
0,"'What will be left?’ 20,000 flee Canada city as fire surges",/news/live/world-us-canada-66542676,US & Canada,Yellowknife residents have been told to evacuate by noon on Friday as fires bear down on the city.
1,Category 4 hurricane barrels towards California,https://www.bbc.com/news/world-us-canada-66499946,US,
2,Nurse Lucy Letby guilty of murdering seven babies,https://www.bbc.com/news/uk-england-merseyside-65960514,UK,
3,The hit song that has divided the US,https://www.bbc.com/culture/article/20230818-rich-men-north-of-richmond-the-hit-song-that-has-divided-the-us,Culture,
4,When wildfires reach the stratosphere,https://www.bbc.com/future/article/20230817-how-wildfires-push-up-temperatures-long-after-they-are-extinguished,Future,
5,Drone attack hits building in central Moscow,/news/world-europe-66541027,Europe,Russian officials say air defences shot down the drone and its debris landed on the city's Expo Center.
6,Nurse Lucy Letby guilty of murdering seven babies,/news/live/uk-66180606,UK,Letby killed the babies at a Chester hospital in 2015 and 2016 - she is the most prolific killer of babies in the UK in modern times.
7,"Abused, stalked... the life of a US election worker",/news/world-us-canada-66540466,US & Canada,Threats to blow up polling stations. Police protection. Ballot counters in hiding. A grim new reality.
8,Transfers latest and Premier League news conferences,/sport/live/football/66540535,Football,"Premier League news conferences and all the latest football transfer news, as Lionesses await Sunday's ""dream"" World Cup final."
9,Liverpool sign Stuttgart midfielder Endo for £16m,/sport/football/66544075,Football,"Liverpool sign midfielder Wataru Endo from Stuttgart for a fee of about £16.2m (19m euros), subject to a work permit and international clearance."
10,Ireland v India first T20 international - live text,/sport/live/cricket/66438684,Cricket,Follow live text commentary from the first of three Twenty20 internationals between Ireland and India at Malahide.
11,The lesser known cycle fueling the deadliest wildfire,/reel/video/p0g7ch3b/maui-s-grass-fire-cycle-explained,,
12,Messi's seismic effect on the US soccer league,/reel/video/p0g73pdm/messi-s-seismic-effect-on-the-us-soccer-league,,
13,A message from the world's oldest living culture,/reel/video/p0g4d8vq/a-message-from-the-world-s-oldest-living-culture,,
14,Stunning photos of a new African wonder,https://www.bbc.com/travel/article/20230817-stunning-photos-of-a-new-african-wonder,Travel,"Few travellers know about the ""new Lalibela"""
15,Why this 1700s trend is coming back,https://www.bbc.com/future/article/20230816-the-farmers-boosting-crops-with-electricity,Future,Electrical horticulture is on the horizon. Could it boost productivity?
16,The greatest martial arts movie ever,https://www.bbc.com/culture/article/20230817-the-inside-story-of-how-bruce-lees-martial-arts-epic-enter-the-dragon-changed-cinema-forever,Culture,Why Enter the Dragon remains awe-inspiring 50 years on
17,Why workers are getting selfish,https://www.bbc.com/worklife/article/20230816-company-loyalty-is-out-touting-yourself-is-in,Worklife,"Company loyalty is out, and touting yourself is in"
18,China Evergrande files for US bankruptcy protection,https://www.bbc.com/news/business-66540785,Business,The move comes as fears grow over problems in the world's second largest economy
19,India's lunar lander sends close-up photos of Moon,https://www.bbc.com/news/world-asia-india-66541956,India,"The photos are taken by Vikram, Chandrayaan-3's lander, which is in its mission's last phase"
20,Blind Side family feud reignites a cultural debate,https://www.bbc.com/news/world-us-canada-66525890,US,"It has also pulled the film's lead actress, Sandra Bullock, into the controversy"
21,Sound recordings from beneath the sea,/future/article/20230815-how-undersea-sounds-help-us-understand-ocean-life,,
22,The indigenous guardians healing Canada,/future/article/20230809-how-indigenous-guardians-are-protecting-canadas-environment,,
23,The town where people live underground,/future/article/20230803-the-town-where-people-live-underground,,
24,Heartstopper and Babalola win TikTok Book Awards,/news/entertainment-arts-66537372,Entertainment & Arts,The winners were voted for by thousands of TikTok users through the video-sharing app.
25,'Sexist' Alexa didn't answer Lionesses win question,/news/technology-66508514,Technology,
26,In pictures: Michael Parkinson and his star guests,/news/entertainment-arts-66430865,Entertainment & Arts,
27,Struggling with asthma in world's most polluted city,/news/world-asia-66496992,Asia,
28,Inflatable moon blocks view for The Weeknd's fans,/news/newsbeat-66449789,Newsbeat,
29,"More rain, less snow are making Himalayas dangerous",/news/world-asia-india-66519698,India,
30,Target sales suffer after Pride month backlash,/news/business-66524497,Business,
31,"Tricks, trials and salutes: Africa’s top shots",/news/world-africa-66532676,Africa,
32,WW2 aerial photos opened to public for first time,/news/uk-england-manchester-66511918,Manchester,
33,Stunning photos as Perseid meteors light up skies,/news/uk-66486813,World,
34,Blowing horns and fierce horsemen: Africa’s top shots,/news/world-africa-66461417,Africa,
35,"Dolphins, tigers and turtles in focus",/news/in-pictures-66437556,In Pictures,
