,title,href,tag,summary
0,"First phase of Ukraine war over, Russia says",/news/live/world-europe-60856533,Europe,"A senior military official has said Russia will focus on the complete ""liberation"" of Ukraine's eastern Donbas region."
1,Supreme Court judge's wife urged election overturn,https://www.bbc.com/news/world-us-canada-60871794,US,
2,Rowling hits back at Putin after 'cancel culture' comment,https://www.bbc.com/news/world-europe-60878133,Europe,
3,The relationship taboo that won't die,https://www.bbc.com/worklife/article/20220317-age-gaps-the-relationship-taboo-that-wont-die,Worklife,
4,The top reason people choose not to be kind,https://www.bbc.com/future/article/20220323-what-stops-people-from-being-kinder,Future,
5,The PR missteps that overshadowed a royal tour,/news/uk-60870417,UK,Palace staff must be wondering how the defining image of the royal trip was not the joy that greeted them.
6,UK Covid infections climb by a million in a week,/news/health-60872687,Health,"About 4.3 million people - or one in every 16 - are thought to have the virus, compared to 3.3 million the week before."
7,Is North America's Arctic vulnerable to Russia?,/news/world-us-canada-60837944,US & Canada,"As tensions with Russia rise, fears mount that North America's isolated Arctic may be vulnerable"
8,England take seventh West Indies wicket in bid to secure lead,/sport/live/cricket/56549597,Cricket,England search for wickets as West Indies reply to the tourists' 204 on day two of the third Test in Grenada.
9,The football scam that took Eriksson to North Korea,/sport/football/60794963,Football,In the summer of 2009 mysterious new owners promised to propel fourth-tier side Notts County to grand success. It was all a big lie.
10,Saudi Arabian GP set to go ahead despite huge fire after oil field 'attack',/sport/live/formula1/58919690,Formula 1,Follow live text and BBC Radio 5 Live Sports Extra commentary from first and second practice at the Saudi Arabian Grand Prix.
11,How one of the world's most expensive spices is harvested,/reel/video/p0bpz9c7/how-one-of-the-world-s-most-expensive-foods-is-harvested,,
12,"A Nordic tale of 'sex, death, revenge and power'",/reel/video/p0bx78hx/why-we-are-still-living-in-an-old-norse-saga,,
13,Life beyond death in the driest place on Earth,/reel/video/p0br366s/life-beyond-death-in-the-driest-place-on-earth,,
14,The Caribbean's rare crowds-free isle,https://www.bbc.com/travel/article/20220324-the-caribbeans-crowds-free-irish-isle,Travel,It's joined the trend of island states attracting remote workers
15,Oscars 2022: Who will win?,https://www.bbc.com/culture/article/20220324-oscars-2022-who-will-win-and-who-should,Culture,Our critics give their Academy Award predictions – and pick their favourites
16,Are children overexposed or pampered?,https://www.bbc.com/worklife/article/20220324-kgoy-kids-getting-older-younger,Worklife,What social media and protective parents mean for 'kids these days'
17,The alternatives to Russia's natural gas,https://www.bbc.com/future/article/20220324-how-biogas-can-help-europe-cut-russian-gas,Future Planet,"Food waste, farm sludge and sewage could find new life as sources of fuel"
18,Why the oldest jokes are still funny,https://www.bbc.com/future/article/20220323-the-jokes-that-have-made-people-laugh-for-thousands-of-years,Future,What makes a good joke? It’s worth going back a few thousand years to find out.
19,Queen's delight as teapot factory comes to her,https://www.bbc.com/news/uk-60869176,UK,She was originally meant to visit the Staffordshire firm - but it arranged to bring its wares to...
20,Mixed responses to second Bridgerton series,https://www.bbc.com/news/entertainment-arts-60872729,Entertainment & Arts,"The hit Netflix series is described as ""less fun"" with fewer sex scenes, but also ""more dynamic"""
21,The town that got up and left,/future/article/20220310-the-illinois-town-valmeyer-could-be-a-model-for-relocation,,
22,The homes powered by a kite,/future/article/20220309-the-kites-flying-to-harness-the-worlds-strongest-winds,,
23,Hong Kong's answer to landslides,/future/article/20220225-how-hong-kong-protects-people-from-its-deadly-landslides,,
24,Charli XCX scores her first number one album,/news/entertainment-arts-60879915,Entertainment & Arts,"The star's fifth studio album, Crash, was billed as an experiment in commercial pop. It worked."
25,Russia 'hacked Ukrainian satellite communications',/news/technology-60796079,Technology,
26,UK's rainfall records rescued by volunteer army,/news/science-environment-60860397,Science & Environment,
27,Stomach bug cases plummeted in UK's Covid lockdown,/news/health-60819716,Health,
28,Russia's cost of living soars by more than 14%,/news/business-60856873,Business,
29,Britain's loudest bird makes booming recovery,/news/science-environment-60863563,Science & Environment,
30,Ferrell 'should have had Oscar nomination' for Elf,/news/entertainment-arts-60872722,Entertainment & Arts,
31,US photographer Dirck Halstead dies at 85,/news/in-pictures-60878983,In Pictures,
32,"Africa's top shots: Quiffs, puppets and chapatis",/news/world-africa-60861605,Africa,
33,Laptop art: From Vans to Harry Styles,/news/in-pictures-60592677,In Pictures,
34,Aerial photos show 100 years of changing landscape,https://www.bbc.co.uk/news/articles/cv2l5x3n0mxo,News,
35,Africa's top shots: Easy riders and lollipop men,/news/world-africa-60777278,Africa,
