,title,href,tag,summary
0,Tory MP Sir David Amess stabbed to death,/news/uk-58930593,UK,"A 25-year-old man was arrested on suspicion of murder after the attack at a church in Leigh-on-Sea, Essex."
1,Latest after MP killed as he met constituents,https://www.bbc.com/news/live/uk-england-essex-58929701,UK,
2,US to lift travel ban on 8 November,https://www.bbc.com/news/world-us-canada-58929441,US,
3,Why it's time to retire the term 'late bloomer',https://www.bbc.com/worklife/article/20211007-why-saying-late-bloomer-is-wrong,Worklife,
4,Spain's untapped 'liquid gold',https://www.bbc.com/travel/article/20211014-spains-untapped-liquid-gold,Travel,
5,The mystery of how long Covid damages our memory,/news/world-us-canada-58918869,US & Canada,"Since Chrissy Gibson was diagnosed with Covid-19, she has had to re-learn many aspects of her life."
6,Grieving Norwegian town seeks answers after murders,/news/world-europe-58923879,Europe,The innocence of a quiet town outside Oslo is shattered and residents are demanding answers.
7,Suicide bombing hits Afghan mosque during prayers,/news/world-asia-58925863,Asia,Explosions at a Shia mosque in Kandahar kill more than 30 people during Friday worship.
8,IPL final: CSK post 192-3 against KKR after Du Plessis' 86 - radio & text,/sport/live/cricket/56643384,Cricket,Follow live text and radio commentary as Chennai Super Kings face Kolkata Knight Riders in the Indian Premier League final.
9,'No discussions' on future - Bruce,/sport/football/58928166,Football,"Steve Bruce says he has tried to ""keep respect and dignity"" following Newcastle's takeover last week and there have been no discussions about his future"
10,Alisson & Fabinho to quarantine in Spain,/sport/football/58928165,Football,Liverpool's Brazilian duo Alisson Becker and defender Fabinho will travel directly to Spain from international duty to complete their Covid-19 quarantine.
11,The 420-year-old instructions for 'immortality',/reel/video/p09ykqlg/the-alchemist-believed-to-have-found-the-key-to-immortality,,
12,The unexpected obsession of China's super-rich,/reel/video/p08t6mv1/the-etiquette-school-for-china-s-super-rich,,
13,The secret chamber full of forbidden ancient erotica,/reel/video/p09xtq4m/the-forbidden-erotica-of-ancient-pompeii,,
14,India's many hidden languages,https://www.bbc.com/future/article/20211014-the-man-who-found-indias-hidden-languages,Future,India is home to hundreds of languages that have been hiding in plain sight
15,Why 'nice guys' became the villains,https://www.bbc.com/culture/article/20211014-netflixs-you-and-how-nice-guys-became-the-real-villains,Culture,How film and TV are questioning preconceptions about the men who commit violence
16,Saving California's rarest butterflies,https://www.bbc.com/future/article/20211013-the-race-to-save-californias-endangered-butterflies,Future Planet,The endangered butterflies have a taste for Gatorade
17,Is being 'average' enough at work?,https://www.bbc.com/worklife/article/20211008-why-not-every-good-worker-has-to-be-a-superstar,Worklife,Not the superstar at your job? You don’t need to be to succeed
18,A mystery off Canada's coast,https://www.bbc.com/travel/article/20211013-an-underwater-mystery-on-canadas-coast,Travel,"Until recently, these ancient sea gardens were overlooked by Western science"
19,Banksy's Love is in the Bin sells for record £16m,https://www.bbc.com/news/entertainment-arts-58908768,Entertainment & Arts,"The artwork, which self-shredded when sold in 2018, fetched more than double its guide price"
20,What's the verdict on Adele's new music?,https://www.bbc.com/news/entertainment-arts-58910034,Entertainment & Arts,The single is the singer's first new material since 2015
21,The unexpected benefits of tiger sharks,/future/article/20211007-why-sharks-help-fight-climate-change-in-the-oceans,,
22,Costa Rica's answer to 'range anxiety',/future/article/20210928-costa-ricas-answer-to-range-anxiety,,
23,The ancient tradition reviving in Spain,/future/article/20210923-the-revival-of-spains-epic-pastoral-migration,,
24,Idris Elba on his 'culture rich' Western film,/news/entertainment-arts-58920492,Entertainment & Arts,Idris Elba chats to Naga Munchetty about his role in The Harder They Fall.
25,Top huntsman guilty of encouraging illegal hunting,/news/science-environment-58654916,Science & Environment,
26,"Last chance to find Covid origins, WHO says",/news/health-58905945,Health,
27,Self-driving cars plague San Francisco street,/news/technology-58928706,Technology,
28,Cheaper Covid travel tests to start on 24 October,/news/uk-58917231,UK,
29,Rich countries' CO2 emissions rose rapidly in 2021,/news/science-environment-58897805,Science & Environment,
30,'Warehouse of ideas' named UK's best new building,/news/entertainment-arts-58908762,Entertainment & Arts,
31,In pictures: Joy through a lens,/news/in-pictures-58884549,In Pictures,
32,Africa's top shots: Superfans and sea patrols,/news/world-africa-58909966,Africa,
33,'Explosive sex' wins top wildlife photo award,/news/science-environment-58888305,Science & Environment,
34,Your pictures on the theme of 'derelict',/news/in-pictures-58841907,In Pictures,
35,Photo of ants feeding off honeydew wins competition,/news/in-pictures-58828861,In Pictures,
