,title,href,tag,summary
0,Biden tells Xi tensions must not 'veer into conflict',/news/live/world-67421394,World,"The rival leaders are holding a high-stakes summit in California, their first meeting in more than a year."
1,Israel says military operation continuing at Gaza's main hospital,https://www.bbc.com/news/live/world-middle-east-67423274,Middle East,
2,India beat NZ to reach final after Kohli record century,https://www.bbc.com/sport/cricket/67431009,Cricket,
3,Napoleon is 'an awe-inspiring achievement' ★★★★☆,https://www.bbc.com/culture/article/20231114-napoleon-review-ridley-scotts-biopic-is-an-awe-inspiring-achievement,Culture,
4,The site of Europe's earliest settlers,https://www.bbc.com/travel/article/20231114-orce-spain-the-site-of-europes-earliest-settlers,Travel,
5,How has Biden and Xi's relationship changed?,/news/world-us-canada-67432662,US & Canada,From Taiwan to Trump to a spy balloon - a decade of growing tension has shaped these two world leaders.
6,Hospital raid comes as clock ticks on war,/news/world-middle-east-67426546,Middle East,Allies are starting to change their tune as Israel troops enter Gaza's largest hospital.
7,War of words continues for US Senator and teamster,/news/world-us-canada-67431996,US & Canada,"Senator Markwayne Mullin said he would ""do anything"" in a fight, including biting an opponent"
8,Women's Champions League: Build-up to Real Madrid v Chelsea,/sport/live/football/67329163,Football,Follow live text updates and commentary as Chelsea face Real Madrid in their Group D opener in the Women's Champions League.
9,FA Cup: Cray Valley Paper Mills v Charlton,/sport/live/football/67359148,Football,Follow live text as Cray Valley Paper Mills host Charlton in their FA Cup first-round replay.
10,Joshua & Wilder to fight on same card in Saudi Arabia,/sport/boxing/67230113,Boxing,"Anthony Joshua and Deontay Wilder will fight separate opponents on the same night as part of a stacked card on 23 December in Riyadh, Saudi Arabia."
11,Why polar bears were once climate icons,/future/article/20231113-climate-change-why-photos-of-polar-bears-dont-work,,
12,The mirrors cooling Sierra Leone,/future/article/20231109-how-africas-first-heat-officer-is-protecting-women-in-sierra-leone,,
13,How bubble veils muffle wind farm noise,/future/article/20231106-the-big-bubble-curtains-protecting-porpoises-from-wind-farm-noise,,
14,How did 'ESG' become meaningless?,https://www.bbc.com/worklife/article/20231114-how-esg-came-to-mean-everything-and-nothing,Worklife,"How the business term ""ESG"" came to mean everything and nothing"
15,What if you met your future self?,https://www.bbc.com/future/article/20231114-time-travel-what-if-you-met-your-future-self,Future,Even imagining a conversation with a 'future you' has benefits for your health
16,How to update your wardrobe sustainably,https://www.bbc.com/culture/article/20231114-how-to-update-your-wardrobe-easily-and-sustainably,Culture,Breathing new life into your clothing doesn't have to mean new purchases
17,A dessert that inspires gratitude,https://www.bbc.com/travel/article/20231114-native-american-slump-puffy-dumplings-in-simmered-fruit,Travel,"This berry ""slump"" is warm, fruity and comforting"
18,Three-toed dinosaur footprint found at nature reserve,https://www.bbc.com/news/articles/czk210gp42eo,UK,The footprint is believed to be about 140 million years old and belong to a species of iguanodontian
19,John Oliver's pick wins NZ Bird of the Century poll,https://www.bbc.com/news/world-australia-67376814,Asia,"The pūteketeke won after the US talk show host's self-described ""alarmingly aggressive"" campaign"
20,The Las Vegas GP - a plan 40 years in the making,https://www.bbc.com/sport/formula1/67402155,Formula 1,The race will be held on a 3.85-mile track around the Las Vegas streets
21,What's the best way to become really strong?,/reel/video/p0gsfwky/what-s-the-best-way-to-become-really-strong-,,
22,Napoleon: The truth about 'small man syndrome',/reel/video/p0gqbk09/napoleon-the-truth-about-small-man-syndrome-,,
23,A simple ritual key to Finnish wellbeing,/reel/video/p0gnhcnx/saunas-the-essence-of-finland-s-heartbeat,,
24,US and China agree joint measures on climate,/news/science-environment-67425588,Science & Environment,Progress seen in climate talks between world's two biggest carbon emitters but major hurdles remain.
25,"Northern Lights, rain and racing: Photos of the week",/news/in-pictures-67378797,In Pictures,
26,Google sends a third of Safari ad revenue to Apple,/news/business-67417987,Business,
27,Pru & Tim: Dementia won't break our 60-year love story,/news/entertainment-arts-67415387,Entertainment & Arts,
28,Amazon latest firm to cut jobs in gaming industry,/news/technology-67417330,Technology,
29,Brazil gripped by 'unbearable' heatwave,/news/world-latin-america-67422663,Latin America & Caribbean,
30,Aniston and Schwimmer pay tribute to Matthew Perry,/news/entertainment-arts-67430717,Entertainment & Arts,
31,"Royals, rallies and regattas: Africa's top shots",/news/world-africa-67342719,Africa,
32,King Charles III delivers speech at State Opening of Parliament,/news/uk-politics-67344490,UK Politics,
33,Damage and disruption: Storm Ciarán in pictures,/news/in-pictures-67298061,In Pictures,
34,Elton John photography collection to go on display,/news/uk-england-london-67205468,London,
35,Skulls and flowers: Mexico's 'skeleton' parade,/news/in-pictures-67193453,In Pictures,
