,title,href,tag,summary
0,Judge delays release of Tyre Nichols arrest video,/news/world-us-canada-64882745,US & Canada,More than 20 hours of unseen footage was expected to show last January's violent traffic stop.
1,"Fox host Carlson not credible, says White House",https://www.bbc.com/news/world-us-canada-64883668,US,
2,The Indian monastery town coveted by China,https://www.bbc.com/news/world-asia-india-64870707,India,
3,A cartel's mistake could explain the Mexico kidnappings,https://www.bbc.com/news/world-latin-america-64825204,Latin America & Caribbean,
4,Europe's forgotten transalpine cuisine,https://www.bbc.com/travel/article/20230308-europes-forgotten-transalpine-cuisine,Travel,
5,'Glitchy' US immigration app branded racially biased,/news/world-us-canada-64814095,US & Canada,Migrants at the US-Mexico border say the new app often struggles to recognise darker-skinned faces.
6,US six-year-old who shot teacher won't be charged,/news/world-us-canada-64897423,US & Canada,"The ""prospect that a six-year-old can stand trial is problematic"", a prosecutor says in a media interview."
7,Big Sur residents told to stock up ahead of storm,/news/world-us-canada-64897062,US & Canada,"Parts of California, including Big Sur, south of San Francisco, are preparing for a new storm."
8,'It looks a failure' - time to rip up PSG project?,/sport/football/64894275,European Football,Paris St-Germain's latest Champions League failure means it could be time to change their approach and try something new.
9,'End of Conte's Spurs reign surely a formality',/sport/football/64897469,Football,"Antonio Conte's Tottenham crash out of the Champions League against AC Milan, and with another trophyless season on the cards it appears his tenure is coming to an end."
10,Bayern cruise past PSG to reach quarter-finals,/sport/football/64879878,European Football,Bayern Munich cruise into the quarter-finals of the Champions League as they condemn Paris St-Germain to another last-16 exit.
11,The Lebanon robbers who only take their own money,/reel/video/p0f52c7v/the-lebanon-robbers-who-only-take-their-own-money,,
12,Sworn virgins: Women who take vow of chastity and live as men,/reel/video/p0f79th5/burrneshat-the-last-sworn-virgins-of-albania,,
13,Has artificial intelligence achieved human-level consciousness?,/reel/video/p0f73vlw/can-artificial-intelligence-ever-be-sentient-,,
14,The young workers in a post-Me Too era,https://www.bbc.com/worklife/article/20230307-did-me-too-change-the-workplace-for-gen-z,Worklife,Gen Z have entered a post-reckoning workplace. What does it mean?
15,The untold story of the Grand Canyon,https://www.bbc.com/travel/article/20230307-mary-colter-the-woman-who-shaped-the-us-southwest,Travel,It was a vision of the Southwest that still rings true today
16,A cult novel's 'dangerous' diary,https://www.bbc.com/culture/article/20230307-the-power-of-forbidden-notebooks-hidden-diary-entries,Culture,The 'radical honesty' of the 1952 novel Forbidden Notebook
17,How Germany treats parental burnout,https://www.bbc.com/future/article/20230228-the-german-clinics-for-burnt-out-parents,Future,Can 'parent-child retreats' save frazzled families?
18,A sweet for India's festival of colours,https://www.bbc.com/travel/article/20230307-gujiya-a-flaky-pastry-to-celebrate-holi,World's Table,"In much of India, this flaky pastry is synonymous with the festival of Holi"
19,Breakthrough as eggs made from male mice cells,https://www.bbc.com/news/science-environment-64893170,Science & Environment,A Japanese researcher says he has created eggs from the cells of male mice
20,Harry and Meghan use princess title for Lilibet,https://www.bbc.com/news/uk-64890702,UK,"Princess Lilibet Diana, who turns two in June, was christened at the couple's LA home last week"
21,The clothes you can't recycle,/future/article/20230227-how-to-recycle-your-clothes,,
22,How longer weekends help the planet,/future/article/20230220-is-a-4-day-workweek-good-for-the-climate,,
23,Can the unborn have a say on climate?,/future/article/20230215-should-future-generations-have-climate-rights,,
24,Oceans littered with 171 trillion plastic pieces,/news/science-environment-64889284,Science & Environment,New estimates suggest that plastic pollution in the oceans has risen dramatically since 2005.
25,US interest rates could go higher than expected,/news/business-64881469,Business,
26,Why Lineker's comments present problem for the BBC,/news/entertainment-arts-64889868,Entertainment & Arts,
27,I was cut out of Covid origin debate - ex-CDC boss,/news/world-us-canada-64891745,US & Canada,
28,Invasive plants outnumber British flora - report,/news/science-environment-64842402,Science & Environment,
29,TikTok launches plans to allay China security fears,/news/technology-64887704,Technology,
30,MSF shuts hospital in Haiti over gang violence,/news/world-latin-america-64897375,Latin America & Caribbean,
31,'Being vulnerable made me a better photographer',/news/in-pictures-64837281,In Pictures,
32,Sunrise swim celebrates International Women's Day,/news/uk-scotland-64889062,Scotland,
33,Do you know this baby? Putting names to archive photos,/news/world-africa-64451314,Africa,
34,Pet crocs and red carpets: Africa's top shots,/news/world-africa-64823868,Africa,
35,The devastated towns near Ukraine's front line,/news/world-europe-64819471,Europe,
