,title,href,tag,summary
0,"More than 20,000 Russians dead in Bakhmut, US says",/news/world-europe-65451487,Europe,"Russia has suffered more than 100,000 causalities in the battle for Bakhmut, the White House says."
1,'Fighter jets are roaring over my home in Sudan',https://www.bbc.com/news/world-africa-65448685,Africa,
2,Yellen warns US could run out of cash in a month,https://www.bbc.com/news/world-us-canada-65452444,US,
3,Kim Kardashian and Serena Williams arrive at Met Gala,https://www.bbc.com/news/live/world-us-canada-65405017,US,
4,Inside Denmark's secret nuclear bunker,https://www.bbc.com/travel/article/20230501-regan-vest-inside-denmarks-secret-nuclear-bunker,Travel,
5,Trump rape accuser says her generation stayed quiet,/news/world-us-canada-65418706,US & Canada,"E Jean Carroll says she did not report the rape because she is a ""member of the silent generation""."
6,Shooting suspect was deported four times - US media,/news/world-us-canada-65447378,US & Canada,"Police have announced a reward of $80,000 for information leading to the suspect's arrest."
7,Two hospitals broke law by denying abortion - US,/news/world-us-canada-65452462,US & Canada,"Hospitals that refused life-saving care during an emergency broke federal rules, health officials say."
8,Leicester & Everton remain in trouble after chaotic draw,/sport/football/65370333,Football,Leicester City and Everton have to settle for a draw in a chaotic match which leaves both in deep trouble at the wrong end of the Premier League table.
9,The two-inch error that stopped an Olympic final,/sport/gymnastics/65426779,Sport,A 16-year-old Allana Slater had a choice: say nothing or trust her instincts and speak up... She chose the latter.
10,Arsenal 'hurt and empty' but proud of defying odds,/sport/football/65452423,Football,"Despite Arsenal's last-gasp Women's Champions League semi-final defeat by Wolfsburg, there was a sense of immense pride for manager Jonas Eidevall."
11,Explore in 3D: The dazzling crown that makes a king,https://www.bbc.co.uk/news/resources/idt-5136bea2-40b8-45bf-83be-e06babcbc2bf,UK,The crown will be worn for less than an hour and then stored until the coronation of the next monarch
12,Your full guide to how coronation day will unfold,https://www.bbc.com/news/uk-65342840,UK,"Processions, ancient rituals, a fly-past and the crowning moment - the key stages of King Charles III's coronation"
13,How coronation food reflects the times,https://www.bbc.com/travel/article/20230430-coronation-cuisine-the-food-fit-for-royalty,World's Table,"It has a history stretching back more than 1,000 years"
14,The ancient trick that will help you make better decisions,/reel/video/p0fg233t/the-ancient-trick-that-will-help-you-make-better-decisions,,
15,The Nazi's secret underground stash of stolen treasure,/reel/video/p0fjpb2b/the-old-salt-mine-where-nazis-hid-stolen-art,,
16,How Norway's princess stirred a controversy,/reel/video/p0fjyx6s/exclusive-interview-with-princess-m-rtha-louise-of-norway,,
17,A history of art in 7 colours,https://www.bbc.com/culture/article/20230428-a-history-of-art-in-7-colours,Culture,From Picasso and Hokusai's Prussian Blue to Vermeer's shade of red
18,The hidden power of the coronation,https://www.bbc.com/future/article/20230428-the-surprising-power-of-pomp-and-ceremony,Future,The pomp and ceremony of a state ritual can act as a social glue
19,A guide to afternoon tea in London,https://www.bbc.com/travel/article/20230430-where-to-have-afternoon-tea-in-london,Travel,"Advice from an ""international tea expert"""
20,How are mums working without childcare?,https://www.bbc.com/worklife/article/20230426-the-mothers-working-from-home-without-childcare,Worklife,"Even as many kids have returned to care, not every mother has the help she needs"
21,Banana artwork in Seoul museum eaten by visitor,https://www.bbc.com/news/world-asia-65446331,Asia,A university student told staff he ate the fruit on display because he was hungry
22,Trevelyan relative would consider famine payment,https://www.bbc.com/news/uk-northern-ireland-65440287,Northern Ireland,"An ex-BBC journalist says her ancestor, referenced in the Fields of Athenry, failed Irish people"
23,Cat steals hundreds of pounds of items from homes,https://www.bbc.com/news/uk-england-derbyshire-65424870,UK,"Harry has stolen items including underwear, a purse and even a designer shoe"
24,The revival of a historic Italian fruit,/future/article/20230424-how-agrivoltaics-helped-save-italys-citron-and-lemon-trees,,
25,The first climate-resilient nation?,/future/article/20230418-how-caribbean-island-dominica-is-fighting-climate-impacts,,
26,A major positive climate tipping point,/future/article/20230414-climate-change-why-2023-is-a-clean-energy-milestone,,
27,US rock band Aerosmith announce farewell tour,/news/entertainment-arts-65447052,Entertainment & Arts,"Steven Tyler and co will say ""peace out"" to North America from later this year."
28,ChatGPT accessible again in Italy,/news/technology-65431914,Technology,
29,Riding the 'vomit comet' with first disabled astronaut,/news/science-environment-65380263,Science & Environment,
30,Sudanese NHS doctor finally allowed to return to UK,/news/uk-65423219,UK,
31,Parasols and prayers: Africa's top shots,/news/world-africa-65409697,Africa,
32,WHO issues alert over another India-made cough syrup,/news/world-asia-india-65395716,India,
33,Why there is serious money in kitchen fumes,https://www.bbc.co.uk/news/business-65328579,Business,
34,The photos that chronicle the cost of dying,/news/uk-scotland-65354687,Scotland,
35,Len Goodman obituary: From the East End to Strictly stardom,/news/entertainment-arts-58929590,Entertainment & Arts,
36,Penarth: Nofio gyda'r wawr yn y môr // Sea swimming at dawn,/newyddion/65372997,Cylchgrawn,
37,In pictures: Muslims around the world celebrate Eid,/news/in-pictures-65346964,In Pictures,
38,Garlands and gymnasts: Africa's top shots,/news/world-africa-65334211,Africa,
