,title,href,tag,summary
0,More than 250 bodies found at site of Israeli Supernova festival - rescuers,/news/live/world-middle-east-67037895,Middle East,The victims are among at least 700 people killed on the Israeli side - with more than 400 also dead in Gaza.
1,'Nobody could help us' - Shock and anger in Israel's Ashkelon,https://www.bbc.com/news/world-middle-east-67048672,Middle East,
2,US moves warships closer to Israel after Hamas attack,https://www.bbc.com/news/world-us-canada-67049196,US,
3,Fiji lose to Portugal but advance to England match,https://www.bbc.com/sport/rugby-union/66994397,Rugby Union,
4,A sacred pole stolen by the British,https://www.bbc.com/travel/article/20231008-the-canadian-museum-filled-with-stolen-art,Travel,
5,Blast in Gaza halts BBC journalist's live report,/news/world-middle-east-67050445,Middle East,Rushdi Abu Alouf was speaking to the BBC News Channel when a loud explosion was heard.
6,Israeli forces fight to drive out Hamas militants,/news/world-middle-east-67045138,Middle East,"Troops try to clear gunmen from several areas, as the Israeli death toll reportedly passes 600."
7,Race to rescue victims from Afghan earthquake,/news/world-asia-67047203,Asia,"More than 1,000 are feared dead after the 6.3-magnitude quake hit remote villages in western Afghanistan."
8,Barcelona fight back as teenager Yamal sets record,/sport/football/67048156,European Football,Teenager Lamine Yamal becomes the youngest goalscorer in La Liga history as Barcelona fight back from two goals down to earn a point against Granada.
9,'Man City win could be Arteta's most significant yet',/sport/football/67049621,Football,"Arsenal's win against Manchester City could be one of the most significant moments in Mikel Arteta's career if it has the galvanising impact it should have, writes Phil McNulty."
10,Verstappen wins in Qatar as Hamilton and Russell collide,/sport/formula1/67048883,Formula 1,Mercedes drivers Lewis Hamilton and George Russell collided at the start before Max Verstappen went on to dominate the Qatar Grand Prix.
11,From the Holy Grail to UFOs: Spain’s mountain of mysteries,/reel/video/p0gjyscs/from-the-holy-grail-to-ufos-spain-s-mountain-of-mysteries,,
12,"The lab growing 225,000 carats of diamond per month",/reel/video/p0gjlpbh/inside-india-s-lab-grown-diamond-industry,,
13,The scandalous life of a 'dashing and unreliable' king,/reel/video/p0gjd5xk/the-scandalous-life-of-a-dashing-and-unreliable-king,,
14,What Swedish reality TV can teach us,https://www.bbc.com/culture/article/20231006-what-swedish-reality-tv-can-teach-us,Culture,Can watching relationship-based reality TV help viewers' own relationships?
15,The bird that sparked a mass clean-up,https://www.bbc.com/future/article/20231002-the-photo-of-the-deepwater-horizon-bird-that-shocked-the-world,Future,The symbol of the worst US environmental disaster
16,The small shops that run NYC,https://www.bbc.com/travel/article/20231005-bodegas-the-small-corner-shops-that-run-nyc,Travel,"Roughly 7,000 of these beloved institutions dot the city"
17,The sneaky trend hurting finances,https://www.bbc.com/worklife/article/20231003-skimpflation-an-even-sneakier-form-of-shrinkflation,Worklife,You're getting fewer services for your money – but you might not even notice
18,How did Israeli intelligence fail to stop major attack?,https://www.bbc.com/news/world-middle-east-67040221,Middle East,Israeli officials tell BBC an investigation into Gaza's surprise attack will go on for years
19,Picasso painting displayed in London to fetch £98m,https://www.bbc.com/news/uk-england-london-67039334,London,"Picasso's masterpiece, Femme A La Montre, depicts his ""golden muse"" Marie-Therese Walter"
20,Teenagers' inner secrets laid bare for stage show,https://www.bbc.com/news/entertainment-arts-66994571,Entertainment & Arts,Hundreds of people allow their secrets - from the harmless to the serious - to be aired in public
21,"A 2,000-year-old method to water crops",/future/article/20230922-the-ancient-sri-lankan-tank-cascade-systems-tackling-drought,,
22,The goats fighting fires in LA,/future/article/20230922-these-la-goats-help-stop-wildfires,,
23,The city that went green to keep cool,/future/article/20230922-how-medellin-is-beating-the-heat-with-green-corridors,,
24,Regulator sues Musk to force testimony in X probe,/news/business-67024538,Business,"Musk accused the Securities and Exchange Commission of ""harassment"" in the two sides' latest battle."
25,'Playing Savile has the potential for catastrophic failure',/news/entertainment-arts-66987497,Entertainment & Arts,
26,Record surge in days over key 1.5C warming limit,/news/science-environment-66857354,Science & Environment,
27,The hunt for a new way to tackle clothing waste,https://www.bbc.co.uk/news/business-66985595,Business,
28,Film director Terence Davies dies aged 77,/news/entertainment-arts-67041682,Entertainment & Arts,
29,"Fashion, football and frontline politics: Photos of the week",/news/in-pictures-67029261,In Pictures,
30,Children in hospital after eating cannabis sweets,/news/world-latin-america-66991933,Latin America & Caribbean,
31,"Stars, bars and beans: Africa’s top shots",/news/world-africa-67017528,Africa,
32,"Bears, birds and kangaroos: Comedy Wildlife Photo Awards",/news/in-pictures-67004896,In Pictures,
33,Sir Michael Gambon: A career in pictures,/news/in-pictures-66950664,In Pictures,
34,Vintage style and bonfires: Africa’s top shots,/news/world-africa-66947006,Africa,
35,In pictures: Storm Agnes sweeps across Scotland,/news/uk-scotland-66947142,Scotland,
