,title,href,tag,summary
0,Taliban 'carrying out door-to-door manhunt',/news/live/world-asia-58219963,Asia,"Militants are searching for government employees and those who worked with US forces, the BBC is told."
1,Child handed over wall amid more Kabul airport chaos,/news/world-asia-58267756,Asia,
2,How vaccine mandates became a Canada election issue,/news/world-us-canada-58264006,US & Canada,
3,Much-changed Spurs lose in Portugal,/sport/football/58257076,European Football,
4,"Covid-19: US state quarantines 20,000 pupils",/news/world-us-canada-58272083,US & Canada,
5,Soldier faces jail over feeding troops pot cupcakes,/news/world-us-canada-58176125,US & Canada,A Canadian bombardier fed cannabis cakes to troops during a drill involving guns and live ammunition.
6,Anger as Kidman reportedly avoids quarantine rules,/news/world-asia-58270417,Asia,Hong Kong media say the Australian star was seen out and about in the city two days after arriving.
7,Afghan footballer falls to death from US plane,/news/world-asia-58272740,Asia,"Zaki Anwari, 19, had played for Afghanistan's national youth team before trying to flee the country."
8,Mourinho's Roma beat Trabzonspor,/sport/football/58275962,European Football,Jose Mourinho's spell as Roma boss starts with a win at Turkish side Trabzonspor in the Europa Conference League play-off.
9,Man Utd great Law diagnosed with dementia,/sport/football/58268041,Football,Scotland legend and former Manchester United forward Denis Law is diagnosed with dementia.
10,No decision on Messi PSG debut,/sport/football/58272543,European Football,Paris St-Germain have yet to decide if Lionel Messi will make his much-anticipated debut in Friday's Ligue 1 game at Brest.
11,"Drugs, violence, sex and love in one of the world's most dangerous slums",/reel/video/p09q955p/a-tale-of-survival-in-belo-horizonte-s-most-dangerous-slums,,
12,Four simple hacks to succeed in every conversation,/reel/video/p098mgm9/four-simple-hacks-to-succeed-in-every-conversation,,
13,The Nordic recipe for a perfect housewife,/reel/video/p09q5pqm/the-nordic-school-that-creates-the-perfect-housewife,,
14,13 unmissable new documentaries to watch,https://www.bbc.com/culture/article/20210816-longshots-13-films-to-stream-from-bbcs-online-film-festival,LongShots,"Watch films that make our hearts jump, catch us by surprise and spark fresh ideas"
15,The Bahamas' queen of Junkanoo,https://www.bbc.com/travel/article/20210818-the-bahamas-queen-of-junkanoo,Travel,"""It was not something that 'good' people did in those days"""
16,What 'sex positivity' really means,https://www.bbc.com/worklife/article/20210818-what-does-sex-positivity-mean,Worklife,"'Sex positivity' has become a buzzword, but what does it mean?"
17,Objects revealing the roots of writing,https://www.bbc.com/culture/article/20210818-epic-iran-ancient-objects-that-reveal-writings-roots,Culture,How some of the world's earliest scripts developed
18,The hand gestures that never die,https://www.bbc.com/future/article/20210818-the-hand-gestures-that-last-longer-than-spoken-languages,Future,There are few universal signs that everyone agrees on.
19,'My son left to help a region he loves. They burned him alive',https://www.bbc.com/news/world-africa-58260855,Africa,"When Djamel Ben Ismail went to fight forest fires in Algeria, his life was cut short by a raging mob"
20,The little-known human stories behind emoji,https://www.bbc.com/news/technology-58180556,Technology,The story of how tiny characters ended up on billions of smartphone keyboards
21,The controversial plan to rewild death,/future/article/20210817-rewilding-death-germanys-plan-to-restore-the-necrobiome,,
22,The ancient Persian way to keep cool,/future/article/20210810-the-ancient-persian-way-to-keep-cool,,
23,The vast methane leaks seen from space,/future/article/20210805-the-search-for-the-worlds-largest-methane-sources,,
24,A look back at the 80s 'video nasty' era,https://www.bbc.com/news/entertainment-arts-58246426,Entertainment & Arts,Censor delves into the impact of horror movies during the era in the UK
25,Baby bats babble like humans,/news/science-environment-58271913,Science & Environment,
26,Facebook removes abusive comments on Lizzo's pages,/news/entertainment-arts-58267704,Entertainment & Arts,
27,US plans to offer booster Covid jabs in September,/news/health-58261590,Health,
28,Puzzles and food posts are Facebook's most-viewed,/news/technology-58270497,Technology,
29,Rattlesnakes' sound ‘trick’ fools human ears,/news/science-environment-58270599,Science & Environment,
30,IMF suspends Afghanistan's access to funds,/news/business-58263525,Business,
31,In pictures: Desperate search after Haiti quake,/news/in-pictures-58258287,In Pictures,
32,Striking image captures Afghan exodus,/news/world-asia-58242733,Asia,
33,In pictures: Huge wildfire near Jerusalem,/news/world-middle-east-58243631,Middle East,
34,In pictures: Kabul - a day after Taliban takeover,/news/in-pictures-58225117,In Pictures,
35,War illustrator describes Afghanistan sadness,/news/uk-wales-58233157,Wales,
