,title,href,tag,summary
0,"Queen had 'great affection' for Northern Ireland, says King",/news/live/uk-62866826,UK,The new King and the Queen Consort greeted crowds at Hillsborough Castle before meeting political leaders.
1,The quiet symbolism of the Queen's farewell to Scotland,https://www.bbc.com/news/uk-62887703,UK,
2,$1m coin returned to Israel after 15-year hunt,https://www.bbc.com/news/world-middle-east-62875673,Middle East,
3,Four cities saying no to cars,https://www.bbc.com/travel/article/20220912-four-health-conscious-cities-putting-pedestrians-first,Travel,
4,Rapper PnB Rock shot dead in LA,https://www.bbc.com/news/newsbeat-62888207,Newsbeat,
5,"Ukraine retook 6,000 sq km this month - Zelensky",/news/world-europe-62884668,Europe,President Volodymyr Zelensky says the gains were made in the east and south during a swift counter-offensive.
6,Will Ukraine's advance have consequences for Putin?,/news/world-europe-62879367,Europe,"Questions are being asked as even state media reported the ""tough"" week, says the BBC's Russia editor."
7,Lower petrol prices help to slow US inflation,/news/business-62884288,Business,"Inflation slips to 8.3%, but non-fuel costs continue to climb, putting pressure on the White House."
8,Champions League build-up & news conferences,/sport/live/football/62888247,Football,"Liverpool host Ajax in their first game since their humbling at Napoli, Tottenham head to Sporting Lisbon while Pep Guardiola and Graham Potter speak to the media."
9,Joshua 'accepts Fury's terms' for December fight,/sport/boxing/62889501,Boxing,"Anthony Joshua has accepted WBC champion Tyson Fury's terms for an all-British heavyweight fight in December and is awaiting a response, his management company has said."
10,England have better chance of Ashes win - Agnew,/sport/cricket/62879746,Cricket,"Ben Stokes' captaincy this summer has already given England a better chance of winning the Ashes next year, says BBC cricket correspondent Jonathan Agnew."
11,What next? A day-by-day guide from now to the funeral,https://www.bbc.com/news/uk-62861617,UK,The Queen's coffin will lie in state in Westminster Hall as King Charles III embarks on a trip around the UK
12,Taking last photos of the Queen was 'an honour',https://www.bbc.com/news/uk-england-derbyshire-62877095,UK,Jane Barlow photographed the Queen two days before she died
13,Plans for the Queen's lying-in-state,https://www.bbc.com/news/uk-62878294,UK,Here's what we know about plans for the public viewing of the Queen's coffin
14,The otherwordly powers of the African Joan of Arc,/reel/video/p0crc8x5/longshots-seeking-aline,,
15,Two young women's thoughts on love and lust,/reel/video/p0crbs6v/longshots-in-this-moment,,
16,A surprising South Korean take on time travel,/reel/video/p0cr79tm/longshots-i-bought-a-time-machine,,
17,Is power returning to employers?,https://www.bbc.com/worklife/article/20220912-where-the-boss-worker-power-struggle-goes-next,Worklife,How a downturn could affect the ongoing tug of war between bosses and workers
18,Are Europe's rivers drying up?,https://www.bbc.com/future/article/20220912-are-drying-rivers-a-warning-of-europes-tomorrow,Future,A spectre of long droughts and a new normal
19,The Japanese craft that helps us heal,https://www.bbc.com/culture/article/20220822-why-we-are-drawn-to-mending-things,Culture,Why mending objects can have a restorative effect on us
20,The US' notorious border dispute,https://www.bbc.com/travel/article/20220911-the-us-island-that-nearly-ignited-a-war,Travel,The diplomatic crisis was ignited by the death of a pig
21,Blondie's eccentric trip to Cuba,https://www.bbc.com/reel/video/p0cz1brc/one-way-or-another-blondie-made-it-to-cuba,LongShots,Director Rob Roth shares details of his trip to Havana with Blondie lead singer Debbie Harry
22,What did archaeologists discover? Our timed quiz...,https://www.bbc.com/news/world-us-canada-62877800,US,"Test your knowledge of the news - 10 questions, 10 seconds each"
23,Nine things about the man who changed cinema,https://www.bbc.com/news/entertainment-arts-46709681,Entertainment & Arts,"Jean-Luc Godard, who has died aged 91, was one of the most influential directors"
24,Why Auckland is the 'spongiest' city,/future/article/20220823-how-auckland-worlds-most-spongy-city-tackles-floods,,
25,The elephant buses safeguarding kids,/future/article/20220816-the-botswana-buses-tackling-human-elephant-conflict,,
26,The crab invading the Mediterranean,/future/article/20220809-how-the-mediterranean-became-the-worlds-most-invaded-sea,,
27,Director Jean-Luc Godard dies by assisted suicide,/news/entertainment-arts-62886470,Entertainment & Arts,The New Wave director rewrote cinema's rules and influenced film-makers from Scorsese to Tarantino.
28,China Covid lockdowns leave residents short of food,/news/world-asia-china-62830326,China,
29,Japan may relax travel restrictions to boost yen,/news/business-62873518,Business,
30,Why the rise of AI art stirs fierce debate,/news/technology-62788725,Technology,
31,Squid Game star makes history at the Emmys,/news/entertainment-arts-62796137,Entertainment & Arts,
32,Apple reveals iPhone 14 Pro and Watch Ultra,/news/technology-62827774,Technology,
33,Bezos rocket malfunctions on trip to space,/news/science-environment-62882272,Science & Environment,
34,In pictures: King Charles in Scotland and Westminster Hall,/news/in-pictures-62876296,In Pictures,
35,In pictures: Queen's journey from Balmoral to Edinburgh,/news/in-pictures-62868466,In Pictures,
36,Queen Elizabeth II: A life in pictures,/news/in-pictures-61645231,In Pictures,
37,In pictures: Royals view tributes as Charles proclaimed King,/news/in-pictures-62864071,In Pictures,
38,Pictured: Sydney darkens opera house as world mourns,/news/world-us-canada-62841762,US & Canada,
