,title,href,tag,summary
0,Rwanda asylum flight cancelled after legal action,/news/uk-61806383,UK,Up to seven people had been expected to be removed to the east African country on Tuesday evening.
1,Top UK-based journalists barred from Russia,/news/world-europe-61796070,Europe,
2,Biden to visit Middle East allies amid strains,/news/world-middle-east-61803192,Middle East,
3,Denmark and Canada reach deal to end 'Whisky Wars',/news/world-europe-61801682,Europe,
4,"Win is my greatest ever, says England's Stokes",/sport/cricket/61801525,Cricket,
5,"Happy the elephant is not a person, US court rules",/news/world-us-canada-61803958,US & Canada,An animal rights group was seeking legal means to have the elephant moved from a zoo to a sanctuary.
6,Russia extends US basketball star's detention again,/news/world-us-canada-61803959,US & Canada,"The US state department says Brittney Griner should not be held ""for a single day longer""."
7,US aircrew cleared in deadly flight from Kabul,/news/world-us-canada-61799998,US & Canada,An Afghan footballer fell to his death after trying to stow away on a plane during the US withdrawal.
8,Liverpool complete Nunez signing for initial £64m,/sport/football/61742358,Football,Liverpool complete the signing of Uruguay striker Darwin Nunez from Portuguese side Benfica on a six-year-deal for an initial £64m.
9,'Southgate's experiment fails as England falter',/sport/football/61806441,Football,England end the night in the history books for the wrong reasons as Gareth Southgate's Nations League experiment fails against Hungary.
10,Scotland with 'work to do' despite Armenia boost,/sport/football/61800345,Football,Scotland head coach Steve Clarke admitted two wins against Armenia does not make up for bruising defeats by Ukraine and Ireland. So how are his side placed after this international window?
11,The medieval 'ghost town' frozen in time,/reel/video/p0cdpdns/the-spanish-ghost-town-that-should-be-underwater,,
12,The idyllic lake coveted by Nazis and communists alike,/reel/video/p0ccs88s/a-remote-lake-with-a-history-of-intrigues,,
13,How exercising doesn't mean you burn calories,/reel/video/p09wk29n/how-exercising-doesn-t-mean-you-burn-calories,,
14,When it's too dangerous to go to work,https://www.bbc.com/worklife/article/20220614-the-immunocompromised-workers-being-left-behind,Worklife,"For one group of workers, there are no good choices as office returns loom"
15,Why top chefs are leaving Paris,https://www.bbc.com/travel/article/20220614-the-exodus-of-paris-chefs-to-the-countryside,Travel,"""It started before Covid, but it was discreet"""
16,The AI voices perpetuating sexism,https://www.bbc.com/future/article/20220614-why-your-voice-assistant-might-be-sexist,Future,Should AI voices be genderless?
17,Inside Kate Bush's alternate universe,https://www.bbc.com/culture/article/20220614-inside-kate-bushs-alternate-universe,Culture,Why the enigmatic star's mystical songs are being constantly re-purposed
18,Huge plan to map DNA of all life in British Isles,https://www.bbc.com/news/science-environment-61747729,Science & Environment,Scientists are planning to sequence the genomes of all species found in Britain and Ireland
19,Lizzo changes derogatory lyric after backlash,https://www.bbc.com/news/entertainment-arts-61794502,Entertainment & Arts,The pop star had been criticised by disability advocates over her latest single
20,Return of Bashir loyalists raises Sudan alarm,https://www.bbc.com/news/world-africa-61550100,Africa,Authoritarian leader Omar al-Bashir was ousted three years ago
21,The English town that welcomed the dark,/future/article/20220614-the-crusade-for-darker-night-skies,,
22,Could we live without plastic?,/future/article/20220526-what-would-happen-if-we-stopped-using-plastic,,
23,Predicting famine before it strikes,/future/article/20220525-how-scientists-predict-famine-before-it-hits,,
24,Instagram launches new parental controls in UK,/news/technology-61796149,Technology,Facebook owner Meta is rolling out new parental controls for Instagram and its VR platforms.
25,'Don't treat your business like your baby',https://www.bbc.co.uk/news/av/business-61792300,Business,
26,Critics divided on Toy Story spin-off Lightyear,/news/entertainment-arts-61797198,Entertainment & Arts,
27,"Don't buy a bulldog until breed reshaped, vets ask",/news/science-environment-61799718,Science & Environment,
28,Dozens of Covid cases linked to Beijing bar,/news/world-asia-china-61777304,China,
29,Fossil fuel rush amid Ukraine war 'delusional': UN,/news/science-environment-61786545,Science & Environment,
30,Kate Bush heading to number one after chart change,/news/entertainment-arts-61797012,Entertainment & Arts,
31,'You can be visually impaired and artistic',/news/uk-england-norfolk-61530561,Norfolk,
32,Africa's top shots: Surfing stars and mellow mermaids,/news/world-africa-61745017,Africa,
33,In pictures: Platinum Jubilee pageant,/news/uk-61698428,UK,
34,In pictures: Stars throw party for Jubilee,/news/entertainment-arts-61693645,Entertainment & Arts,
35,In pictures: Street parties and celebrations,/news/in-pictures-61689516,In Pictures,
