,title,href,tag,summary
0,Thousands of JFK assassination records released,/news/world-us-canada-63994729,US & Canada,"The CIA reiterates it ""never engaged"" the alleged assassin, Lee Harvey Oswald, as over 13,000 files go online."
1,Powerful US storm brings 'catastrophic damage',/news/world-us-canada-63989303,US & Canada,
2,What US Patriot missiles would mean for Ukraine,/news/world-us-canada-63994648,US & Canada,
3,US brings back free at-home Covid tests,/news/world-us-canada-63990173,US & Canada,
4,The 50 best books of the year,https://www.bbc.com/culture/article/20220407-the-best-books-of-the-year-2022,Culture,
5,Immigrants' daughter is first black head of Harvard,/news/world-us-canada-63990177,US & Canada,Dr Claudine Gay is also the second woman to lead the elite Massachusetts college.
6,Can nostalgia save a famous discount store?,/news/world-us-canada-63924365,US & Canada,"Zellers, an iconic but failed retail chain, will soon be revived. Can nostalgia rejuvenate the brand?"
7,Deadly attack leaves whole of Kherson without power,/news/world-europe-63983730,Europe,Heavy shelling of critical infrastructure knocks out the power supply to the entire Ukrainian port.
8,Arsenal qualification marred by Miedema injury,/sport/football/63976971,Football,Arsenal are through to the quarter-finals of the Women's Champions League despite losing to holders Lyon in a match marred by an injury to striker Vivianne Miedema.
9,'Spectacular' Alvarez proving key for Argentina,/sport/football/63970188,Football,"Argentina captain Lionel Messi describes team-mate Julian Alvarez a ""spectacular"" and ""extraordinary"" after his World Cup semi-final double."
10,Bolt wins BBC Lifetime Achievement award,/sport/sports-personality/63971257,Sports Personality,Athletics legend Usain Bolt is awarded the Lifetime Achievement award at BBC Sports Personality of the Year 2022.
11,Hikikomori: Why Japan's extreme social withdrawl is a global phenomenon,/reel/video/p0dj0n68/hikikomori-what-drives-us-to-withdraw-from-society-,,
12,The dark history of the world's most controversial diamond,/reel/video/p0dp2x1q/kohinoor-the-cursed-diamond-set-into-the-crown-jewels,,
13,The surprising physics behind Brazilian Jiu-Jitsu,/reel/video/p0dmlcgl/the-surprising-physics-behind-brazilian-jiu-jitsu,,
14,A crispy 13th-Century holiday doughnut,https://www.bbc.com/travel/article/20221215-isfeng-a-crispy-doughnut-from-al-andalus-for-hanukkah,Travel,It can be found in the Iberian Peninsula's oldest cookbook
15,The silent struggles of ADHD workers,https://www.bbc.com/worklife/article/20221209-the-silent-struggles-of-workers-with-adhd,Worklife,Neurodiverse workers can find themselves judged and often lack help they need
16,Avatar 2 is a 'damp squib',https://www.bbc.com/culture/article/20221213-avatar-the-way-of-water-is-a-damp-squib,Culture,James Cameron's sequel is vapid and slow
17,Time to end Santa's 'naughty list'?,https://www.bbc.com/future/article/20221124-should-you-tell-your-child-the-truth-about-santa,Future,The ethical dilemma around a much-loved figure
18,TikTok tests landscape videos in major shake-up,https://www.bbc.com/news/business-63981657,Business,The world's fastest-growing social media platform has become known globally for its vertical format
19,Jack Sparrow message for terminally ill boy,https://www.bbc.com/news/uk-england-derbyshire-63971424,UK,Johnny Depp fulfils the final wish of a boy who has decided not to have a third heart transplant
20,'My boss made me wash the men's towels at my office',https://www.bbc.com/news/world-asia-63905490,Asia,"Seoul is abolishing its equality ministry, despite a vast gender pay gap and pervasive sexism"
21,In defence of real Christmas trees,/future/article/20221213-why-christmas-trees-may-be-good-for-the-environment,,
22,What would a green World Cup look like?,/future/article/20221206-what-would-a-green-world-cup-look-like,,
23,The Alpine villages powered by streams,/future/article/20221129-the-alpine-villages-producing-their-own-power,,
24,Io volcano world comes into view of Juno probe,/news/science-environment-63982190,Science & Environment,"A Nasa spacecraft will be making ever closer encounters with Jupiter's hellish, lava-strewn moon."
25,Ofcom report shows growing 5G coverage,/news/technology-63974085,Technology,
26,Newborns to get rapid genetic disease diagnosis,/news/health-63906892,Health,
27,William screamed at me in royal meeting - Harry,/news/uk-63983062,UK,
28,Breakthrough in nuclear fusion energy announced,/news/science-environment-63950962,Science & Environment,
29,Fed hikes rates again and warns of more rises,/news/business-63977120,Business,
30,Revolutionary therapy clears girl's incurable cancer,/news/health-63859184,Health,
31,Row over festivity divides Afro-Colombian town,/news/world-latin-america-63895510,Latin America & Caribbean,
32,In pictures: Snow blankets parts of the UK,/news/in-pictures-63942122,In Pictures,
33,In pictures: Hundreds gather for Maasai Olympics,/news/world-africa-63932225,Africa,
34,Celebrated photographer remembered,https://www.bbc.co.uk/news/articles/cjjq83w8vpgo,News,
35,"Africa's top shots: Afro puffs, icons and ballerinas",/news/world-africa-63902414,Africa,
