,title,href,tag,summary
0,Work with us on forests - Amazon communities,/news/live/world-59125188,World,"As a major deforestation pledge is signed in Glasgow, indigenous groups in the Amazon say they need to be directly involved."
1,Thunberg tells protest politicians are pretending,https://www.bbc.com/news/uk-scotland-glasgow-west-59116611,UK,
2,The city where you can't serve meat,https://www.bbc.com/travel/article/20211101-varanasi-where-its-forbidden-to-serve-meat,Travel,
3,Are meeting-free workers happier?,https://www.bbc.com/worklife/article/20211101-does-banning-meetings-help-workers-get-back-their-time,Worklife,
4,Who entered rock's Hall of Fame? Take our timed quiz,https://www.bbc.com/news/world-us-canada-59121470,US,
5,World leaders promise to end deforestation by 2030,/news/science-environment-59088498,Science & Environment,"More than 100 nations - including Brazil, Russia and Indonesia - sign COP26's first major deal."
6,Cognitive behavioural therapy pioneer dies at 100,/news/world-us-canada-59124427,US & Canada,Dr Aaron Beck's work is considered revolutionary worldwide for the treatment of mental health.
7,South Asians react to Kal Penn coming out as gay,/news/world-us-canada-59122928,US & Canada,The actor revealed he is now engaged to a man he has been in a relationship with for 11 years.
8,"Spurs appoint Conte, Newcastle want Emery & Champions League news conferences",/sport/live/football/59130760,Football,"Tottenham appoint Antonio Conte, Unai Emery favourite for Newcastle job, plus Champions League build-up."
9,Conte named new Tottenham manager,/sport/football/59123988,Football,Tottenham name former Chelsea boss Antonio Conte as their new manager on a contract until summer 2023.
10,Newcastle want swift Emery appointment,/sport/football/59131790,Football,Villarreal head coach Unai Emery is the leading candidate to take over as Newcastle manager.
11,Lördagsgodis: The Swedish tradition with a dark past,/reel/video/p0b1ks66/l-rdagsgodis-why-swedes-only-eat-sweets-on-saturdays,,
12,The unexpected industry that could rescue the planet,/reel/video/p0b0mmcf/can-a-transfarmation-save-the-climate-,,
13,The physics that explains why we cannot go faster than light,/reel/video/p04v97r0/this-video-explains-why-we-cannot-go-faster-than-light,,
14,How we can adapt plants to save our planet,https://www.bbc.com/future/bespoke/follow-the-food/how-we-can-adapt-plants-to-save-our-planet.html,Follow The Food,Plants hold the key to removing atmospheric carbon dioxide
15,Why Hogarth is the UK's greatest artist,https://www.bbc.com/culture/article/20211020-why-william-hogarth-is-britains-greatest-artist,Culture,How the pioneering satirist has gone on to influence generations
16,The village that tamed a 100ft wave,https://www.bbc.com/travel/article/20211031-how-a-portuguese-fishing-village-tamed-a-100ft-wave,Travel,The skyscraper-sized waves are caused by Europe's largest underwater canyon
17,Why 'net-zero carbon' may not be enough,https://www.bbc.com/future/article/20211028-why-not-all-net-zero-emissions-targets-are-equal,Future,Not all net zero carbon targets are equal
18,Penalised for showing emotion at work?,https://www.bbc.com/worklife/article/20211029-the-people-penalised-for-expressing-feelings-at-work,Worklife,Why not all displays of feelings in the workplace are treated equally
19,The data revolutionary who exposed baseball's big fix,https://www.bbc.com/sport/baseball/59078788,Sport,The World Series was rigged and Hugh Fullerton's revolutionary analysis backed it up
20,Squid Game crypto token collapses in apparent scam,https://www.bbc.com/news/business-59129466,Business,"Inspired by the hugely popular Netflix series Squid Game, the tokens had rocketed in value"
21,The ancient Persian way to keep cool,/future/article/20210810-the-ancient-persian-way-to-keep-cool,,
22,California's last-chance butterfly lab,/future/article/20211013-the-race-to-save-californias-endangered-butterflies,,
23,The unexpected benefits of tiger sharks,/future/article/20211007-why-sharks-help-fight-climate-change-in-the-oceans,,
24,US to tackle methane leaks from oil and gas wells,/news/world-us-canada-59131282,US & Canada,The Biden administration plans to restore tough rules curbing one of the most potent greenhouse...
25,Terry Gilliam show cancelled by Old Vic,/news/59127144,Entertainment & Arts,
26,Chinese version of Fortnite to close in November,/news/technology-59121165,Technology,
27,Yahoo joins tech firm exodus from China,/news/technology-59136937,Technology,
28,Covid deaths pass five million worldwide,/news/world-59119731,World,
29,"Act now for our children, Queen urges leaders",/news/uk-59125350,UK,
30,Carole Baskin sues Netflix over unagreed footage,/news/entertainment-arts-59132315,Entertainment & Arts,
31,In pictures: Scotland's young climate activists,/news/uk-scotland-59109736,Scotland,
32,In pictures: Leaders gather for COP26,/news/in-pictures-59118673,In Pictures,
33,"Flowers, fruit and bakes compete for best in show",/news/in-pictures-59050515,In Pictures,
34,"Africa's top shots: Prizes, loot and a rescued lion",/news/world-africa-59075237,Africa,
35,Close-up of gull eye wins major photography prize,/news/uk-scotland-north-east-orkney-shetland-59054453,"NE Scotland, Orkney & Shetland",
