,title,href,tag,summary
0,US Supreme Court preserves abortion drug access,/news/world-us-canada-65356390,US & Canada,"In a split decision, it also rejects restrictions on mifepristone, maintaining the status quo."
1,Paris synagogue bomber convicted after 43 years,/news/world-europe-65347584,Europe,
2,A vibrant city suffers: Uncovering Khartoum's civilian crisis,https://www.bbc.co.uk/news/world-africa-65338181,News,
3,Canada's latest gold heist was far from the first,/news/world-us-canada-65350126,US & Canada,
4,Title-chasing Arsenal salvage point against Saints,/sport/football/65271717,Football,
5,'Be a man' ad campaign tells Russians to join army,/news/world-europe-65351271,Europe,The campaign comes as Russian armed forces apparently suffer heavy losses in Ukraine.
6,Baldwin to be sued by family of Halyna Hutchins,/news/entertainment-arts-65355387,Entertainment & Arts,"Lawyers for her parents and sister say the Rust actor ""cannot escape responsibility"" for her death."
7,The $5m 'Prove Mike Wrong' challenge that backfired,/news/world-us-canada-65350125,US & Canada,The My Pillow boss challenged people to prove his data wrong. A software expert did exactly that.
8,Mbappe scores twice as PSG move closer to title,/sport/football/65356169,European Football,Kylian Mbappe scores twice as Paris St-Germain beat bottom side Angers to move a step closer to a record 11th Ligue 1 title.
9,Five NFL players banned for gambling violations,/sport/american-football/65354787,American Football,"Five NFL players, including 2022 first-round pick Jameson Williams, are banned for violating gambling policy."
10,England captain Williamson to miss World Cup,/sport/football/65349115,Football,England captain Leah Williamson will miss this summer's World Cup with an anterior cruciate ligament injury.
11,The family secrets kept for generations,https://www.bbc.com/future/article/20230417-how-secrets-affect-families,Future,Many families have a hidden past that they never speak about
12,Britain's 'cool' new seaside towns,https://www.bbc.com/travel/article/20230416-a-new-life-for-britains-seaside-towns,Travel,Visitors now come for visual arts rather than jellied eels
13,The fading glamour of hustle culture,https://www.bbc.com/worklife/article/20230417-hustle-culture-is-this-the-end-of-rise-and-grind,Worklife,"For some workers, the rise-and-grind narrative feels outdated and out of touch"
14,A rare look at Queen Elizabeth's private life,/reel/video/p0fhwsbh/a-rare-look-at-queen-elizabeth-s-private-life,,
15,The surprising truth about drinking milk,/reel/video/p0d47mjl/the-truth-about-drinking-raw-milk,,
16,The radical sex lives of America’s 19th Century ‘Bible communists’,/reel/video/p08sbbn2/oneida-the-free-love-utopia-that-chased-immortality,,
17,Earth Day: 11 photos of the 'new Big 5',https://www.bbc.com/culture/article/20230421-earth-day-and-the-new-big-5-11-photos-of-vanishing-wildlife,Culture,How a violent practice rooted in colonialism is being subverted
18,Why you should never add ginger to sushi,https://www.bbc.com/travel/article/20230420-the-right-way-to-eat-sushi,World's Table,"We set the record straight on the ""right way"" to eat sushi"
19,The anxiety of being replaced by AI,https://www.bbc.com/worklife/article/20230418-ai-anxiety-artificial-intelligence-replace-jobs,Worklife,Many workers fear AI is coming for their jobs – are they right?
20,Six choices that help the climate,https://www.bbc.com/future/article/20230421-what-are-the-best-ways-to-reduce-carbon-footprint,Future,"From food to fashion, there are quick and easy ways to help fight climate change"
21,A simple dish emblematic of Sicily,https://www.bbc.com/travel/article/20230421-caponata-alla-giudia-sicilian-aubergine-and-vegetable-stew,Travel,It has roots in the island's pre-Inquisition Jewish community
22,Picture of late Queen released to mark birthday,https://www.bbc.com/news/uk-65350728,UK,A new photograph with her great-grandchildren is released on the day she would have turned 97
23,'I got my fortune read - using asparagus',https://www.bbc.co.uk/food/articles/fortune_read_asparagus,Food,Mystic Veg says she has successfully predicted a number of big events using asparagus stalks
24,The first climate-resilient nation?,/future/article/20230418-how-caribbean-island-dominica-is-fighting-climate-impacts,,
25,A major positive climate tipping point,/future/article/20230414-climate-change-why-2023-is-a-clean-energy-milestone,,
26,The wool that could capture carbon,/future/article/20230413-can-regenerative-wool-make-fashion-more-sustainable,,
27,Can we grow houses from fungus?,/news/entertainment-arts-65346052,Entertainment & Arts,"A structure grown from mycelium, the root network of fungus, is on display in Newcastle."
28,US Supreme Court to decide on abortion pill access,/news/world-us-canada-65320035,US & Canada,
29,How to talk to your parents about climate change,/news/science-environment-65339214,Science & Environment,
30,Buzzfeed News to close as media firm cuts jobs,/news/65341450,Business,
31,In pictures: Muslims around the world celebrate Eid,/news/in-pictures-65346964,In Pictures,
32,Multiple Hillarys as Twitter blue ticks end,/news/technology-65346263,Technology,
33,Elon Musk promises second Starship launch in months,/news/science-environment-65334810,Science & Environment,
34,Garlands and gymnasts: Africa's top shots,/news/world-africa-65334211,Africa,
35,Image of wounded pregnant woman wins World Press Photo,/news/in-pictures-65340265,In Pictures,
36,Award-winning photo turns out to be AI creation,/news/entertainment-arts-65296763,Entertainment & Arts,
37,In Pictures: Eryri in spring,/news/uk-wales-65277475,Wales,
38,Rare photos of skyscraper completion rediscovered,/news/uk-england-london-65274803,London,
