,title,href,tag,summary
0,Putin preparing for long war in Ukraine - US spy chief,/news/live/world-europe-61353374,Europe,"Moscow is counting on the resolve of Ukraine's allies to weaken over time, Avril Haines tells a US Senate hearing."
1,The stolen faces pushing pro-Putin propaganda,https://www.bbc.com/news/blogs-trending-61351342,Trending,
2,EA Sports to stop making Fifa video game,https://www.bbc.com/news/entertainment-arts-61383672,Entertainment & Arts,
3,The end of the sick day?,https://www.bbc.com/worklife/article/20220505-how-remote-work-could-nix-the-sick-day,Worklife,
4,The UK 'climate refugees' who won't leave,https://www.bbc.com/future/article/20220506-the-uk-climate-refugees-who-wont-leave,Future Planet,
5,US fugitives 'planned shootout with police',/news/world-us-canada-61401184,US & Canada,"Police said firearms were found in the vehicle the pair was driving, along with thousands in cash."
6,Bodies of 44 civilians found as battle for Izyum rages,/news/world-europe-61396800,Europe,The Ukrainian city of Izyum has been under Russian occupation since the beginning of April.
7,Elon Musk would reverse Donald Trump's Twitter ban,/news/business-61399483,Business,"He says Twitter's decision to ban the former US president was ""morally wrong and flat-out stupid""."
8,Premier League: Liverpool come from behind to beat Aston Villa,/sport/live/football/60987258,Football,Follow live text updates as Aston Villa host Liverpool in the Premier League after leaders Manchester City agree to sign Borussia Dortmund striker Erling Haaland.
9,Man City 'reach agreement' to sign £51m Haaland,/sport/football/60819647,Football,Manchester City reach an agreement to sign prolific Norway striker Erling Haaland from Borussia Dortmund.
10,Scottish Premiership: Dundee beat Hibs... can they somehow escape drop?,/sport/live/football/61373978,Football,"Listen to Sportsound and follow live text coverage as Dundee welcome on Hibernian in the Scottish Premiership, with anything other than a win confirming the hosts' relegation."
11,Ukraine round-up: A US warning and one man's remarkable life,https://www.bbc.com/news/world-europe-61399039,Europe,"The US warns of a long war, rescuers make a dreadful discovery and a 92-year-old's remarkable story"
12,"I fought Nazis with Russia, now I flee Putin's war",https://www.bbc.com/news/world-europe-61388816,Europe,A Ukrainian Jew who once fought the Nazis with Russia says he had to flee to escape Putin's war
13,Ukrainecast: The Russian invasion of Ukraine,https://www.bbc.com/sounds/brand/p0bqztzm,Sounds,This BBC News Ukraine podcast uncovers and explains the latest events from the conflict
14,The surprising reason behind our ever-increasing narcissim,/reel/video/p0c53h1m/the-link-between-our-hands-and-our-increasing-narcissism,,
15,How one switch saved the US from a nuclear catastrophe,/reel/video/p0c5889f/broken-arrows-the-accidents-that-could-end-the-world,,
16,The delicious flavour with a toxic secret,/reel/video/p09447nl/the-delicious-flavour-with-a-toxic-secret,,
17,England's criminal mastermind of £650m,https://www.bbc.com/travel/article/20220510-the-uk-landscape-that-hid-a-criminal-enterprise,Travel,It was once the biggest fraud in British history
18,The offices turning into luxury flats,https://www.bbc.com/worklife/article/20220505-the-office-spaces-transforming-into-luxury-apartments,Worklife,"Office buildings are ghost towns, so high-end apartments are taking their place"
19,Are decaffeinated drinks healthier?,https://www.bbc.com/future/article/20220506-are-decaffeinated-coffee-alternatives-better-for-health,Future,The coffee bean itself might not be the problem
20,Is this the new Normal People?,https://www.bbc.com/culture/article/20220509-conversations-with-friends-the-new-normal-people,Culture,How does the latest Sally Rooney adaptation match up?
21,Apple to discontinue the iPod after 21 years,https://www.bbc.com/news/technology-61401626,Technology,"The end of an era for Apple's original music player, which has been overshadowed by the iPhone"
22,US faces baby formula 'crisis' as shortage worsens,https://www.bbc.com/news/business-61387183,Business,Pressure is building on the White House to address the worsening shortage of formula milk
23,Skeletons in old mass grave were British soldiers,https://www.bbc.com/news/world-europe-61391848,Europe,"Bones found in the Dutch city of Vianen date back to the late 18th Century, archaeologists say"
24,The hidden volcano beneath a city,/future/article/20220427-how-taiwan-discovered-an-active-volcano-on-its-doorstep,,
25,The forest tended by an elusive giant,/future/article/20220414-how-africas-forest-elephants-help-fight-climate-change,,
26,What would happen if we stopped mining?,/future/article/20220413-how-ending-mining-would-change-the-world,,
27,Peloton warns 'turnarounds are hard' as losses rise,/news/business-61398999,Business,Demand for Peloton's bikes and treadmills has sunk as pre-pandemic exercise habits return.
28,Rebekah Vardy tells court she didn't leak stories,/news/entertainment-arts-61398382,Entertainment & Arts,
29,UK blames Russia for satellite internet hack,/news/technology-61396331,Technology,
30,'Fifty-fifty chance' global warming tops 1.5C soon,/news/science-environment-61383391,Science & Environment,
31,Fourth-dose Covid jab trial shows good boost,/news/health-61384269,Health,
32,Airlines miss all but one climate target - report,/news/science-environment-61384377,Science & Environment,
33,"All I want is more life, says Big C's Deborah James",/news/uk-61397745,UK,
34,Photo map of Queen's visits released to mark jubilee,/news/uk-england-61377866,England,
35,In pictures: Russia's victory day parade,/news/in-pictures-61380487,In Pictures,
36,In pictures: Dogs at polling stations,/news/in-pictures-61333251,In Pictures,
37,Africa's top shots: Beauty kings and fire eaters,/news/world-africa-61327201,Africa,
38,Lockdown reflections in photography awards,/news/in-pictures-61308032,In Pictures,
