,title,href,tag,summary
0,Ukraine anger as Putin offers evacuation routes to Russia,/news/live/world-europe-60635927,Europe,"Ukraine says a proposal of humanitarian corridors taking refugees to Belarus or Russia is ""completely immoral""."
1,"With placards and tears, Poles greet refugees like family",https://www.bbc.com/news/world-europe-60641217,Europe,
2,Watch: A look back at a week that changed history,https://www.bbc.com/news/world-europe-60633138,Europe,
3,The surge in misleading climate adverts,https://www.bbc.com/future/article/20220302-the-adverts-that-were-banned-for-misleading-climate-claims,Future,
4,Why unique baby names are rising,https://www.bbc.com/worklife/article/20220302-why-uncommon-baby-names-are-surging,Worklife,
5,Zelensky vows to punish Russian atrocities,/news/world-europe-60638042,Europe,The Ukrainian president says the country will not forgive or forget those who murder its civilians.
6,Ukraine war 'catastrophic for global food',/news/business-60623941,Business,One of the world's biggest fertiliser firms says the conflict could deliver a shock to food supplies.
7,Shares slide as oil and gas prices soar,/news/business-60642786,Business,"Investors fear global economic shock, with rising petrol and energy bills causing more pain for households."
8,'A graphic illustration of rebuilding job required at Man Utd',/sport/football/60642078,Football,"Manchester United's dismal derby display lays bare the scale of the challenge facing them in the months ahead, writes Phil McNulty."
9,Russian gymnast wears pro-war symbol,/sport/gymnastics/60641891,Sport,Russian gymnast Ivan Kuliak is being investigated after wearing a national war symbol on his leotard as he stood next to a Ukrainian rival on the podium in Qatar on Saturday.
10,City outclass United in Manchester derby,/sport/football/60531492,Football,Kevin de Bruyne and Riyad Mahrez score twice each as Manchester City outclass rivals Manchester United to move six points clear at the top of the table.
11,What happens when sci-fi meets food production,/reel/video/p0bkptqw/why-we-should-treat-food-like-medicine,,
12,The deadly toxin found in the world's oldest mummies,/reel/video/p0br366s/life-beyond-death-in-the-driest-place-on-earth,,
13,Why pleasure is key to losing weight,/reel/video/p0brtrb1/why-pleasure-is-key-to-losing-weight,,
14,Why the best TV characters are Gen X,https://www.bbc.com/culture/article/20220304-the-coolest-characters-on-television,Culture,How the most compelling stories are coming from unapologetic midlife women
15,How a US highway changed race laws,https://www.bbc.com/travel/article/20220306-the-us-highway-that-helped-break-segregation,Travel,The incident made the front page of newspapers across Africa and Asia
16,The rise of 'solo polyamory',https://www.bbc.com/worklife/article/20220301-does-solo-polyamory-mean-having-it-all,Worklife,"""I felt like monogamy would deny me something of myself"""
17,The myths of 21st Century friendship,https://www.bbc.com/future/article/20220302-the-myths-and-reality-of-modern-friendship,Future,Is modern life really changing how we connect with each other?
18,The West fights back against Putin the disruptor,https://www.bbc.com/news/world-us-canada-60597186,US,Several US presidents have failed to get the measure of him
19,A master chef's tips for a bountiful kitchen garden,https://www.bbc.co.uk/food/articles/marcus_wareing_kitchen_garden,Food,The thought process of the garden chain changes the way you think and cook
20,'I went from prisoner to PhD',https://www.bbc.com/ideas/videos/i-went-from-prisoner-to-phd/p08mpxtt,Ideas,Stephen Akpabio-Klementowski's extraordinary story of how he transformed his life through education
21,The puzzle of Mexico's ageing oaks,/future/article/20220222-the-mystery-of-mexicos-vanishing-stream-oaks,,
22,The animal 'sixth sense' for disaster,/future/article/20220211-the-animals-that-predict-disasters,,
23,The country embracing life on water,/future/article/20220202-floating-homes-the-benefits-of-living-on-water,,
24,India TV host yells at wrong man on Ukraine debate,https://www.bbc.com/news/world-asia-india-60614274,India,Rahul Shivshankar only realised his mistake when his perplexed guest spoke up
25,The high-tech testers who can say if an advert is going to work,https://www.bbc.co.uk/news/business-60584596,Business,
26,Head conductor at Moscow's Bolshoi Theatre resigns,https://www.bbc.co.uk/news/entertainment_and_arts?ns_mchannel=social&ns_source=twitter&ns_campaign=bbc_live&ns_linkname=6225ea8cec502b53cd48111d%26Head%20conductor%20at%20Moscow%27s%20Bolshoi%20Theatre%20resigns%262022-03-07T11%3A25%3A28.511Z&ns_fee=0&pinned_post_locator=urn:asset:fa36d1e1-737e-41f7-88d3-8b5c7c41b61a&pinned_post_asset_id=6225ea8cec502b53cd48111d&pinned_post_type=share,Entertainment,
27,Abandoned rocket 'hits the Moon' - scientists,/news/science-environment-60596449,Science & Environment,
28,The TikToker spreading viral Ukraine war videos,/news/technology-60613331,Technology,
29,Another life-saving Covid drug identified,/news/health-60601750,Health,
30,Costa Rica Congress passes medical marijuana bill,/news/world-latin-america-60587109,Latin America & Caribbean,
31,"Destruction, demos and other photos from this week",/news/in-pictures-60619314,In Pictures,
32,In pictures: Russia intensifies attacks on Ukraine,/news/in-pictures-60601185,In Pictures,
33,"Africa's top shots: Bikes, blocks and borders",/news/world-africa-60599941,Africa,
34,In pictures: Kyiv under attack,/news/in-pictures-60536824,In Pictures,
35,In pictures: Destruction and fear as war hits Ukraine,/news/in-pictures-60505277,In Pictures,
