,title,href,tag,summary
0,N Korea 'not returning US calls' on missing soldier,/news/world-asia-66253401,Asia,"The US has reached out to the North, but there is still no word on the whereabouts of Travis King."
1,The Open round one: Follow live text updates,https://www.bbc.com/sport/live/golf/66239237,Golf,
2,Women's World Cup: Australia v Republic of Ireland,https://www.bbc.com/sport/live/football/66143718,Women's Football,
3,How a careless slip killed a physicist,https://www.bbc.com/future/article/20230719-the-blue-flash-louis-slotin-accident-manhattan-project-oppenheimer-atomic-bomb,Future,
4,A foodie pilgrimage around Auckland,https://www.bbc.com/travel/article/20230719-best-places-to-eat-in-auckland-according-to-chef-peter-gordon,Travel,
5,Canada wants US workers - and they are interested,/news/world-us-canada-66249400,US & Canada,"A Canadian work permit for US H1-B visa holders hit its cap of 10,000 applicants in only 48 hours."
6,Outrage after women paraded naked by mob in India,/news/world-asia-india-66253389,India,Police say the women were also gang raped in conflict-hit Manipur state.
7,Wheat prices soar after Russia threatens ships,/news/world-europe-66253143,Europe,Russia announces it will treat ships heading for Ukrainian ports as potential military targets.
8,Ashes: Duckett caught behind off Starc for one,/sport/live/cricket/64959408,Cricket,"Follow live text, Test Match Special commentary and in-play clips from the second day of the fourth Ashes Test between England and Australia at Emirates Old Trafford."
9,New Zealand stun Norway at Women's World Cup,/sport/football/66241739,Football,Co-hosts New Zealand open the 2023 Fifa Women's World Cup in stunning style against Norway as they win on the global stage for the first time.
10,"Transfer latest - Newcastle near Barnes deal, Mahrez and Henderson set for Saudi",/sport/live/football/66248335,Football,"Newcastle close on Harvey Barnes, Al-Ahli and Al-Ettifaq agree deals for Riyad Mahrez and Jordan Henderson, plus more transfer news and gossip."
11,How automation could affect your salary,https://www.bbc.com/worklife/article/20230718-ai-artificial-intelligence-worker-wages-salaries,Worklife,What will happen to wages as AI changes work
12,The dead Hollywood stars still working,https://www.bbc.com/future/article/20230718-how-ai-is-bringing-film-stars-back-from-the-dead,Future,Artificial intelligence is giving some celebrities a new kind of immortality
13,AI: Experts propose guidelines for safe development,https://www.bbc.com/news/technology-66225855,Technology,A new voluntary framework has the backing of hundreds of experts around the world
14,How old is the universe?,/reel/video/p0g1v4pq/how-old-is-the-universe-,,
15,"The dark history of Denmark's room of 10,000 brains",/reel/video/p0g1ntd0/the-danish-basement-housing-10-000-human-brains,,
16,What is Barbenheimer and why should we care?,/reel/video/p0g1kzz6/what-is-barbenheimer-and-why-should-we-care-,,
17,The row over Europe's heatwave names,https://www.bbc.com/future/article/20230718-the-fiery-row-behind-europes-mythological-heatwave-names,Future,It is possible to find deeper meaning in the names of the extreme heatwaves
18,Where Oppenheimer escaped his legacy,https://www.bbc.com/travel/article/20230719-st-john-the-tiny-island-where-robert-oppenheimer-escaped-his-legacy,Travel,"How ""the father of the atomic bomb"" ended up on an island paradise"
19,Oppenheimer is a flat-out masterpiece,https://www.bbc.com/culture/article/20230719-a-magnificent-story-of-a-tragic-american-genius,Culture,Our verdict on Christopher Nolan's much-anticipated World War Two drama
20,Is AI Gen Z's silver bullet?,https://www.bbc.com/worklife/article/20230717-can-ai-help-gen-z-workers-make-up-lost-ground,Worklife,"""Since AI is so new for everyone, it puts Gen Z employees on a level footing"""
21,'There were sandwiches left next to rape-case kits',https://www.bbc.com/news/uk-england-london-65930938,UK,A former detective and a special constable reveal their experiences of serving with the Met Police
22,Netflix password crackdown fuels subscriber surge,https://www.bbc.com/news/business-66240390,Business,The boss of the streaming giant also calls for an end to the strikes disrupting Hollywood
23,Gigi Hadid arrested over drug possession,https://www.bbc.com/news/world-us-canada-66244822,US,The model's bags were searched as she arrived in the Cayman Islands earlier this month
24,How Texas is heat-proofing its cities,/future/article/20230714-how-texas-is-fighting-back-against-heatwaves,,
25,The ancient Chinese way to cool homes,/future/article/20230712-how-ancient-skywells-are-keeping-chinese-homes-cool,,
26,What would green shipping look like?,/future/article/20230707-what-would-net-zero-shipping-look-like,,
27,Fifa esports final hit by penalty shootout row,/news/newsbeat-66255645,Newsbeat,One of gaming's biggest contests is marred by a row over a penalty shootout in its grand final.
28,In pictures: Europe's scorching heatwave,/news/in-pictures-66226313,In Pictures,
29,McDonald's abused workers told to come forward,/news/business-66247184,Business,
30,Medics use body-bag ice treatment in US heatwave,/news/world-us-canada-66237583,US & Canada,
31,World will miss 1.5C warming limit - top UK expert,/news/science-environment-66256101,Science & Environment,
32,Tree row turns up heat on Hollywood strike,/news/entertainment-arts-66255244,Entertainment & Arts,
33,UK amends encrypted message scanning plans,/news/technology-66240006,Technology,
34,Hilarious pictures of pets in comedy photographs,/newsround/66210126,Newsround,
35,Jane Birkin: Artist and style icon's life in pictures,/news/world-europe-66216663,Europe,
36,Hidden history of city revealed in saved pictures,/news/uk-england-coventry-warwickshire-66090707,Coventry & Warwickshire,
37,Cool shades and hot nights: Africa's top shots,/news/world-africa-66187685,Africa,
38,In pictures: President Biden visits the UK,/news/in-pictures-66155089,In Pictures,
