,title,href,tag,summary
0,Tory Lanez jailed for 10 years over Megan Thee Stallion shooting,/news/live/world-us-canada-66431305,US & Canada,The Canadian rapper will spend 10 years in prison for shooting and injuring hip-hop star Megan Thee Stallion.
1,Which criminal case may be hardest for Trump to win?,/news/world-us-canada-66404233,US & Canada,
2,US Supreme Court restores Biden 'ghost guns' rules,/news/world-us-canada-66365642,US & Canada,
3,Japan's innovative cooling solutions,https://www.bbc.com/travel/article/20230807-want-to-cope-with-heatwaves-look-to-japans-creative-cooling-solutions,Travel,
4,Obama's Indonesian comfort food,https://www.bbc.com/travel/article/20230807-mie-bakso-rice-noodle-soup-with-meatballs,World's Table,
5,Russia blames Ukraine for call-up centre fires,/news/world-europe-66440752,Europe,Russia says Ukrainian scammers tricked elderly Russians into setting fire to army recruitment centres.
6,Why Ohio's rare summer vote is so controversial,/news/world-us-canada-66442370,US & Canada,A seemingly tedious constitutional amendment could have a significant impact on abortion rights.
7,Bullock praised for the way she cared for partner,/news/entertainment-arts-66437720,Entertainment & Arts,"The actress has been praised for the ""amazing"" way she cared for Bryan Randall in his final years."
8,"Lopetegui leaves Wolves, O'Neil set to replace him",/sport/football/66437744,Football,Wolves boss Julen Lopetegui leaves the club with former Bournemouth manager Gary O'Neil set to replace him.
9,"Blood, cocaine and questions - the death of 'the Pirate'",/sport/cycling/66373364,Cycling,"Marco Pantani's maverick life ended in a mysterious death. Nearly 20 years on, the questions and investigations continue amid claims that powerful criminals wanted Italy's star cyclist dead."
10,Spurs sign forward Veliz and defender Van de Ven,/sport/football/66406170,Football,Tottenham have completed deals for Argentina U20 forward Alejo Veliz and Netherlands Under-21 defender Micky van de Ven.
11,Colombia 'dream big' at World Cup with England next,https://www.bbc.com/sport/football/66439542,Football,Catalina Usme scored as Colombia beat Jamaica to set up a meeting with the Lionesses
12,England's James apologises for World Cup red card,https://www.bbc.com/sport/football/66438007,Football,England forward Lauren James apologised for her red card in her team's win over Nigeria
13,Have women got the kit they deserve?,https://www.bbc.com/culture/article/20230804-womens-world-cup-2023-how-female-players-have-finally-got-the-football-kit-they-deserve,Culture,How women's football kits are finally meeting female footballers' needs
14,Is this 'game changing' drug risky?,/reel/video/p0g5kmmq/the-risks-of-the-first-pill-for-postpartum-depression,,
15,The Bloody Angle: The deadliest street in American history,/reel/video/p0g1yn2x/the-bloody-angle-the-deadliest-street-in-american-history,,
16,Mystery of treasure-packed ancient tomb in Spain solved,/reel/video/p0g543bb/mystery-of-high-status-ancient-spanish-tomb-solved,,
17,Literature's most misunderstood great?,https://www.bbc.com/culture/article/20230808-the-hours-at-25-the-book-that-changed-how-we-see-virginia-woolf,Culture,Why it's such a struggle to depict the 'real' Virginia Woolf
18,The atomic bomb marker inside your body,https://www.bbc.com/future/article/20230808-atomic-bomb-spike-carbon-radioactive-body-anthropocene,Future,"It's in your teeth, eyes and brain – and it's surprisingly useful to scientists"
19,Should you ditch a bad job in a week?,https://www.bbc.com/worklife/article/20230808-when-a-job-raises-red-flags-immediately-should-workers-cut-and-run,Worklife,Some jobs raise red flags quickly – and workers are deciding to cut and run
20,The world's largest landlocked country,https://www.bbc.com/travel/article/20230808-kazakhstan-a-road-trip-through-the-nations-immense-landscapes,Travel,It's filled with spectacular landscapes that are seldom seen
21,Weight-loss drug heart benefit 'significant',https://www.bbc.com/news/health-66440808,Health,Trial suggests Wegovy cuts risk of cardiovascular event in overweight people with heart disease
22,Fatal family lunch mystery grips Australia,https://www.bbc.com/news/world-australia-66391325,Australia,A tight-knit town is reeling after a meal left three dead and another fighting for life
23,US to announce newest national monument in Arizona,https://www.bbc.com/news/world-us-canada-66440836,US,"The plan, to be announced by Joe Biden later, will protect indigenous cultural sites and curb mining"
24,The town where people live underground,/future/article/20230803-the-town-where-people-live-underground,,
25,The US states pre-empting floods,/future/article/20230731-climate-adaptation-how-us-is-preparing-for-extreme-floods,,
26,The Scottish village reviving a loch,/future/article/20230725-seawilding-the-scottish-community-reviving-a-loch,,
27,Fiery ‘meteor’ over Australia probably Russian space rocket,/news/world-australia-66436211,Australia,Flaming debris was seen blazing across the night sky in Melbourne on Monday evening.
28,Sinéad O'Connor 'brought joy to countless people',https://www.bbc.co.uk/news/articles/c3g1yy5yxyvo,Entertainment,
29,"Onlyfans, Twitch and Snapchat rules 'impenetrable'",/news/technology-66441073,Technology,
30,US approves first postpartum depression pill,/news/world-us-canada-66414446,US & Canada,
31,Cha-Cha Slide hitmaker DJ Casper dies aged 58,/news/entertainment-arts-66436701,Entertainment & Arts,
32,"Dolphins, tigers and turtles in focus",/news/in-pictures-66437556,In Pictures,
33,"UPS drivers in US to get $170,000 pay package",/news/business-66445496,Business,
34,In Pictures: Sinéad O'Connor's funeral,/news/in-pictures-66440464,In Pictures,
35,Alarming photos show typhoon floods engulfing Asia,/news/in-pictures-66400905,In Pictures,
36,"Coronations, celebrations and coups: Africa’s top shots",/news/world-africa-66394367,Africa,
37,In pictures: Supermoon lights up night sky,/news/world-66376332,World,
38,'Dream come true' exhibition for city photographer,/news/uk-england-coventry-warwickshire-66371960,Coventry & Warwickshire,
