,title,href,tag,summary
0,Biden defends Afghan exit amid Taliban joy,/news/world-asia-58403735,Asia,"Staying in Afghanistan was not an option, the US president says, as Taliban militants celebrate."
1,Afghanistan: What was left behind by US forces?,https://www.bbc.com/news/world-58393763,World,
2,Thousands leave as fire closes in on Lake Tahoe,https://www.bbc.com/news/world-us-canada-58399739,US,
3,Irish population tops 5m for first time since 1851,https://www.bbc.com/news/world-europe-58399880,Europe,
4,The Gullah isle only accessible by boat,https://www.bbc.com/travel/article/20210830-the-chef-preserving-gullah-culture-through-storytelling,Travel,
5,Biden: Afghan exit 'best decision for US',/news/live/world-58279900,World,The US president defends the decision to pull out all US troops from Afghanistan in an address to the nation.
6,'They're on the road feeling scared and nervous',/news/world-us-canada-58402381,US & Canada,Traffic clogs evacuation routes as residents and tourists flee from the encroaching Caldor Fire.
7,Reprisals cast doubts over the Taliban's amnesty,/news/world-asia-58395954,Asia,"Reports suggest the Taliban are searching for, and allegedly killing, people they pledged to leave in peace."
8,Transfer deadline day: Live updates & latest news,/sport/live/football/58385562,Football,Follow all the latest news about incomings and outgoings from transfer deadline day on the day the window closes.
9,'I'm back where I belong' - Ronaldo,/sport/football/58367537,Sport,"Cristiano Ronaldo says he is ""back where I belong"" at Manchester United and dedicates his return to the club to former boss Sir Alex Ferguson."
10,Real Madrid sign Camavinga from Rennes,/sport/football/58399787,European Football,Real Madrid sign highly-rated France midfielder Eduardo Camavinga from Rennes on a six-year deal.
11,Do you have the 'warrior gene'?,/reel/video/p09syvpv/can-the-warrior-gene-make-you-violent-,,
12,The Russian cult leader who thinks he is Jesus,/reel/video/p094t5zh/the-russian-cult-leader-who-thinks-he-is-jesus,,
13,An iconic Parisian landmark about to disappear forever,/reel/video/p09qlqyz/the-iconic-parisian-landmark-now-under-threat,,
14,Why it's OK to lose passion for a job,https://www.bbc.com/worklife/article/20210826-why-so-many-workers-have-lost-interest-in-their-jobs,Worklife,Why the pandemic has deteriorated our relationship with our jobs
15,The planes that conquered Antarctica,https://www.bbc.com/future/article/20210829-the-aircraft-that-opened-up-antarctica,Future,Flying on the coldest continent on Earth is dangerous but essential
16,The island where knitting is men's work,https://www.bbc.com/travel/article/20210831-taquile-where-manliness-is-based-on-knitting,Travel,"For nearly 500 years, men here have knitted to attract lovers"
17,A Gen-Z spin on a centuries-old fashion,https://www.bbc.com/culture/article/20210818-how-the-sari-is-being-reinvented-for-the-21st-century,Culture,"The women reclaiming and re-energising a traditional, 'feminine' garment"
18,13 unmissable new documentaries to watch,https://www.bbc.com/culture/article/20210816-longshots-13-films-to-stream-from-bbcs-online-film-festival,LongShots,"Watch films that make our hearts jump, catch us by surprise and spark fresh ideas"
19,Naked Attraction bus campaign to end,https://www.bbc.com/news/uk-england-london-58350075,London,"The advert was criticised on social media as ""tone deaf"" with passengers at risk of sexual assault"
20,Fake Banksy NFT sold through artist's website,https://www.bbc.com/news/technology-58399338,Technology,"Duped buyer says he feels ""burned"" after apparent hack of Banksy website"
21,Can investors save the Amazon?,/future/article/20210825-can-investors-save-the-amazon,,
22,The controversial plan to rewild death,/future/article/20210817-rewilding-death-germanys-plan-to-restore-the-necrobiome,,
23,The ancient Persian way to keep cool,/future/article/20210810-the-ancient-persian-way-to-keep-cool,,
24,Toyota restarts driverless vehicles after accident,/news/business-58390290,Business,A visually impaired athlete from Japan's judo team was hit by one of the e-Palette pods on Thursday.
25,John Lydon calls Sex Pistols ruling dumbfounding,/news/entertainment-arts-58394811,Entertainment & Arts,
26,"Australia records 1,000th Covid death",/news/world-australia-58381168,Australia,
27,Coinbase users fear hacking after erroneous emails,/news/technology-58384458,Technology,
28,Thunberg: Scotland not world leader on climate change,/news/uk-scotland-58387017,Scotland,
29,"Leaded petrol now eradicated worldwide, says UN",/news/world-58388810,World,
30,R. Kelly's first male accuser testifies to abuse,/news/entertainment-arts-58393119,Entertainment & Arts,
31,The best of British press photography,/news/in-pictures-58392452,In Pictures,
32,In pictures: Hurricane Ida lashes Gulf Coast,/news/world-us-canada-58380820,US & Canada,
33,A flight down the UK by paramotor in pictures,/news/uk-england-norfolk-58345631,Norfolk,
34,Photographer captures Oasis star's years on tour,/news/uk-england-manchester-58229489,Manchester,
35,"Africa's top shots: New kings, freedom flags and tea baskets",/news/world-africa-58342301,Africa,
