,title,href,tag,summary
0,"US says up to 400,000 remain in north Gaza as ground offensive goes on",/news/live/world-middle-east-67305304,Middle East,A US official says hundreds of thousands of people are still in the part of Gaza that Israel has urged them to leave.
1,'They couldn't save my daughter': 150 dead in Nepal quake,/news/world-asia-67317442,Asia,
2,What a Trump second term would look like,/news/world-us-canada-67272569,US & Canada,
3,Norris beats Verstappen to pole for sprint race,/sport/formula1/67321231,Formula 1,
4,Japan's unique form of accommodation,https://www.bbc.com/travel/article/20231103-shukubo-the-japanese-temples-where-you-can-sleep-alongside-monks,Travel,
5,Woman accuses Brand of sexual assault on film set,/news/world-us-canada-67318813,US & Canada,The actor is accused of exposing himself and sexually assaulting an extra on set in a US lawsuit.
6,Space telescope records baby star's first screams,/news/science-environment-67243772,Science & Environment,The James Webb observatory records the giant jets and shocks created by a birthing star in Orion.
7,Awkward EU summit kiss causes controversy,/news/world-europe-67319850,Europe,"Croatia's foreign minister has apologised saying the greeting was ""maybe an awkward moment""."
8,"Premier League: Man City, Sheffield United, Brentford, Everton and Palace lead",/sport/live/football/67065667,Football,"Follow live commentary, text & score updates as Fulham lose to Man Utd plus six other fixtures in the Premier League."
9,World Cup: England v Australia,/sport/live/cricket/66858961,Cricket,Follow live text updates as England play Australia in the Men's Cricket World Cup 2023
10,Kilmarnock lead Motherwell in top-flight; Championship leaders Utd equalise,/sport/live/football/67284741,Football,"Listen to Sportsound, watch Sportscene results, and follow text updates as Kilmarnock host Motherwell, plus action in the lower leagues."
11,'The day I saw the walls breathing',https://www.bbc.com/future/article/20231101-psychedelic-drugs-flashbacks-hallucinogen-persisting-perception-disorder-hppd,Future,A poorly understood yet disconcerting after-effect of hallucinogenic drugs
12,What The Beatles' new song can tell us,https://www.bbc.com/culture/article/20230616-the-beatles-final-record-should-we-bring-singers-back-from-the-dead,Culture,"AI voices, holograms and 'raves beyond the grave'"
13,The monument that represents Australia,https://www.bbc.com/travel/article/20231102-the-sydney-opera-house-the-monument-that-represents-australia,Travel,The blueprint for the Sydney Opera House was once placed in the reject bin
14,How bison could become climate heroes,/future/article/20231102-why-grazing-bisoncould-be-good-for-the-planet,,
15,Sign up to our new climate newsletter,/future/article/20231103-introducing-future-earth-newsletter-get-bbc-climate-updates-to-your-inbox,,
16,A frosty day at a Finnish forest school,/future/article/20231031-how-forest-schools-boost-childrens-immune-systems,,
17,Tuning into indigenous climate science,https://www.bbc.com/future/article/20231102-climate-scientists-are-working-with-indigenous-tribes,Future,Western scientists are using indigenous knowledge to study climate change
18,Why ads are hitting streaming services,https://www.bbc.com/worklife/article/20231101-why-some-streaming-companies-are-leaning-into-adverts-and-raising-prices,Worklife,The adverts consumers hoped to escape through media subscriptions are returning
19,Did American History X see the future?,https://www.bbc.com/culture/article/20231102-how-american-history-x-foreshadowed-the-resurgence-of-white-nationalism-in-the-us,Culture,The 1998 indie film portrayed a chilling vision of extremism in the US
20,The world's best tourism villages,https://www.bbc.com/travel/article/20231030-the-worlds-best-tourism-villages-in-2023,Travel,"For those looking to immerse themselves in local culture, here's where to go"
21,How to Have Sex: The film tackling consent head-on,https://www.bbc.com/news/entertainment-arts-67203958,Entertainment & Arts,Molly Manning Walker's debut follows three teenagers abroad whose holiday turns sour
22,Mainz end El Ghazi contract over Israel-Gaza post,https://www.bbc.com/sport/football/67312754,Football,El Ghazi has his contract terminated for a social media post about the Israel-Gaza conflict
23,Palestinian-American family finally escapes Gaza,https://www.bbc.com/news/world-us-canada-67301742,US,The war shattered a joyful reunion with the grandparents the couple's one-year-old had never met
24,The 400-year-old nude self-portrait censored for centuries,/reel/video/p0gq3vps/the-naked-portrait-covered-up-for-centuries,,
25,The truth about supplements and who should be taking them,/reel/video/p0c5mwdb/the-truth-about-supplements-and-who-should-be-taking-them,,
26,Caldas de Reis: The prehistoric treasure found by Spanish farmers,/reel/video/p0gpz2qf/the-enigmatic-prehistoric-gold-treasure-of-caldas-de-reis,,
27,"Storms, singing and silence: Photos of the week",/news/in-pictures-67308202,In Pictures,"A selection of striking images from around the world, taken over the past seven days."
28,AI bot 'capable of covering up illegal trading',/news/technology-67302788,Technology,
29,Cough syrup maker boss jailed after child deaths,/news/business-67294106,Business,
30,"Maersk cuts 10,000 jobs as shipping demand falls",/news/business-67307248,Business,
31,What it's like to go clubbing in an abandoned Ikea?,/news/entertainment-arts-67273621,Entertainment & Arts,
32,Boom in unusual jellyfish spotted in UK waters,/news/science-environment-67301074,Science & Environment,
33,BTS's Jung Kook crowned 'pop king' with solo album,/news/entertainment-arts-67307109,Entertainment & Arts,
34,Damage and disruption: Storm Ciarán in pictures,/news/in-pictures-67298061,In Pictures,
35,"Clouds, crowns and crews: Africa's top shots",/news/world-africa-67295807,Africa,
36,Elton John photography collection to go on display,/news/uk-england-london-67205468,London,
37,Skulls and flowers: Mexico's 'skeleton' parade,/news/in-pictures-67193453,In Pictures,
38,Steely gaze of endangered tigress tops mangrove photo awards,/news/in-pictures-67155632,In Pictures,
