,title,href,tag,summary
0,Soldier in North Korea is absent without leave - Pentagon,/news/world-asia-66253401,Asia,The White House says Pyongyang has failed to respond to attempts to negotiate release.
1,What's next for US soldier detained in North Korea,/news/world-asia-66261925,Asia,
2,Votes being counted after by-election polls close,/news/live/uk-politics-66181315,UK Politics,
3,How a careless slip killed a physicist,https://www.bbc.com/future/article/20230719-the-blue-flash-louis-slotin-accident-manhattan-project-oppenheimer-atomic-bomb,Future,
4,Why critics are loving Barbie's Ken,https://www.bbc.com/culture/article/20230720-the-joy-of-ken-can-barbies-ryan-gosling-really-win-an-oscar,Culture,
5,Tupac police seize hard drives and laptops at house,/news/world-us-canada-66263481,US & Canada,Police search the home of a man who says he was inside the car with the person who shot the rapper.
6,What charges could Trump face in January 6 probe?,/news/world-us-canada-64034782,US & Canada,"As the former president says he expects to be indicted, we explain what the possible counts could be."
7,Xi meets Kissinger as US seeks to defrost China ties,/news/world-asia-china-66106076,China,The 100-year-old diplomat's surprise trip to Beijing follows a flurry of visits by US officials.
8,'Argumentative' Crawley vindicates England faith,/sport/cricket/66250767,Cricket,"England captain Ben Stokes says Zak Crawley is ""argumentative"", but the opener repaid the faith shown by the skipper with a memorable Ashes hundred."
9,Fleetwood shares Open lead as McIlroy rallies,/sport/golf/66254702,Golf,Tommy Fleetwood raises hopes of a first English winner of The Open in 31 years with a superb five-under-par 66 on the opening morning at Royal Liverpool.
10,Bounty hunting and cheat chasing - the battle for Kenya’s conscience,/sport/athletics/66223437,Athletics,"Faked medical records, pharmacists, fixers, fame and fortune. Dopers infiltrated Kenyan distance running but the fightback has begun."
11,Artist's work copied by AI more times than Picasso,https://www.bbc.com/news/uk-wales-66099850,UK,Greg Rutkowski is among the artists calling for more protection from artificial intelligence tools
12,The three job categories safe from AI,https://www.bbc.com/worklife/article/20230507-the-jobs-ai-wont-take-yet,Worklife,AI will be able to replace some workers – but computers won't overtake all
13,The dead Hollywood stars still working,https://www.bbc.com/future/article/20230718-how-ai-is-bringing-film-stars-back-from-the-dead,Future,Artificial intelligence is giving some celebrities a new kind of immortality
14,The age of the Universe might be drastically wrong,/reel/video/p0g1v4pq/how-old-is-the-universe-,,
15,"The dark history of Denmark's room of 10,000 brains",/reel/video/p0g1ntd0/the-danish-basement-housing-10-000-human-brains,,
16,What is Barbenheimer and why should we care?,/reel/video/p0g1kzz6/what-is-barbenheimer-and-why-should-we-care-,,
17,A city living under an active volcano,https://www.bbc.com/travel/article/20230720-in-pictures-a-city-living-under-an-active-volcano,Travel,Stunning images show what life is like on the side of danger
18,The row over Europe's heatwave names,https://www.bbc.com/future/article/20230718-the-fiery-row-behind-europes-mythological-heatwave-names,Future,It is possible to find deeper meaning in the names of the extreme heatwaves
19,How heatwaves will change our jobs,https://www.bbc.com/worklife/article/20230719-how-will-extreme-temperatures-and-heat-waves-change-how-we-work,Worklife,Heatwaves are descending across the globe – and work may never be the same
20,Oppenheimer is a 'flat-out masterpiece' ★★★★★,https://www.bbc.com/culture/article/20230719-a-magnificent-story-of-a-tragic-american-genius,Culture,Our verdict on Christopher Nolan's much-anticipated World War Two drama
21,"Jury awards girl $800,000 for chicken McNugget burn",https://www.bbc.com/news/world-us-canada-66260956,US,Her family had alleged the child received severe burns when a McDonalds nugget fell on her leg
22,Beethoven skull fragments return to Vienna,https://www.bbc.com/news/world-europe-66261623,Europe,The remains have been donated by a US businessman to a university so they can be studied
23,Chinese man convicted after BBC racist video expose,https://www.bbc.com/news/world-africa-66261665,Africa,"Lu Ke was shown by BBC Africa Eye making videos with children, some of which included racist content"
24,How Texas is heat-proofing its cities,/future/article/20230714-how-texas-is-fighting-back-against-heatwaves,,
25,The ancient Chinese way to cool homes,/future/article/20230712-how-ancient-skywells-are-keeping-chinese-homes-cool,,
26,What would green shipping look like?,/future/article/20230707-what-would-net-zero-shipping-look-like,,
27,Apple slams UK surveillance-bill proposals,/news/technology-66256081,Technology,The technology giant says it could remove services such as FaceTime from the UK over potential...
28,In pictures: Europe's scorching heatwave,/news/in-pictures-66226313,In Pictures,
29,Netflix password crackdown fuels jump in subscribers,/news/business-66240390,Business,
30,Medics use body-bag ice treatment in US heatwave,/news/world-us-canada-66237583,US & Canada,
31,World will miss 1.5C warming limit - top UK expert,/news/science-environment-66256101,Science & Environment,
32,Tree row turns up heat on Hollywood strike,/news/entertainment-arts-66255244,Entertainment & Arts,
33,New plans to clamp down on mobile roaming charges,/news/technology-66256470,Technology,
34,Hilarious pictures of pets in comedy photographs,/newsround/66210126,Newsround,
35,Jane Birkin: Artist and style icon's life in pictures,/news/world-europe-66216663,Europe,
36,Hidden history of city revealed in saved pictures,/news/uk-england-coventry-warwickshire-66090707,Coventry & Warwickshire,
37,Cool shades and hot nights: Africa's top shots,/news/world-africa-66187685,Africa,
38,In pictures: President Biden visits the UK,/news/in-pictures-66155089,In Pictures,
