,title,href,tag,summary
0,Rushdie's 'defiant sense of humour' remains - son,/news/world-us-canada-62542161,US & Canada,The author was severely injured after being stabbed on stage at an event in New York State.
1,Dozens dead in Egypt church fire,/news/world-middle-east-62541074,Middle East,
2,"'We are waiting for rain, for winter, for God'",/news/world-europe-62539385,Europe,
3,Remote Pacific nation hit by Covid outbreak,/news/world-asia-62544116,Asia,
4,'Match sucked me in' - why Tuchel & Conte saw red,/sport/football/62543119,Football,
5,Fireworks explosion rocks Armenia shopping market,/news/world-62540398,World,"Video footage shows people running from the huge blast, which killed at least three people."
6,Walrus Freya who became Oslo attraction put down,/news/world-europe-62539485,Europe,"Freya had to be euthanised because the public went too close to her, officials said."
7,US Congress team follows Pelosi to Taiwan,/news/world-asia-62541750,Asia,The trip comes just 12 days after a controversial tour by House Speaker Nancy Pelosi.
8,"'Fight, character & depth - how Conte has changed Spurs'",/sport/football/62541788,Football,Former Tottenham midfielder Jermaine Jenas says it was important for his old side to show they can play badly and not lose in their draw with Chelsea.
9,'New-look Chelsea are a force to be reckoned with',/sport/football/62543996,Football,Todd Boehly soaks it all up as feisty London derby sees late drama and red cards for Antonio Conte and Thomas Tuchel.
10,Jacks hits sublime 47-ball ton - Hundred round-up,/sport/cricket/62541362,The Hundred,Will Jacks smashes the fastest century in The Hundred as Oval Invincibles sweep to an easy seven-wicket win over Southern Brave.
11,The new problem for 'overthinkers',https://www.bbc.com/worklife/article/20220803-why-overthinkers-struggle-with-remote-work,Worklife,Communicating remotely is hard – particularly for anxious workers
12,The play still going after 388 years,https://www.bbc.com/culture/article/20220809-oberammergau-passion-388-year-old-play-thats-still-going,Culture,How a remarkable epic about Jesus Christ takes over a German town every decade
13,Why do we die?,https://www.bbc.com/future/article/20220805-why-do-we-die,Future,Some organisms have a remarkable ability to defy death – can we learn from them?
14,Was this the greatest moment in human history?,/reel/video/p0cs9390/when-the-first-humans-ever-landed-on-the-moon,,
15,How a dictator controlled Portugal with cod,/reel/video/p0crynq5/why-is-cod-so-popular-in-portugal-,,
16,How repeating mantras 'repairs' your brain,/reel/video/p0cqt0yc/mantra-meditation-the-ancient-practice-to-heal-our-minds,,
17,The greatest novel of the 20th Century?,https://www.bbc.com/culture/article/20220812-did-proust-write-the-greatest-novel-of-the-20th-century,Culture,Why Proust's In Search of Lost Time is so misunderstood
18,The most sustainable way to eat fish,https://www.bbc.com/future/article/20220810-can-eating-fish-ever-be-sustainable,Future,Is sustainable seafood actually possible – or should we avoid fish altogether?
19,The floating homes of Lake Titicaca,https://www.bbc.com/travel/article/20220814-the-floating-homes-of-lake-titicaca,Travel,The islands are an incredible feat of human engineering
20,The end of the layoff taboo,https://www.bbc.com/worklife/article/20220812-how-layoffs-shed-their-taboo,Worklife,Some workers are posting about getting laid off – and it's paying off
21,The humiliating story that made me a break-up coach,https://www.bbc.com/news/world-africa-62506531,Africa,A shocking moment in a divorce court prompted Aronke Omame to switch careers and become a break-up...
22,Cereals that are actually good for you,https://www.bbc.co.uk/food/articles/choosing_right_cereal,Food,Do we pay enough attention to what's in our favorite box?
23,What did the FBI find in Trump's home?,https://www.bbc.com/news/world-us-canada-62528709,US,Agents took classified documents from the former president's home as part of an unprecedented...
24,The crab invading the Mediterranean,/future/article/20220809-how-the-mediterranean-became-the-worlds-most-invaded-sea,,
25,Scotland's most misunderstood landscape,/future/article/20220802-climate-change-the-promise-and-danger-of-scotlands-peat,,
26,How religion is saving species in India,/future/article/20220726-how-religious-worship-is-boosting-conservation-in-india,,
27,NHS IT supplier held to ransom by hackers,/news/technology-62506039,Technology,Its IT provider says it may take three or four weeks to fully recover from the cyber-attack.
28,'Extreme' racism behind Sadowitz scrapping – venue,/news/62543162,"Edinburgh, Fife & East Scotland",
29,'I'm a different person after having monkeypox',/news/world-us-canada-62438263,US & Canada,
30,Drought highlights dangers for electricity supply,/news/science-environment-62524551,Science & Environment,
31,Presenter Helen Skelton completes Strictly line-up,/news/entertainment-arts-62532622,Entertainment & Arts,
32,The tech aiming to prevent lost airline luggage,/news/business-62446937,Business,
33,Britney Spears' ex guilty over crashing wedding,/news/entertainment-arts-62531945,Entertainment & Arts,
34,In pictures: Stunning Sturgeon Moon lights up skies,/news/in-pictures-62518102,In Pictures,
35,"In pictures: Heatwaves, drought and wildfires",/news/in-pictures-62497772,In Pictures,
36,"Africa's top shots: Laughs, leaps and prickly pears",/news/world-africa-62503581,Africa,
37,Picture of wild cat hunting flamingo wins award,/news/in-pictures-62492855,In Pictures,
38,Mexico indigenous groups celebrate their heritage,/news/world-latin-america-62491341,Latin America & Caribbean,
