,title,href,tag,summary
0,Street fighting in Bakhmut but Russia not in control,/news/world-europe-64846666,Europe,The city has seen months of intense fighting - despite its strategic value being questioned.
1,Saving Private Ryan actor Tom Sizemore dies at 61,/news/entertainment-arts-64721187,Entertainment & Arts,
2,Alex Murdaugh's legal troubles are far from over,/news/world-us-canada-64843564,US & Canada,
3,Why Alex Murdaugh was spared the death penalty,/news/world-us-canada-64843984,US & Canada,
4,'Days like this win titles' - Arsenal joy from drama,/sport/football/64848020,Football,
5,Russian minister laughed at for Ukraine war claims,/news/world-europe-64848508,Europe,"Sergei Lavrov is laughed at in Delhi after saying the Ukraine war was ""launched against us""."
6,Harry: I feared losing memories of mum during therapy,/news/uk-64850024,UK,"The Duke of Sussex says he showers his children with affection to avoid passing on ""traumas"" from his past."
7,US-made cheese can be called 'gruyere' - court,/news/world-us-canada-64848884,US & Canada,"A US appeal court has ruled that cheeses from outside Switzerland and France can be called ""gruyere""."
8,Verstappen on pole for season opener in Bahrain,/sport/formula1/64849721,Formula 1,Max Verstappen leads a Red Bull one-two as he takes pole position for the season-opening Bahrain Grand Prix.
9,Medvedev overwhelms Rublev to clinch Dubai title,/sport/tennis/64846986,Tennis,Russian Daniil Medvedev sweeps past compatriot Andrey Rublev in straight sets to win the Dubai Tennis Championship title.
10,NBA investigates after Morant appears to hold gun,/sport/basketball/64851375,Basketball,Memphis Grizzlies star Ja Morant apologises as the NBA investigates a video that appears to show him holding a gun in a nightclub.
11,Why Marlon Brando rejected an Oscar,https://www.bbc.com/culture/article/20230302-the-most-shocking-moment-in-oscars-history-50-years-on,Culture,How Native American activist Sacheen Littlefeather divided Hollywood
12,How three widows came to rule Champagne,https://www.bbc.com/travel/article/20230301-the-little-known-history-of-champagne,Travel,They created some of Champagne's most lauded empires
13,The problem confronting women of colour,https://www.bbc.com/worklife/article/20230228-the-perfect-storm-keeping-women-of-colour-behind-at-work,Worklife,There's a story hidden in the recent workplace changes
14,The untold story of Britain's African emperor,/reel/video/p0f6fwt2/the-untold-story-of-britain-s-african-emperor,,
15,What science tells us about the afterlife,/reel/video/p0f61ch8/why-are-humans-obsessed-with-the-afterlife-,,
16,The Caribbean island that embraces a 'deadly sin',/reel/video/p09ftqzh/the-paradise-island-with-a-lesson-about-pride,,
17,The rise of the Gen Z side hustle,https://www.bbc.com/worklife/article/20230302-the-rise-of-the-gen-z-side-hustle,Worklife,Why the youngest workers are eagerly juggling multiple roles
18,The return of the US' lost language,https://www.bbc.com/travel/article/20230228-kouri-vini-the-return-of-the-us-lost-language,Travel,"There are fewer than 6,000 speakers left"
19,The ocean making our days longer,https://www.bbc.com/future/article/20230303-how-the-moon-is-making-days-longer-on-earth,Future,Every year the average Earth day elongates by a millisecond
20,The most ingenious recycled homes,https://www.bbc.com/culture/article/20230302-the-most-ingenious-recycled-homes,Culture,New interiors made from old materials are leading sustainable design
21,What's the least exercise we can get away with?,https://www.bbc.com/news/health-64001807,Health,Is there a minimum amount of exercise you can do to stay fit and healthy?
22,Sacred coronation oil will be animal-cruelty free,https://www.bbc.com/news/uk-64836101,UK,A new version of sacred oil to be used at the King's coronation has been consecrated in Jerusalem
23,AOC under investigation for Met Gala dress,https://www.bbc.com/news/world-us-canada-64837119,US,The ethics probe centres on whether her rented dress violated congressional rules about gifts
24,The clothes you can't recycle,/future/article/20230227-how-to-recycle-your-clothes,,
25,How longer weekends help the planet,/future/article/20230220-is-a-4-day-workweek-good-for-the-climate,,
26,Can the unborn have a say on climate?,/future/article/20230215-should-future-generations-have-climate-rights,,
27,Ken Bruce signs off final BBC Radio 2 show,/news/entertainment-arts-64821817,Entertainment & Arts,Fellow DJs and listeners pay tribute to the presenter as he leaves the BBC after almost 50 years.
28,Half of world could be overweight by 2035,/news/world-64831848,World,
29,Tech Tent: the pregnant worker who took on Google,https://www.bbc.co.uk/sounds/play/w3ct4kj7,Technology,
30,Pet crocs and red carpets: Africa's top shots,/news/world-africa-64823868,Africa,
31,Airlines sue Dutch government over flight cuts,/news/science-environment-64842394,Science & Environment,
32,Scotland first to ban anaesthetic over environment,/news/health-64347191,Health,
33,Seed sales jump as fruit and veg shortage continues,/news/business-64811491,Business,
34,The devastated towns near Ukraine's front line,/news/world-europe-64819471,Europe,
35,Pictures show devastation after Greece train disaster,/news/world-europe-64808123,Europe,
36,Spectacular northern lights seen across UK,/news/uk-64782372,UK,
37,SAG Awards: The red carpet in pictures,/news/entertainment-arts-64781316,Entertainment & Arts,
38,Vigils and flags: Ukraine war anniversary in pictures,/news/in-pictures-64757068,In Pictures,
