,title,href,tag,summary
0,China imposes sanctions on US officials,/news/world-asia-china-57950720,China,The sanctions are in response to recent US sanctions on Chinese officials in Hong Kong.
1,Tokyo 2020 Olympics officially open,/sport/olympics/57929293,Olympics,
2,"Tokyo 2020 day one: 11 gold medals – video, clips, radio & text",/sport/live/olympics/50973971,Olympics,
3,"Bezos and Branson not astronauts, US says",/news/world-us-canada-57950149,US & Canada,
4,The woman helping reunite volcano families,/news/world-africa-57947193,Africa,
5,Gender disparities still vex Tokyo Olympics,/news/world-us-canada-57937102,US & Canada,"From breastfeeding to representation, women are still frustrated at most 'gender balanced' Games."
6,Cold case cracked with smallest ever amount of DNA,/news/world-us-canada-57947785,US & Canada,Just 15 cells' worth of DNA was used to track down the man suspected of killing a US girl in 1989.
7,Court removes judge from Jolie-Pitt divorce case,/news/world-us-canada-57946434,US & Canada,"The ruling is a victory for Angelina Jolie, who is locked in a custody battle with Brad Pitt."
8,Lions angered by 'offensive' Smith slur,/sport/rugby-union/57946171,Rugby Union,The British and Irish Lions and Harlequins both express anger over former Ireland international Neil Francis' description of fly-half Marcus Smith.
9,Sancho at Man Utd: Right or left winger? Or a liberator for Fernandes?,/sport/football/57943489,Sport,What clues does Jadon Sancho's Borussia Dortmund career give us about how he will fit in at Manchester United?
10,'Protest a human right' - Asher-Smith,/sport/olympics/57942477,Olympics,Team GB sprinter Dina Asher-Smith speaks out in support of athlete protests at the Tokyo 2020 Olympics
11,The mysterious Himalayan lake full of human skeletons,/reel/video/p08mqncs/the-ancient-mystery-of-the-himalayan-skeleton-lake-,,
12,The revolutionary idea reshaping Dutch society,/reel/video/p08hppxt/how-the-dutch-are-reshaping-their-post-pandemic-utopia,,
13,Lessons on wealth from the happiest country in the world,/reel/video/p09fc6tx/the-truth-behind-the-nordic-myth-of-endless-wealth,,
14,The workers weaponising punctuality,https://www.bbc.com/worklife/article/20210716-ya-miao-taiwans-workers-revolt-by-squeezing-the-second,Worklife,Why Taiwan’s workers like to 'squeeze the second' at the office
15,The greatest film about sport ever made,https://www.bbc.com/culture/article/20210722-tokyo-olympiad-the-greatest-film-about-sport-ever-made,Culture,Why Tokyo Olympiad is a masterpiece of Japanese cinema
16,Is French cuisine forever changed?,https://www.bbc.com/travel/article/20210722-is-french-cuisine-forever-changed,Travel,The French revolution that has chefs sharpening their knives
17,Why some people don't want a vaccine,https://www.bbc.com/future/article/20210720-the-complexities-of-vaccine-hesitancy,Future,The reasons for vaccine hesitancy are complex but may prevent herd immunity
18,"Mars has thin crust and huge core, Nasa probe shows",https://www.bbc.com/news/science-environment-57935742,Science & Environment,"Scientists now have absolute numbers for the thickness of the Red Planet's crust, mantle and core"
19,TikTok's pasta chips - can millions be wrong?,https://www.bbc.co.uk/food/articles/pasta_chips,FOOD,Sophie Whitbread puts the TikTok recipe to the test
20,Could there be new Amy Winehouse music on the way?,https://www.bbc.com/news/entertainment-arts-57926362,Entertainment & Arts,"Ten years after her death, Amy's parents say they want fans to hear CDs of her unreleased material"
21,The neglected 'Galapagos of Europe',/future/article/20210720-europes-museum-of-living-fossils,,
22,The beavers returning to Utah's desert,/future/article/20210713-the-beavers-returning-to-the-desert,,
23,The new use for abandoned coal mines,/future/article/20210706-how-flooded-coal-mines-could-heat-homes,,
24,Face palm: The fight to get a new emoji made,/news/technology-57848226,Technology,"There are about 3,000 emojis to choose from but what happens when the one you want isn't there?"
25,AI breakthrough could spark medical revolution,/news/science-environment-57929095,Science & Environment,
26,Spacing out Pfizer Covid jabs gives antibody boost,/news/health-57929953,Health,
27,YouTuber and rapper KSI tops UK album chart,/news/entertainment-arts-57940455,Entertainment & Arts,
28,"Road schemes can ignore climate, campaigners claim",/news/business-57935608,Business,
29,Didi shares fall on reports of penalties in China,/news/business-57938212,Business,
30,'It's so nice to get back into the festival vibe',/news/uk-england-suffolk-57940287,Suffolk,
31,Striking news pictures from around the world,/news/in-pictures-57932538,In Pictures,
32,Town transformed for Boyle's Sex Pistols drama,/news/uk-england-beds-bucks-herts-57933408,"Beds, Herts & Bucks",
33,Africa's top shots: Eid prayers and sea dips,/news/world-africa-57926873,Africa,
34,Rare 'lightning rainbows' captured during storms,/news/uk-england-beds-bucks-herts-57921718,"Beds, Herts & Bucks",
35,In pictures: Germany grapples with flood aftermath,/news/world-europe-57902024,Europe,
