,title,href,tag,summary
0,Top US court keeps curb on migrants crossing border,/news/world-us-canada-64103825,US & Canada,Legislation preventing undocumented migrants crossing the border from Mexico is extended.
1,Deadly blizzard leaves more than 60 dead across US,/news/world-us-canada-64099642,US & Canada,
2,Flight cancellations wreak havoc on US airports,/news/world-us-canada-64104155,US & Canada,
3,In-form Rashford leads dominant Man Utd to victory,/sport/football/64035052,Football,
4,Leader of plot to kidnap Michigan governor jailed,/news/world-us-canada-64103685,US & Canada,
5,Chinese rush to book travel as Covid rules lifted,/news/world-asia-china-64102176,China,But Chinese tourists will not have unfettered access to all countries - as some impose restrictions.
6,Republican George Santos admits lying on his CV,/news/world-us-canada-64102086,US & Canada,"George Santos, who was recently elected, says he misrepresented his education and employment history."
7,Cardinals star Watt announces retirement,/sport/american-football/64102113,American Football,"JJ Watt, considered one of the NFL's greatest ever defensive players, announces he will retire at the end of the season."
8,Comfortable Chelsea win boosts top-four hopes,/sport/football/64035053,Football,Chelsea boost their top-four hopes as they resume their Premier League season with a comfortable victory over Bournemouth at Stamford Bridge.
9,Australia v South Africa - second Test scorecard,https://www.bbc.co.uk/sport/cricket/scorecard/ECKO54101,Sport,"Latest scorecard from the traditional Boxing Day Test at the Melbourne Cricket Ground, as Australia take on South Africa."
10,Djokovic lands in Australia after ban overturned,/sport/tennis/64101511,Tennis,"Novak Djokovic lands in Australia for the 2023 Australian Open, almost a year after being deported over his Covid vaccine status."
11,The forgotten way medieval people slept,https://www.bbc.com/future/article/20220107-the-lost-medieval-habit-of-biphasic-sleep,Future,"For millennia, people slept in two shifts. Why did we stop?"
12,A stunning lake hidden in plain sight,https://www.bbc.com/travel/article/20220308-new-zealands-secret-lake-most-kiwis-dont-know,Travel,It's the crown jewel on an isolated predator- and pest-free island reserve
13,The millennials in sexless marriages,https://www.bbc.com/worklife/article/20221019-the-millennials-in-sexless-marriages,Worklife,Why are so many couples reporting major dry spells?
14,The surprising dark side of empathy,/reel/video/p0bwksjj/the-surprising-dark-side-of-empathy,,
15,The earthquake that changed the course of history,/reel/video/p0ckfxtn/the-earthquake-that-changed-the-course-of-history,,
16,The tiny creatures you didn't know are living on your face,/reel/video/p0c4238j/there-are-thousands-of-mites-living-on-your-face,,
17,The fruit that once fed mastodons,https://www.bbc.com/travel/article/20220425-the-revival-of-a-forgotten-american-fruit,Travel,"Ancient beasts ate it, now humans want North America's forgotten fruit too"
18,Why we brush our teeth wrong,https://www.bbc.com/future/article/20220718-the-best-way-to-brush-your-teeth,Future,Most of us don't clean our teeth in the right way
19,Why open relationships are on the rise,https://www.bbc.com/worklife/article/20220725-the-rising-curiosity-behind-open-relationships,Worklife,"From 'free passes' to swinging, interest in consensual non-monogamy is spiking"
20,The greatest novel of the 20th Century?,https://www.bbc.com/culture/article/20220812-did-proust-write-the-greatest-novel-of-the-20th-century,Culture,Why Proust's In Search of Lost Time is so misunderstood
21,50 best driving games of all time,https://www.topgear.com/car-news/gaming/these-are-50-best-driving-games-all-time,Top Gear,Top Gear's definitive list of all-time great video games
22,Quiz: How many 2022 sport moments do you remember?,https://www.bbc.com/sport/64086506,Sport,Test yourself on memorable sporting moments from 2022
23,Prince Harry's Spare to kick off 2023 book bonanza,/news/entertainment-arts-63708229,Entertainment & Arts,Join us as we lift the curtain on some of the most anticipated books coming our way next year.
24,An answer to India's flower waste,/future/article/20221208-fleather-the-vegan-leather-made-of-indias-flower-waste,,
25,In defence of real Christmas trees,/future/article/20221213-why-christmas-trees-may-be-good-for-the-environment,,
26,What would a green World Cup look like?,/future/article/20221206-what-would-a-green-world-cup-look-like,,
27,The truth about a miracle cure that doesn’t exist,/news/blogs-trending-64070190,Health,Why has a fictional miracle cure taken off online - and who's making money out of it?
28,Amazon could be blamed for fake Louboutin ads - EU,/news/technology-64065290,Technology,
29,Melanie C pulls out of NYE concert in Poland,/news/entertainment-arts-64101556,Entertainment & Arts,
30,"Young, female and addicted in Somalia",/news/world-africa-64032267,Africa,
31,"Airport strikes could go on for months, warns union",/news/business-64060584,Business,
32,Can robots stop billions of litres of water leaks?,/news/science-environment-64052740,Science & Environment,
33,Blind BBC reporter defeats mugger who stole phone,/news/uk-64100975,UK,
34,US winter storm in pictures,/news/in-pictures-64074758,In Pictures,
35,Escaping Nile floods to a minefield,/news/world-africa-64032266,Africa,
36,Young photographers scoop national awards,/news/uk-england-south-yorkshire-64002737,Sheffield & South Yorkshire,
37,In pictures: An explosion of joy as Argentina wins,/news/world-latin-america-64026174,Latin America & Caribbean,
38,Argentina win 2022 World Cup final - in pictures,/sport/football/64020038,Football,
