,title,href,tag,summary
0,Travis King in US custody after North Korea expulsion,/news/world-us-canada-66939470,US & Canada,The 23-year-old soldier was transferred into US custody in China after being deported from North Korea.
1,Republicans to square off in second presidential debate,https://www.bbc.com/news/live/world-us-canada-66917041,US,
2,Armenians rush to help Karabakh ‘brothers and sisters’,https://www.bbc.com/news/world-europe-66937303,Europe,
3,Retail's billion-dollar makeover,https://www.bbc.com/worklife/article/20230922-how-billion-dollar-store-make-overs-are-taking-on-the-retail-apocalypse,Worklife,
4,How spaceflight alters the human body,https://www.bbc.com/future/article/20230927-what-a-long-term-mission-in-space-does-to-the-human-body,Future,
5,A QAnon 'queen' and the town that wants her gone,/news/world-us-canada-66930536,US & Canada,Romana Didulo and her band of followers have hunkered down in a rural Canadian village.
6,"He shook Biden’s hand, but may vote for Trump again",/news/world-us-canada-66940361,US & Canada,The current and former presidents are wooing striking auto workers in Michigan ahead of 2024 battle.
7,Five things we learned from latest Trump aide book,/news/world-us-canada-66932585,US & Canada,Cassidy Hutchinson book alleges sexual assault at a rally and burning of documents in the White House.
8,Isak scores winner as Newcastle beat Man City,/sport/football/66862351,Football,"Eddie Howe says his Newcastle side want to ""go one better"" than last season's runners-up finish in the Carabao Cup after beating Manchester City to advance."
9,Szoboszlai scores stunner in Liverpool EFL Cup win,/sport/football/66862357,Football,"Cody Gakpo, Dominik Szoboszlai and Diogo Jota score as Liverpool come from behind to beat Leicester in the Carabao Cup."
10,Jackson strike gives Chelsea edge over Brighton,/sport/football/66862359,Football,Mauricio Pochettino says Chelsea's victory over Brighton in the third round of the Carabao Cup 'must be' the turning point of their season.
11,The world's quickest electric vehicle,/reel/video/p0gh2kvj/the-world-s-quickest-electric-vehicle,,
12,The unsolved problem as urgent as climate change,/reel/video/p0gfyls0/are-we-at-the-brink-of-a-bug-pocalypse-,,
13,The 19th Century cycling pioneer,/reel/video/p0gfp509/the-first-person-to-cycle-the-globe-on-a-penny-farthing,,
14,A 3D map of an eerie asteroid,https://www.bbc.com/future/article/20230927-a-far-off-asteroid-brought-to-life-in-3d,Future,An intriguing view of Nasa's close encounter
15,Four of the best countries for women,https://www.bbc.com/travel/article/20230927-the-worlds-most-gender-equal-countries,Travel,What's it really like to live in these top-rated places?
16,US auto strike: Eye-popping CEO pay,https://www.bbc.com/worklife/article/20230925-uaw-auto-strike-why-us-automotive-ceos-make-more-than-global-competition,Worklife,Why American executives earn so much more than their global counterparts
17,Can Victoria's Secret fix its image?,https://www.bbc.com/culture/article/20230926-can-victorias-secret-fix-its-image,Culture,A new film aims to re-cast the famous lingerie brand's problematic image
18,Mutilated bodies dumped in Mexico's business capital,https://www.bbc.com/news/world-latin-america-66911902,Latin America & Caribbean,The remains of a dozen people are found strewn across the Mexican city of Monterrey
19,NFL's Kelce breaks silence on 'amazing' Taylor Swift,https://www.bbc.com/news/world-us-canada-66940478,US,"Travis Kelce says his rumoured love interest's appearance at his game was ""awesome"""
20,Biden dog bites another Secret Service agent,https://www.bbc.com/news/world-us-canada-66932087,US,This is the 11th time the dog has bitten a guard at the White House or Biden family home
21,"A 2,000-year-old method to water crops",/future/article/20230922-the-ancient-sri-lankan-tank-cascade-systems-tackling-drought,,
22,The goats fighting fires in LA,/future/article/20230922-these-la-goats-help-stop-wildfires,,
23,The city that went green to keep cool,/future/article/20230922-how-medellin-is-beating-the-heat-with-green-corridors,,
24,US accuses Amazon of illegal monopoly,/news/business-66920137,Business,"The Federal Trade Commission alleges Amazon uses ""unfair"" and ""illegal"" strategies to keep power."
25,Rina Sawayama: Therapy made me realise I was groomed at 17,/news/entertainment-arts-66879351,Entertainment & Arts,
26,The day sea-dipping elephants stunned a Welsh town,/news/uk-wales-66855122,Wales,
27,Owner's husband hunted in NY nursery fentanyl death,/news/world-us-canada-66873058,US & Canada,
28,One in six UK species at risk of extinction - report,/news/science-environment-66923930,Science & Environment,
29,GB News suspends Wootton after Fox comments,/news/uk-66940513,UK,
30,"Disinformation most active on X, EU says",/news/technology-66926080,Technology,
31,Ploughing: A snapshot of a disappearing skill,/news/uk-england-norfolk-66869691,Norfolk,
32,"Glasses, goats and goodbyes: Africa’s top shots",/news/world-africa-66877589,Africa,
33,Historic scenes for King and Queen on their French visit,/news/in-pictures-66867649,In Pictures,
34,Adeiladau anghofiedig Cymru // Wales' forgotten buildings,/newyddion/66858159,Cylchgrawn,
35,'Accidental' rock photographer wins lifetime prize,/news/entertainment-arts-66817901,Entertainment & Arts,
