,title,href,tag,summary
0,"Tory MP David Davis to PM: In the name of God, go",/news/uk-politics-60054294,UK Politics,The veteran Conservative backbencher has dramatically called for Boris Johnson to resign.
1,Biden's first year in office - in six charts,https://www.bbc.com/news/world-us-canada-60044270,US,
2,US officers charged with fatally shooting girl,https://www.bbc.com/news/world-us-canada-60048887,US,
3,Italy's surprising capital of coffee,https://www.bbc.com/travel/article/20220119-trieste-italys-surprising-capital-of-coffee,Travel,
4,The games that can make millionaires,https://www.bbc.com/future/article/20220118-how-top-esports-talents-are-plucked-from-obscurity,Future,
5,Tory MP defects as ex-minister tells Johnson to go,/news/live/uk-politics-60046632,UK Politics,But the prime minister makes clear he will not resign during fiery exchanges over No 10 parties at PMQs.
6,New images show scale of damage to ash-laden Tonga,/news/world-asia-60034179,Asia,Trees are torn down and buildings ripped apart following Saturday's tsunami triggered by a volcano.
7,'World's most valuable house' - which no one wanted to buy,/news/world-europe-60042021,Europe,"The BBC’s Rome correspondent Mark Lowen takes a look inside Villa Aurora, which failed to sell at auction."
8,Arsenal news conference & transfers latest,/sport/live/football/60050398,Football,"Mikel Arteta faces the media ahead of Arsenal's Carabao Cup semi-final second leg against Liverpool, plus the latest transfer news."
9,Is Mourinho running out of time at Roma?,/sport/football/60044439,European Football,Jose Mourinho was once dismissive of the Europa League - now Europe's new third-tier Conference League could be key to his chances of success as manager at Roma.
10,Maxwell smashes 154 to break BBL record,/sport/cricket/60050911,Cricket,Glenn Maxwell hits 154 for Melbourne Stars against Hobart Hurricanes to break the record for the highest individual score in the Big Bash League.
11,The Himalayan lake of opulent houseboats and floating gardens,/reel/video/p0bhybmw/the-magical-lake-of-kashmir-and-its-splendid-houseboats,,
12,"Sweden's 'exceptional' 7,000-year-old burial comes to life",/reel/video/p0bhtslq/how-sweden-s-mysterious-seated-woman-came-to-life,,
13,How to use brown fat to burn more calories,/reel/video/p097ylw3/is-exercising-in-the-cold-good-for-you-,,
14,The films tackling senseless violence,https://www.bbc.com/culture/article/20220118-the-films-trying-to-make-sense-of-senseless-violence,Culture,How cinema has reckoned with the horrifying epidemic of US school shootings
15,The green reason to buy a coal mine,https://www.bbc.com/future/article/20220118-the-environmental-case-for-buying-a-coal-mine,Future Planet,The surprising environmental case for investing in fossil fuels
16,How Arctic kids learn resilience,https://www.bbc.com/future/article/20220105-the-arctic-parenting-style-that-fosters-resilience,Future,"To raise free-thinking kids, Sámi reindeer herders follow this age-old tradition"
17,The Spanish town lost in France,https://www.bbc.com/travel/article/20220117-aranese-spains-little-known-language,Travel,It has been caught between larger kingdoms and nation-states for centuries
18,The CV ageism that hurts workers,https://www.bbc.com/worklife/article/20220118-cv-ageism-can-you-be-the-wrong-age-for-a-job,Worklife,Both older and younger workers alike can fall victim to age-based judgement
19,Gen Z on battling soaring prices for the first time,https://www.bbc.com/news/business-60024716,Business,Those aged 18 to 25 have never experienced inflation before in their lives - how are they coping?
20,The resilience of a survivor of five suicide attacks,https://www.bbc.com/news/world-africa-60039136,Africa,Former BBC reporter Mohamed Moalimu is recovering after being targeted on Sunday in Somalia
21,The rhino that became an icon for peace,/future/article/20220111-the-rhinos-bringing-peace-in-india,,
22,The big question for lithium batteries,/future/article/20220105-lithium-batteries-big-unanswered-question,,
23,The new use for abandoned oil rigs,/future/article/20210126-the-richest-human-made-marine-habitats-in-the-world,,
24,'The traditional job interview is dead',https://www.bbc.co.uk/news/av/business-60043376,Business,"Rachael Flanagan, founder and CEO of cleaning company Mrs Buckét, shares her business advice."
25,Untreated sewage regularly dumped illegally,/news/uk-60040162,UK,
26,WHO warns Covid not over amid Europe case records,/news/world-europe-60048390,Europe,
27,"U2's name and songs make me cringe, says Bono",/news/entertainment-arts-60051813,Entertainment & Arts,
28,Influencers called out over social media ads,/news/newsbeat-60040262,Newsbeat,
29,Face mask rules and Covid passes to end in England,/news/uk-60047438,UK,
30,"Plastic crisis needs binding treaty, report says",/news/science-environment-60026748,Science & Environment,
31,Celebrating creativity in the construction industry,/news/in-pictures-59952716,In Pictures,
32,Stunning Wolf Moon dazzles around the world,/news/in-pictures-60038631,In Pictures,
33,In pictures: Mourners line the streets for Ashling Murphy,/news/world-europe-60035626,Europe,
34,Italian fashion great Nino Cerruti dies aged 91,/news/uk-england-derbyshire-60011771,Europe,
35,Photographers flock to overflowing 'plug holes',/news/uk-england-derbyshire-59966942,Derby,
