,title,href,tag,summary
0,Ukraine aiming to arm a million people,/news/live/world-europe-61404062,Europe,"The country is entering a new, long phase of the war with dark days ahead, its defence minister says."
1,US basketball star has Russian detention extended,/news/world-us-canada-61417928,US & Canada,
2,Elon Musk puts $44bn Twitter deal on hold,/news/business-61433724,Business,
3,Eleven migrants drown trying to reach US territory,/news/world-us-canada-61417926,US & Canada,
4,Alexander-Arnold or James - who gets your vote?,/sport/football/61302842,Football,
5,Worry and fear as US faces baby formula shortage,/news/world-us-canada-61445314,US & Canada,"With stocks running low across the country, parents are scrambling to find ways to feed their children."
6,Ukraine tries first Russian soldier for war crimes,/news/world-europe-61441907,Europe,"In the first such trial of the war, the defendant, 21, is accused of killing an unarmed civilian."
7,Violence at funeral for Al Jazeera reporter,/news/world-middle-east-61437601,Middle East,"Police with riot gear hit mourners, saying they were pelted with stones, as crowds carry her coffin."
8,GB's Asher-Smith comes third in Doha opener,/sport/athletics/61445394,Athletics,British 200m world champion Dina Asher-Smith is well beaten in her Diamond League opener as American Gabby Thomas serves up a reminder of the event's strength in depth.
9,De Bruyne & Salah up for top Premier League award,/sport/football/61433663,Football,Manchester City's Kevin de Bruyne and Liverpool's Mohamed Salah are among eight nominees for the Premier League player of the season award.
10,Newcastle appoint Golf Saudi chief as director,/sport/football/61433365,Football,Newcastle United appoint Majed Al Sorour - the chief executive of Golf Saudi - as a director of the club.
11,The forgotten genius who invented our future,/reel/video/p0c6k16c/the-forgotten-genius-who-invented-our-future,,
12,What Marvel got wrong about the God of Thunder,/reel/video/p0c664wj/was-thor-really-an-all-conquering-hero-,,
13,How the rebirth of supersonic flight could change everything,/reel/video/p0c5mvlh/can-supersonic-flight-ever-be-sustainable-,,
14,The offices turning into luxury flats,https://www.bbc.com/worklife/article/20220505-the-office-spaces-transforming-into-luxury-apartments,Worklife,"Office buildings are ghost towns, so high-end apartments are taking their place"
15,How high is your toxic 'body burden'?,https://www.bbc.com/future/article/20220512-the-chemicals-that-linger-for-decades-in-your-blood,Future,There are chemicals that linger for decades in your blood
16,Italy's beloved 'ugly' city,https://www.bbc.com/travel/article/20220508-livorno-tuscanys-unattractive-unmissable-town,Travel,It's overshadowed by its more famous Tuscan neighbours. And that's a shame.
17,People who 'danced themselves to death',https://www.bbc.com/culture/article/20220512-the-people-who-danced-themselves-to-death,Culture,The bizarre 16th Century 'dance plague' that gripped French city Strasbourg
18,Dropping ethnic pay gap reporting 'nonsensical',https://www.bbc.com/news/business-61443538,Business,A government decision not to extend pay gap reporting to racial disparities has been criticised by...
19,Moon soil used to grow plants for first time,https://www.bbc.com/news/science-environment-61434295,Science & Environment,The research is an important step towards making long-terms stays on the moon possible
20,Village pub asked to change name by Vogue magazine,https://www.bbc.com/news/uk-england-cornwall-61435596,Cornwall,"The landlord of The Star Inn at Vogue says he found Condé Nast's request ""hilariously funny"""
21,The UK’s disappearing village,/future/article/20220506-the-uk-climate-refugees-who-wont-leave,,
22,The hidden volcano beneath a city,/future/article/20220427-how-taiwan-discovered-an-active-volcano-on-its-doorstep,,
23,The forest tended by an elusive giant,/future/article/20220414-how-africas-forest-elephants-help-fight-climate-change,,
24,Coleen Rooney: My online post was a last resort,/news/entertainment-arts-61433801,Entertainment & Arts,"Mrs Rooney appeared in the witness box on day four of the libel case, brought by Rebekah Vardy."
25,Could solar solve Puerto Rico's energy nightmare?,https://www.bbc.co.uk/news/business-61153251,Business,
26,Tech Tent: Learning the lessons of Wannacry,https://www.bbc.co.uk/sounds/play/w3ct3751,Technology,
27,First picture of monster black hole in our galaxy,/news/science-environment-61412463,Science & Environment,
28,North Korea announces first death from Covid-19,/news/world-asia-61432084,Asia,
29,Watchdog highlights 'precarious state' of nature,/news/science-environment-61414475,Science & Environment,
30,The enduring intrigue and theories around crop circles,/news/entertainment-arts-61332202,Entertainment & Arts,
31,Mythological family photos win top prize,/news/in-pictures-61073684,In Pictures,
32,Africa's top shots: Big knits and giant gems,/news/world-africa-61399819,Africa,
33,From India to UK: An immigrant's snapshots from 1950s,/news/world-asia-india-61389834,India,
34,Archive sheds new light on Tutankhamun discovery,/news/world-middle-east-61394416,Middle East,
35,Photo map of Queen's visits released to mark jubilee,/news/uk-england-61377866,England,
