,title,href,tag,summary
0,Suicide bombing hits Afghan mosque during prayers,/news/world-asia-58925863,Asia,Explosions at a Shia mosque in Kandahar kill more than 30 people during Friday worship.
1,US to lift travel ban on 8 November,/news/world-us-canada-58929441,US & Canada,
2,Grieving Norwegian town seeks answers after murders,https://www.bbc.com/news/world-europe-58923879,Europe,
3,Why it's time to retire the term 'late bloomer',https://www.bbc.com/worklife/article/20211007-why-saying-late-bloomer-is-wrong,Worklife,
4,How 'nice guys' became the real villains,https://www.bbc.com/culture/article/20211014-netflixs-you-and-how-nice-guys-became-the-real-villains,Culture,
5,MP Sir David Amess stabbed at constituency meeting,/news/uk-58929453,UK,"Police say a man was arrested and a knife was recovered after the incident in Leigh-on-Sea, Essex."
6,The mystery of how long Covid damages our memory,/news/world-us-canada-58918869,US & Canada,"Since Chrissy Gibson was diagnosed with Covid-19, she has had to re-learn many aspects of her life."
7,Adele's comeback single: Hit or miss?,/news/entertainment-arts-58910034,Entertainment & Arts,Easy On Me is the singer's first new material since 2015 - but what does it tell us about the star?
8,IPL final: Chennai bat first after Kolkata win toss - radio & text,/sport/live/cricket/56643384,Cricket,Follow live text and radio commentary as Chennai Super Kings face Kolkata Knight Riders in the Indian Premier League final.
9,"Premier League news conferences - Guardiola, Solskjaer, Tuchel & Bruce",/sport/live/football/58924986,Football,"Thomas Tuchel, Pep Guardiola and Steve Bruce among several top-flight managers due to speak to the media."
10,Bruce to stay in charge against Spurs,/sport/football/58928166,Football,Steve Bruce will stay in charge of Newcastle for their Premier League game against Tottenham on Sunday.
11,The 420-year-old instructions for 'immortality',/reel/video/p09ykqlg/the-alchemist-believed-to-have-found-the-key-to-immortality,,
12,The unexpected obsession of China's super-rich,/reel/video/p08t6mv1/the-etiquette-school-for-china-s-super-rich,,
13,The secret chamber full of forbidden ancient erotica,/reel/video/p09xtq4m/the-forbidden-erotica-of-ancient-pompeii,,
14,Spain's untapped 'liquid gold',https://www.bbc.com/travel/article/20211014-spains-untapped-liquid-gold,Travel,It's one of the last places in Europe to carry on this age-old tradition
15,Is being 'average' enough at work?,https://www.bbc.com/worklife/article/20211008-why-not-every-good-worker-has-to-be-a-superstar,Worklife,Not the superstar at your job? You don’t need to be to succeed
16,The greatest music films ever made,https://www.bbc.com/culture/article/20211012-how-todd-haynes-the-velvet-underground-reclaims-the-past,Culture,Why 2021 is a groundbreaking year for music documentaries
17,Saving California's rarest butterflies,https://www.bbc.com/future/article/20211013-the-race-to-save-californias-endangered-butterflies,Future Planet,The endangered butterflies have a taste for Gatorade
18,India's many hidden languages,https://www.bbc.com/future/article/20211014-the-man-who-found-indias-hidden-languages,Future,India is home to hundreds of languages that have been hiding in plain sight
19,Clueless actress: I was addicted to painkillers,https://www.bbc.com/news/entertainment-arts-58924426,Entertainment & Arts,"Stacey Dash has revealed how she ""lost everything"""
20,New Zealand city parts ways with its wizard,https://www.bbc.com/news/world-asia-58924306,Asia,Christchurch was the only city in the world with its own official wizard
21,The unexpected benefits of tiger sharks,/future/article/20211007-why-sharks-help-fight-climate-change-in-the-oceans,,
22,Costa Rica's answer to 'range anxiety',/future/article/20210928-costa-ricas-answer-to-range-anxiety,,
23,The ancient tradition reviving in Spain,/future/article/20210923-the-revival-of-spains-epic-pastoral-migration,,
24,Idris Elba on his 'culture rich' Western film,/news/entertainment-arts-58920492,Entertainment & Arts,Idris Elba chats to Naga Munchetty about his role in The Harder They Fall.
25,One third of UK farmers could be depressed,/news/science-environment-58911758,Science & Environment,
26,"Last chance to find Covid origins, WHO says",/news/health-58905945,Health,
27,Self-driving cars plague San Francisco street,/news/technology-58928706,Technology,
28,Overseas abattoir workers to get temporary visas,/news/business-58906114,Business,
29,Rich countries' CO2 emissions rose rapidly in 2021,/news/science-environment-58897805,Science & Environment,
30,Banksy's Love is in the Bin sells for record £16m,/news/entertainment-arts-58908768,Entertainment & Arts,
31,In pictures: Joy through a lens,/news/in-pictures-58884549,In Pictures,
32,Africa's top shots: Superfans and sea patrols,/news/world-africa-58909966,Africa,
33,'Explosive sex' wins top wildlife photo award,/news/science-environment-58888305,Science & Environment,
34,Your pictures on the theme of 'derelict',/news/in-pictures-58841907,In Pictures,
35,Photo of ants feeding off honeydew wins competition,/news/in-pictures-58828861,In Pictures,
