,title,href,tag,summary
0,AI chatbots 'may soon be more intelligent than us',/news/world-us-canada-65452940,US & Canada,"Artificial intelligence pioneer Geoffrey Hinton quits Google, saying he now regrets his work."
1,More than 100 police hurt in French May Day protests,https://www.bbc.com/news/world-europe-65449777,Europe,
2,Yellen warns US could run out of cash in a month,https://www.bbc.com/news/world-us-canada-65452444,US,
3,The 17 most eye-catching looks at the Met Gala,https://www.bbc.com/news/entertainment-arts-65413976,Entertainment & Arts,
4,A history of art in 7 colours,https://www.bbc.com/culture/article/20230428-a-history-of-art-in-7-colours,Culture,
5,"Russia troop deaths hit 20,000 in five months - US",/news/world-europe-65451487,Europe,"Another 80,000 Russian soldiers have been wounded in fighting since December, the White House estimates."
6,Palestinian hunger striker dies in Israel prison,/news/world-middle-east-65452946,Middle East,"Israel says Khader Adnan, an Islamic Jihad activist, had refused any medical tests or treatment."
7,HSBC says £1 SVB UK buyout boosted profit by $1.5bn,/news/business-65332752,Business,HSBC bought Silicon Valley Bank's British business in a deal led by the government and the Bank of England.
8,Leicester & Everton remain in trouble after chaotic draw,/sport/football/65370333,Football,Leicester City and Everton have to settle for a draw in a chaotic match which leaves both in deep trouble at the wrong end of the Premier League table.
9,The two-inch error that stopped an Olympic final,/sport/gymnastics/65426779,Sport,A 16-year-old Allana Slater had a choice: say nothing or trust her instincts and speak up... She chose the latter.
10,Arsenal 'hurt and empty' but proud of defying odds,/sport/football/65452423,Football,"Despite Arsenal's last-gasp Women's Champions League semi-final defeat by Wolfsburg, there was a sense of immense pride for manager Jonas Eidevall."
11,King Charles to wear golden robes for Coronation,https://www.bbc.com/news/uk-65448709,UK,"The King will wear layers of glittering garments, some of which were created for George V"
12,Your full guide to how coronation day will unfold,https://www.bbc.com/news/uk-65342840,UK,"Processions, ancient rituals, a fly-past and the crowning moment - the key stages of King Charles III's coronation"
13,The hidden power of the coronation,https://www.bbc.com/future/article/20230428-the-surprising-power-of-pomp-and-ceremony,Future,The pomp and ceremony of a state ritual can act as a social glue
14,The ancient trick that will help you make better decisions,/reel/video/p0fg233t/the-ancient-trick-that-will-help-you-make-better-decisions,,
15,The Nazi's secret underground stash of stolen treasure,/reel/video/p0fjpb2b/the-old-salt-mine-where-nazis-hid-stolen-art,,
16,How Norway's princess stirred a controversy,/reel/video/p0fjyx6s/exclusive-interview-with-princess-m-rtha-louise-of-norway,,
17,A Cold War time capsule is now open,https://www.bbc.com/travel/article/20230501-regan-vest-inside-denmarks-secret-nuclear-bunker,Travel,"Only 50,000 visitors are permitted each year"
18,The best Met Gala looks through the decades,https://www.bbc.com/culture/article/20230428-met-gala-2023-eight-of-the-best-looks-over-the-decades,Culture,"As it turns 75, we look back at the event's most memorable themes and outfits"
19,The puzzle of Neanderthal culture,https://www.bbc.com/future/article/20230428-the-puzzle-of-neanderthal-culture-and-aesthetics,Future,They may have even had an appreciation of aesthetics
20,How are mums working without childcare?,https://www.bbc.com/worklife/article/20230426-the-mothers-working-from-home-without-childcare,Worklife,"Even as many kids have returned to care, not every mother has the help she needs"
21,Why YouTube is mad at Canada,https://www.bbc.com/news/world-us-canada-65420133,Canada,A law that seeks to give Canadian artists a boost online has led to accusations of censorship
22,Banana artwork in Seoul museum eaten by visitor,https://www.bbc.com/news/world-asia-65446331,Asia,A university student told staff he ate the fruit on display because he was hungry
23,Trevelyan relative would consider famine payment,https://www.bbc.com/news/uk-northern-ireland-65440287,Northern Ireland,"An ex-BBC journalist says her ancestor, referenced in the Fields of Athenry, failed Irish people"
24,The revival of a historic Italian fruit,/future/article/20230424-how-agrivoltaics-helped-save-italys-citron-and-lemon-trees,,
25,The first climate-resilient nation?,/future/article/20230418-how-caribbean-island-dominica-is-fighting-climate-impacts,,
26,A major positive climate tipping point,/future/article/20230414-climate-change-why-2023-is-a-clean-energy-milestone,,
27,Hollywood screenwriters go on strike over pay,/news/entertainment-arts-65447046,Entertainment & Arts,TV and movie writers will walk out on Tuesday after pay talks with major studios broke down.
28,UK chip giant Arm files for blockbuster share sale,/news/business-65445428,Business,
29,Riding the 'vomit comet' with first disabled astronaut,/news/science-environment-65380263,Science & Environment,
30,Sudanese NHS doctor finally allowed to return to UK,/news/uk-65423219,UK,
31,Parasols and prayers: Africa's top shots,/news/world-africa-65409697,Africa,
32,WHO issues alert over another India-made cough syrup,/news/world-asia-india-65395716,India,
33,Australia to ban recreational vaping,/news/world-australia-65446352,Australia,
34,The photos that chronicle the cost of dying,/news/uk-scotland-65354687,Scotland,
35,Len Goodman obituary: From the East End to Strictly stardom,/news/entertainment-arts-58929590,Entertainment & Arts,
36,Penarth: Nofio gyda'r wawr yn y môr // Sea swimming at dawn,/newyddion/65372997,Cylchgrawn,
37,In pictures: Muslims around the world celebrate Eid,/news/in-pictures-65346964,In Pictures,
38,Garlands and gymnasts: Africa's top shots,/news/world-africa-65334211,Africa,
