,title,href,tag,summary
0,Poland blocks hundreds of migrants at Belarus border,/news/world-europe-59206685,Europe,Poland has accused Belarus of encouraging people to enter the country illegally.
1,Mock-up US warships pictured in China desert,https://www.bbc.com/news/world-asia-china-59210417,China,
2,"New York scrambles for plates, staff and loo roll",https://www.bbc.com/news/business-59140960,Business,
3,The parents who track their children,https://www.bbc.com/worklife/article/20211105-the-parents-who-track-their-children,Worklife,
4,The once-popular dogs that vanished,https://www.bbc.com/future/article/20211105-the-bizarre-dog-breeds-time-forgot,Future,
5,"Stay angry on climate, Obama tells young people",/news/science-environment-59210395,Science & Environment,"The ex-US president calls for global unity and condemns ""active hostility"" towards climate science."
6,Joyful reunions in US as 20-month travel ban ends,/news/world-us-canada-59201107,US & Canada,"There are tears, hugs and balloons galore as the first international visitors arrive in US airports."
7,Travis Scott sued over deadly US festival crush,/news/world-us-canada-59205570,US & Canada,The rapper faces legal action after at least eight people were killed during his Astroworld festival.
8,'Drained' India 'need rest' - Shastri,/sport/cricket/59206954,Cricket,"India players are ""physically and mentally drained"" and ""need a rest"" says coach Ravi Shastri after ending their disappointing T20 World Cup campaign with a win over Namibia."
9,Newcastle appoint Howe as head coach,/sport/football/59172217,Football,Newcastle United appoint former Bournemouth boss Eddie Howe to succeed Steve Bruce as the club's head coach.
10,Yorkshire investigating new racism allegation,/sport/cricket/59213073,Cricket,"A former Yorkshire academy player says he was racially abused by a member of staff as a 16-year-old, in the latest allegation of racism against the club."
11,Ancient DNA reveals the truth about Vikings,/reel/video/p0b2t4nk/why-vikings-weren-t-who-we-thought-they-were,,
12,How we may generate energy in 2045,/reel/video/p0b0w3b0/the-energy-sources-of-the-future,,
13,How this simple habit can improve your fitness,/reel/video/p0b22fj1/why-australians-love-going-barefoot,,
14,The troubled city filmmakers love,https://www.bbc.com/culture/article/20211105-belfast-the-troubled-city-filmmakers-love,Culture,How cinema has captured the extraordinary light and shade of Belfast
15,Britain's abandoned 'outback' island,https://www.bbc.com/travel/article/20211107-inchconnachan-the-british-island-where-wallabies-rule,Travel,Adventure-seekers can camp on the isle with Scotland's most exotic mammal
16,Why it's wrong to dismiss demisexuality,https://www.bbc.com/worklife/article/20211101-why-demisexuality-is-as-real-as-any-sexual-orientation,Worklife,No attraction without connection? Understanding this sexual orientation
17,The long history of vaccine mandates,https://www.bbc.com/future/article/20211029-why-mandatory-vaccination-is-nothing-new,Future,Compulsory vaccinations have been with us for centuries
18,Missing girl found after using viral TikTok sign,https://www.bbc.com/news/technology-59206549,Technology,The hand gesture asking for help led to the rescue of a missing teenager in the US
19,Photographer captures stunning wildlife shots in lunch break,https://www.bbc.com/news/uk-england-lincolnshire-59132484,UK,Amateur photographer Dave Newman captures impressive wildlife photos
20,Buyers show remorse over pandemic purchases,https://www.bbc.com/news/business-59207124,Business,"One in 10 regret spending on hot tubs, pizza ovens and other lockdown purchases"
21,Bangladesh's unusual use for oysters,/future/article/20210827-the-unlikely-protector-against-rising-seas-in-bangladesh,,
22,The ancient Persian way to keep cool,/future/article/20210810-the-ancient-persian-way-to-keep-cool,,
23,California's last-chance butterfly lab,/future/article/20211013-the-race-to-save-californias-endangered-butterflies,,
24,"How will the US deal with a shortage of 80,000 truckers?",https://www.bbc.co.uk/news/business-59136957,Business,The chronic lack of lorry drivers in the US is adding to supply chain woes - and could get worse.
25,Ex-Corrie star Victoria Ekanoye has breast cancer,https://www.bbc.co.uk/news/articles/c166r3rerg1o,Entertainment,
26,Fossil fuel industry has biggest delegation at COP26,/news/science-environment-59199484,Science & Environment,
27,Twitter poll calls on Musk to sell 10% Tesla stake,/news/business-59182278,Business,
28,"Antiviral Covid pill 89% effective, Pfizer says",/news/health-59178291,Health,
29,As it happened: Obama speaks at COP26 climate summit,/news/live/world-59192126,World,
30,Singer's head 'forced down toilet by security',/news/uk-england-london-59208362,London,
31,Africa's top shots: Gazing veterans and ancient skulls,/news/world-africa-59161935,Africa,
32,Northern Lights splendour captured across Cumbria,/news/uk-england-cumbria-59153902,Cumbria,
33,In pictures: Scotland's young climate activists,/news/uk-scotland-59109736,Scotland,
34,In pictures: Leaders gather for COP26,/news/in-pictures-59118673,In Pictures,
35,"Flowers, fruit and bakes compete for best in show",/news/in-pictures-59050515,In Pictures,
