,title,href,tag,summary
0,New York apartment block fire kills 19,/news/world-us-canada-59931896,US & Canada,"There were nine children among the fatalities in the fire, which took hold on Sunday in the Bronx."
1,Djokovic fights deportation in Australian court,/news/live/world-australia-59909477,Australia,
2,NFL live updates & radio on final day of regular season - 49ers or Saints to reach play-offs?,/sport/live/american-football/58482379,American Football,
3,Australia says Djokovic given no promises on visa,/news/world-australia-59929586,Australia,
4,At least 164 killed in Kazakhstan unrest - reports,/news/world-asia-59927267,Asia,
5,Baby lost in Kabul chaos is reunited with family,/news/world-asia-59926854,Asia,The infant was lost after being handed to an American soldier at Kabul airport in August.
6,Survivor tells of Pakistan snowstorm horror,/news/world-asia-59927266,Asia,Samina was one of thousands trapped in freezing conditions trying to reach the town of Murree.
7,Ten die after Brazilian cliff collapses onto boats,/news/world-latin-america-59923900,Latin America & Caribbean,Another 32 were injured when the cliff fell onto boats in a lake in the south-east of the country.
8,"'England show spirit, bottle & backbone'",/sport/cricket/59927259,Cricket,"England showed spirit, bottle and backbone to earn a draw in the fourth Ashes Test in Sydney, according to Jonathan Agnew."
9,Liverpool cases were 'a lot of false positives',/sport/football/59931656,Football,Jurgen Klopp says a Covid outbreak that led to the postponement of Liverpool's Carabao Cup semi-final first leg at Arsenal contained a number of false positives.
10,Juve fight back to beat Roma in thriller,/sport/football/59930854,European Football,A stunning comeback from Juventus sees them score three goals in seven minutes to come from 3-1 down and beat Roma in Serie A.
11,The Soviet palace that people love to hate,/reel/video/p0bfsd4y/the-soviet-palace-that-people-love-to-hate,,
12,Why this man believes he will live to 180 years old,/reel/video/p093919p/can-science-reverse-the-ageing-process-,,
13,A marvel of engineering in the world's highest mountain range,/reel/video/p0bf49jv/a-close-look-at-the-highest-railway-bridge-in-the-world,,
14,Why we're in 'the age of fake islands',https://www.bbc.com/future/article/20220105-why-were-in-the-age-of-artificial-islands,Future,A visual tour of humanity's bold attempts to create artificial land
15,Is this Canada's 'Stonehenge'?,https://www.bbc.com/travel/article/20220109-iniskim-umaapi-is-this-canadas-stonehenge,Travel,It's one of the oldest religious monuments in the world
16,The end of the 'flexible work penalty'?,https://www.bbc.com/worklife/article/20220103-will-workers-continue-to-pay-a-price-for-flexibility,Worklife,Why workers are still losing pay and promotions when they work remotely
17,22 films to watch in 2022,https://www.bbc.com/culture/article/20220106-22-films-to-watch-in-2022,Culture,Including The Batman and a Buzz Lightyear origin story
18,The big question for lithium batteries,https://www.bbc.com/future/article/20220105-lithium-batteries-big-unanswered-question,Future Planet,Time is growing short to figure out how to recycle lithium batteries effectively
19,Why are scientists so intrigued by the food matrix?,https://www.bbc.co.uk/food/articles/food_matrix,Food,It might just re-write the rulebook on what’s healthy and what’s not
20,Why you don't need to go on a 'sugar detox',https://www.bbc.co.uk/food/articles/sugar_detox,Food,"Sugar is the simplest form of energy our body uses, but it’s somehow the most complicated"
21,The new use for abandoned oil rigs,/future/article/20210126-the-richest-human-made-marine-habitats-in-the-world,,
22,The sector behind a third of our waste,/future/article/20211215-the-buildings-made-from-rubbish,,
23,The new weapon against climate change,/future/article/20211207-the-legal-battle-against-climate-change,,
24,The artificial intelligence that can help you become a pop star,https://www.bbc.co.uk/news/business-59878572,Business,"Computer programmes can now compose songs for you, and get them on streaming services."
25,Danny Dyer to leave EastEnders this year,/news/entertainment-arts-59857385,Entertainment & Arts,
26,Colour-changing cars and remotes that eat wi-fi,/news/technology-59895079,Technology,
27,"Deadly Omicron should not be called mild, warns WHO",/news/world-59901547,World,
28,James Webb completes epic deployment sequence,/news/science-environment-59914936,Science & Environment,
29,"No need for a fourth Covid jab yet, say UK advisers",/news/health-59915560,Health,
30,"Fix insulation to tackle energy bills, PM told",/news/business-59917640,Business,
31,Africa's top shots: Trumpeting Tutu and the New Year,/news/world-africa-59896920,Africa,
32,In pictures: Orthodox Christians celebrate Christmas,/news/in-pictures-59907964,In Pictures,
33,Astronomer hones star photo skills in lockdown,/news/uk-england-cambridgeshire-59820361,Cambridgeshire,
34,Photographer captures unique bird spoon image,/news/world-middle-east-59748062,Middle East,
35,Legend of street photography Sabine Weiss dies at 97,/news/world-europe-59816052,Europe,
