,title,href,tag,summary
0,Tyre Nichols police department to be investigated,/news/world-us-canada-64882745,US & Canada,"Meanwhile, the Memphis Police Department is set to release 20 hours of footage of January's incident."
1,Tucker Carlson said he hates Trump 'passionately',https://www.bbc.com/news/world-us-canada-64886188,US,
2,Harry and Meghan use princess title for Lilibet,https://www.bbc.com/news/uk-64890702,UK,
3,Adidas unsure what to do with €1.2bn Yeezy goods,https://www.bbc.com/news/business-64892898,Business,
4,The untold story of the Grand Canyon,https://www.bbc.com/travel/article/20230307-mary-colter-the-woman-who-shaped-the-us-southwest,Travel,
5,Two Mexico kidnap victims recovering in US hospitals,/news/world-us-canada-64882744,US & Canada,One of them has gunshot wounds and two of their friends were killed by gangs at a Mexico border town.
6,WATCH: Car crashes into cafe during podcast recording,/news/world-us-canada-64894083,US & Canada,"""It's so quiet in here,"" the host says as an out-of-control car swerves into shot behind him."
7,New protest targets Russian-style law in Georgia,/news/world-europe-64892213,Europe,Crowds return to Georgia's capital after riot police broke up a protest against a Russian-style law.
8,Fernandes an 'inspiration' to Man Utd - Ten Hag,/sport/football/64888099,Football,Manchester United manager Erik ten Hag defends captain Bruno Fernandes after criticism of his attitude in the 7-0 thrashing by Liverpool.
9,'I nearly died' - the Olympian wrongly sectioned for 26 days,/sport/rugby-union/64876477,Rugby Union,British Olympian Abi Burton was wrongly sectioned for 26 days and spent 25 days in an induced coma; this is her story.
10,How Andreescu fell back in love with tennis,/sport/tennis/64879852,Tennis,"Bianca Andreescu knew it would not be ""butterflies and rainbows every day"" after her first big title, but also didn't expect the setbacks that nearly led her to quit tennis."
11,Sworn virgins: Women who take vow of chastity and live as men,/reel/video/p0f79th5/burrneshat-the-last-sworn-virgins-of-albania,,
12,Has artificial intelligence achieved human-level consciousness?,/reel/video/p0f73vlw/can-artificial-intelligence-ever-be-sentient-,,
13,The world's most destructive material,/reel/video/p0f6jmwc/the-world-s-growing-problem-with-concrete,,
14,A cult novel's 'dangerous' diary,https://www.bbc.com/culture/article/20230307-the-power-of-forbidden-notebooks-hidden-diary-entries,Culture,The 'radical honesty' of the 1952 novel Forbidden Notebook
15,How Germany treats parental burnout,https://www.bbc.com/future/article/20230228-the-german-clinics-for-burnt-out-parents,Future,Can 'parent-child retreats' save frazzled families?
16,"Europe's little-known, progressive city",https://www.bbc.com/travel/article/20230306-the-progressive-city-that-few-know,Travel,"Surprisingly, few outside the Netherlands have even heard of it"
17,The young workers in a post-Me Too era,https://www.bbc.com/worklife/article/20230307-did-me-too-change-the-workplace-for-gen-z,Worklife,Gen Z have entered a post-reckoning workplace. What does it mean?
18,A sweet for India's festival of colours,https://www.bbc.com/travel/article/20230307-gujiya-a-flaky-pastry-to-celebrate-holi,World's Table,"In much of India, this flaky pastry is synonymous with the festival of Holi"
19,Heathrow told to cut passenger charges again,https://www.bbc.com/news/business-64885252,Business,The regulator has told the airport it needs to lower charges due to passenger numbers recovering
20,What a bird's eye view of Africa reveals,https://www.bbc.com/news/world-africa-64862607,Africa,Pictures taken from above the continent show how the landscape is transformed by human activity
21,The clothes you can't recycle,/future/article/20230227-how-to-recycle-your-clothes,,
22,How longer weekends help the planet,/future/article/20230220-is-a-4-day-workweek-good-for-the-climate,,
23,Can the unborn have a say on climate?,/future/article/20230215-should-future-generations-have-climate-rights,,
24,Breakthrough as eggs made from male mice cells,/news/science-environment-64893170,Science & Environment,"Researchers have created eggs from the cells of male mice, raising the prospect of male couples..."
25,Business group boss steps aside after misconduct claims,/news/business-64861370,Business,
26,Why Lineker's comments present problem for the BBC,/news/entertainment-arts-64889868,Entertainment & Arts,
27,Weight loss drug semaglutide approved for NHS use,/news/health-64874243,Health,
28,Invasive plants outnumber British flora - report,/news/science-environment-64842402,Science & Environment,
29,TikTok launches plans to allay China security fears,/news/technology-64887704,Technology,
30,Bindi Irwin reveals endometriosis struggle,/news/world-australia-64884116,Australia,
31,Sunrise swim celebrates International Women's Day,/news/uk-scotland-64889062,Scotland,
32,Do you know this baby? Putting names to archive photos,/news/world-africa-64451314,Africa,
33,Pet crocs and red carpets: Africa's top shots,/news/world-africa-64823868,Africa,
34,The devastated towns near Ukraine's front line,/news/world-europe-64819471,Europe,
35,Pictures show devastation after Greece train disaster,/news/world-europe-64808123,Europe,
