,title,href,tag,summary
0,"Christmas travel will spread Omicron, warns Fauci",/news/world-us-canada-59714272,US & Canada,The US infectious disease expert says the Covid-19 variant will spread - even among the vaccinated.
1,Senator vows to sink key Biden social spending plan,/news/world-us-canada-59720745,US & Canada,
2,Liz Truss replaces Lord Frost in post-Brexit talks,/news/uk-politics-59721801,UK Politics,
3,Record low turnout in Hong Kong vote,/news/world-asia-china-59717343,China,
4,La Liga: Real Madrid v Cadiz,/sport/live/football/59721556,European Football,
5,Massive anti-coup protests sweep Sudan,/news/world-africa-59719765,Africa,"Demonstrations around the country demand an end to military rule, following a coup in October."
6,Il Divo's Carlos Marin dies aged 53,/news/entertainment-arts-59722285,Entertainment & Arts,The Spanish singer is remembered by other members of the group for his unique voice and spirit.
7,Highlights from the career of architect Richard Rogers,/news/entertainment-arts-59717076,Entertainment & Arts,"Lord Rogers, who has died aged 88, designed the Millennium Dome and the Pompidou Centre."
8,"NFL scores, updates & live radio – Packers-Ravens; Lions stun Cardinals",/sport/live/american-football/58482330,American Football,"Follow live text updates and watch clips from week 15 of the NFL, with live radio commentary on the Green Bay Packers at the Baltimore Ravens."
9,Raducanu named Sports Personality of the Year,/sport/sports-personality/59687576,Sports Personality,Teenage US Open champion Emma Raducanu has been voted BBC Sports Personality of the Year 2021.
10,Spurs and Liverpool share thrilling draw,/sport/football/59625603,Football,Liverpool lose ground in the Premier League title race in a pulsating draw at Tottenham that saw Andrew Robertson sent off.
11,The city where you can't serve meat,https://www.bbc.com/travel/article/20211101-varanasi-where-its-forbidden-to-serve-meat,Travel,A meat ban has fostered creativity among a new generation of chefs
12,Why women are more sexually fluid,https://www.bbc.com/worklife/article/20210610-why-more-women-identify-as-sexually-fluid-than-men,Worklife,Why more women are embracing less rigid sexual identities – and men aren't
13,The most shocking film of 2021,https://www.bbc.com/culture/article/20210715-titane-the-most-shocking-film-of-2021,Culture,This sci-fi body horror pushes the boundaries of cinema
14,How archaeologists finally found India's 'Atlantis',/reel/video/p0bbbxjd/searching-for-the-sunken-kingdom-of-dwarka,,
15,A simple exercise that gives your brain an unexpected boost,/reel/video/p09v8wyh/a-simple-exercise-that-gives-your-brain-an-unexpected-boost,,
16,The words that reveal if you are an extrovert or an introvert,/reel/video/p09hg3dd/why-extroverts-have-their-own-extreme-language,,
17,The family rifts triggered by Christmas,https://www.bbc.com/future/article/20211201-why-family-estrangement-is-surprisingly-common,Future,Family estrangement can be painful – but there are ways to heal
18,The secret behind Rome's megastructures,https://www.bbc.com/travel/article/20211213-how-are-romes-monuments-still-standing,Travel,"When it came to building big, the Romans knew what they were doing"
19,6 major ways work changed in 2021,https://www.bbc.com/worklife/article/20211209-the-6-biggest-lessons-about-work-from-2021,Worklife,"The workplace is now different, to say the least – here are the lessons of 2021"
20,The best TV shows of 2021,https://www.bbc.com/culture/article/20210415-the-best-tv-shows-of-2021-so-far,Culture,"From Squid Game to Succession, Ted Lasso, Mare of Easttown and Maid"
21,How to make the best roast potatoes this Christmas,https://www.bbc.co.uk/food/articles/perfect_roast_potatoes,Food,Discover what makes the perfect roast potato
22,What makes a Christmas film sparkle?,https://www.bbc.co.uk/programmes/articles/3CN7Gn4V2drCmwfcLRDBzq5/festive-flicks-what-makes-a-christmas-film-sparkle,Arts,Themes and traits that make for a festive filmic feast
23,Is Gen Z changing Christmas food?,https://www.bbc.co.uk/food/articles/gen_z_christmas,Food,What might we see at the festive feast in the future?
24,The sector behind a third of our waste,/future/article/20211215-the-buildings-made-from-rubbish,,
25,The new weapon against climate change,/future/article/20211207-the-legal-battle-against-climate-change,,
26,Medieval Europe's solution to flooding,/future/article/20211129-the-medieval-dutch-solution-to-flooding,,
27,GirlsDoPorn victims win rights to their videos,/news/technology-59699234,Technology,More than 400 people can now demand the illegally obtained films be removed from websites.
28,LA rapper Drakeo the Ruler dies after stabbing,/news/world-us-canada-59720744,US & Canada,
29,Last view of mighty Webb space telescope on Earth,/news/science-environment-59692930,Science & Environment,
30,Will Omicron stall airlines' recovery in 2022?,https://www.bbc.co.uk/news/business-59654176,Business,
31,Dutch to enter tight lockdown over Omicron wave,/news/world-europe-59713503,Europe,
32,Controversial Alzheimer's drug rejected by EU,/news/health-59699907,Health,
33,Brazil wildfires killed 17 million animals - study,/news/science-environment-59670396,Science & Environment,
34,US photographer Sally Mann wins Prix Pictet award,/news/in-pictures-59682234,In Pictures,
35,Africa's top shots: Portraits in tyres and masquerades,/news/world-africa-59680921,Africa,
36,Chilean crowds celebrate death of Pinochet's widow,/news/world-latin-america-59692506,Latin America & Caribbean,
37,Sibling relationships through the lens,/news/in-pictures-58157397,In Pictures,
38,Christmas Lane lights up for charity,/news/uk-england-suffolk-59552491,Suffolk,
