,title,href,tag,summary
0,US accuses Russia of plotting fake invasion pretext,/news/world-europe-60248259,Europe,Officials say Russia could try to justify invading Ukraine with a fake attack video.
1,Olympics kick off despite Covid and boycotts,https://www.bbc.com/news/world-asia-china-60242083,China,
2,Satellites map huge plumes from leaking oil and gas,https://www.bbc.com/news/science-environment-60203683,Science & Environment,
3,10 TV shows to watch this February,https://www.bbc.com/culture/article/20220203-10-tv-shows-to-watch-this-february,Culture,
4,The impossible search for the greatest shipwreck,https://www.bbc.com/news/science-environment-60239105,Science & Environment,
5,Closely planned US raid kills Islamic State leader,/news/world-middle-east-60246129,Middle East,Abu Ibrahim al-Qurayshi blew up himself and his family during a US operation that took months to plan.
6,Australia revisited - a country changed by Covid,/news/world-australia-60216375,Australia,Nick Bryant returned to Australia to find a more inward and fractured nation than the one he left behind.
7,'All-American girl' turned jihadist denied bail,/news/world-us-canada-60254827,US & Canada,"Allison Fluke-Ekren, who allegedly led an Islamic State squadron, was once a doe-eyed Kansas schoolgirl."
8,FA Cup build up and news conferences,/sport/live/football/60256882,Football,"Build-up as Manchester United host Middlesbrough in the FA Cup fourth round on Friday evening, plus managers face the media before the weekend's games."
9,Egypt beat Cameroon on penalties,/sport/football/60149874,Football,Egypt edged past hosts Cameroon in a penalty shootout after a goalless draw to set up an Africa Cup of Nations final against Senegal.
10,All you need to know about Beijing 2022,/sport/winter-olympics/60199574,Sport,BBC Sport tells you all you need to know about the Beijing 2022 Winter Olympics.
11,The unexpected aftermath of a toppled Bristol statue,/reel/video/p0bm2slm/the-slave-trader-s-statue-that-divided-a-city,,
12,Capturing New York City frame by frame on the 1980s subway,/reel/video/p0bllp4k/the-iconic-images-capturing-the-magic-of-the-80s,,
13,"The world's most nutritious foods, according to science",/reel/video/p08h49pb/the-world-s-most-nutritious-foods,,
14,The discovery of Egypt's lost city,https://www.bbc.com/travel/article/20220203-the-discovery-of-egypts-lost-city,Travel,"""It's very much an Egyptian Pompeii"""
15,The benefits of being a playful adult,https://www.bbc.com/future/article/20220127-why-adults-should-embrace-their-playfulness,Future,Playing has been shown to improve adults' mental health – so why do we stop?
16,The 'brain waste' shutting out workers,https://www.bbc.com/worklife/article/20220203-brain-waste-the-skilled-workers-who-cant-get-jobs,Worklife,"When some workers have valuable professional skills, why are they left out?"
17,Eight photos showing a US in crisis,https://www.bbc.com/culture/article/20220202-eight-photos-showing-a-us-in-crisis,Culture,"Images depicting protests, poverty and the effects of climate change"
18,The 40% of food that never gets eaten,https://www.bbc.com/future/bespoke/follow-the-food/how-to-use-food-waste-for-good/,Follow the Food,"As global food production is on the rise, food waste is soaring"
19,Facebook sees daily users fall for first time ever,https://www.bbc.com/news/business-60238565,Business,The technology giant's owner Meta said platforms like TikTok were hurting its growth
20,Dune leads Bafta Film Awards nominations with 11,https://www.bbc.com/news/entertainment-arts-60213530,Entertainment & Arts,"The Power of the Dog, starring Benedict Cumberbatch, got eight nominations, while Belfast got six"
21,The climate benefits of tiny islands,/future/article/20220131-the-worlds-tiny-islands-inspiring-green-action,,
22,How a desert city holds back its sand,/future/article/20220125-how-dubai-is-pushing-back-its-encroaching-deserts,,
23,The 'outrageous' green plan for coal,/future/article/20220118-the-environmental-case-for-buying-a-coal-mine,,
24,Game of Thrones studio opens door to Westeros,/news/entertainment-arts-60243681,Entertainment & Arts,A major new attraction launches at one of the hit TV show's filming locations in Northern Ireland.
25,How to store excess wind power underwater,https://www.bbc.co.uk/news/business-60066690,Business,
26,Space station to crash down to Earth in 2031,/news/science-environment-60246032,Science & Environment,
27,Wordle code could be copied to play for years,/news/technology-60231055,Technology,
28,UK approves fifth Covid-19 vaccine,/news/health-60245736,Health,
29,Tonga enters Covid lockdown after aid delivered,/news/world-asia-60210867,Asia,
30,Vaccine trial for killer elephant virus begins,/news/science-environment-60222464,Science & Environment,
31,Africa's top shots: Cowboys and beach burials,/news/world-africa-60243953,Africa,
32,In Pictures: Lunar New Year 2022,/news/in-pictures-60209010,In Pictures,
33,In Pictures: US cities clear up after big freeze,/news/world-us-canada-60190444,US & Canada,
34,Photographs capture city's Covid-19 response,/news/uk-england-tyne-60131496,Tyne & Wear,
35,Africa's top shots: Weighty matters and cartwheels,/news/world-africa-60156013,Africa,
