,title,href,tag,summary
0,Ohio town rues chemical train crash as 'our Chernobyl',/news/world-us-canada-64671893,US & Canada,Residents of this close-knit community fear the railroad disaster has changed their lives forever.
1,"No deal with Putin on territory, Zelensky tells BBC",https://www.bbc.com/news/world-europe-64662184,Europe,
2,Holding out against China in a row over reefs,https://www.bbc.com/news/world-asia-64634814,Asia,
3,"Bruce Willis has dementia, family announces",https://www.bbc.com/news/entertainment-arts-64670521,Entertainment & Arts,
4,Can you dream in another language?,https://www.bbc.com/future/article/20230213-how-people-dream-in-foreign-languages,Future,
5,Biden says no apologies for downing China balloon,/news/world-us-canada-64668143,US & Canada,"The president says he will speak with China's Xi Jinping soon ""to get to the bottom of this""."
6,Why spy balloons are still so useful in era of drones,/news/world-us-canada-64639407,US & Canada,A technology first used during the French Revolutionary Wars remains in demand today for good reasons.
7,US cancer patient got 'uncontrollable' Irish accent,/news/world-us-canada-64671894,US & Canada,"Despite never having been to Ireland, the North Carolina man spoke with a ""brogue"" until his death, say researchers."
8,New Zealand trail England by under 100 runs,/sport/live/cricket/62866042,Cricket,"Follow live text updates from day two of the first Test between England and New Zealand at the Bay Oval, Tauranga."
9,'On-fire’ Rashford poised for most prolific season,/sport/football/64671106,Football,Marcus Rashford shows why Xavi rates him as one of Europe's most dangerous players with a fine performance against Barcelona as he equals his most prolific season in football.
10,'We can't stop watching' - Arsenal's reluctant rebel fans,/sport/football/64641090,Football,"Three years ago, they walked away from Arsenal. Now, a Premier League title challenge has drawn them, reluctantly, back."
11,The enigmatic far side of the Moon,/reel/video/p0f3k9ww/the-enigmatic-far-side-of-the-moon,,
12,The greatest literary hoax of the 20th Century,/reel/video/p0f3h03g/ern-malley-the-influential-australian-poet-who-never-lived,,
13,The ancient Indian mega-port that mysteriously vanished,/reel/video/p0f377b2/muziris-the-first-emporium-of-india-lost-for-700-years,,
14,How Magic Mike transformed stripping,https://www.bbc.com/culture/article/20230216-how-magic-mike-transformed-the-image-of-male-stripping,Culture,The real-life impact of the Channing Tatum franchise
15,Italy's unusual vegetable ritual,https://www.bbc.com/travel/article/20230216-italys-unusual-vegetable-ritual,Travel,It won a battle and can predict the future
16,The 'permacrisis' hitting Gen Z workers,https://www.bbc.com/worklife/article/20230215-are-gen-z-the-most-stressed-generation-in-the-workplace,Worklife,Why pressure and stress is especially burning out young employees
17,The hidden reasons there's no male pill,https://www.bbc.com/future/article/20230216-the-weird-reasons-male-birth-control-pills-are-scorned,Future,Side-effects deemed unacceptable for men have been vexing women for years
18,How a shark in lycra became an accidental World Pride icon,https://www.bbc.com/news/world-australia-64578444,Australia,The rainbow-clad model shark has captured international attention and won adoring fans
19,Will Qatari bid materialise before Man Utd deadline?,https://www.bbc.com/sport/football/64617640,Sport,"As Friday's deadline approaches, who will join Sir Jim Ratcliffe in submitting a bid to buy Man Utd?"
20,KitKat maker Nestle to raise prices again,https://www.bbc.com/news/business-64664292,Business,It comes after the world's biggest food company increased its prices by 8% last year
21,Should the unborn get a say on climate?,/future/article/20230215-should-future-generations-have-climate-rights,,
22,The cities built to be reusable,/future/article/20230207-can-we-design-cities-for-disassembly,,
23,The next frontier for heat pumps,/future/article/20230131-can-city-dwellers-ever-have-heat-pumps,,
24,Antarctica sea-ice hits new record low,/news/science-environment-64649596,Science & Environment,"Sea-ice measurements in Antarctica have registered a new minimum, breaking the record set only one..."
25,Riseborough says Oscars row deeply impacted her,/news/entertainment-arts-64661528,Entertainment & Arts,
26,Anger after former conjoined twin dies of malaria,/news/uk-england-oxfordshire-64651816,Oxford,
27,What's the cheapest way to stay warm in bed?,/news/business-64559402,Business,
28,Major microchip firm says China employee stole data,/news/business-64658843,Business,
29,King to host palace event backing action on nature,/news/science-environment-64665675,Science & Environment,
30,A-list stars attend Vivienne Westwood memorial,/news/entertainment-arts-64666516,Entertainment & Arts,
31,Raquel Welch: A life in pictures,/news/world-us-canada-64658155,US & Canada,
32,Vigils held in UK and Ireland for Brianna Ghey,/news/uk-64658794,UK,
33,England's Big Picture: Images of the nation,/news/uk-england-64619278,England,
34,In pictures: President Zelensky visits the UK,/news/in-pictures-64573568,In Pictures,
35,Royal photos win British Press Photo Award,/news/in-pictures-64513500,In Pictures,
