,title,href,tag,summary
0,US justice department seeks to unseal Trump warrant,/news/world-us-canada-62512360,US & Canada,The FBI searched Mr Trump's Florida home on Monday - the unsealed warrant could reveal why.
1,France battles 'monster' wildfire near Bordeaux,https://www.bbc.com/news/world-europe-62503775,Europe,
2,Gunman hailed hero for holding up bank over savings,https://www.bbc.com/news/world-middle-east-62514631,Middle East,
3,Why did South Korea pardon the Samsung 'prince'?,https://www.bbc.com/news/world-us-canada-62501514,Asia,
4,Is dark chocolate really good for you?,https://www.bbc.com/future/article/20220811-is-dark-chocolate-really-good-for-us,Future,
5,Armed man shot after trying to 'breach' FBI office,/news/world-us-canada-62514752,US & Canada,The suspect fled the scene in Cincinnati and was gunned down after an hours-long standoff.
6,UN alarm as Ukraine nuclear plant shelled again,/news/world-europe-62505815,Europe,"Ukraine and Russia trade blame as the Zaporizhzhia nuclear plant, Europe's largest, is hit."
7,'I'm a different person after having monkeypox',/news/world-us-canada-62438263,US & Canada,"""If you haven't lived through it, you have no idea the kind of pain this is,"" one man tells the BBC."
8,'Women make Hundred whole again with welcome return',/sport/cricket/62510229,The Hundred,"The first week of The Hundred suffered without the women, who made a welcome return at The Oval on Thursday, says chief cricket writer Stephan Shemilt."
9,Curran brothers steer Invincibles to victory over Superchargers,https://www.bbc.co.uk/sport/live/cricket/60184723,Sport,Sam Curran and Tom Curran hold their nerve to steer Oval Invincibles to a tense victory over Northern Superchargers.
10,Russell's jersey number retired by all NBA teams,/sport/basketball/62512979,Basketball,The NBA will honour late 11-time champion Bill Russell by retiring his jersey number six across the league.
11,When the first humans ever landed on the moon,/reel/video/p0cs9390/when-the-first-humans-ever-landed-on-the-moon,,
12,How a dictator controlled Portugal with cod,/reel/video/p0crynq5/why-is-cod-so-popular-in-portugal-,,
13,How repeating mantras 'repairs' your brain,/reel/video/p0cqt0yc/mantra-meditation-the-ancient-practise-to-heal-our-minds,,
14,A Spanish town abandoned by mistake,https://www.bbc.com/travel/article/20220811-a-spanish-town-abandoned-by-mistake,Travel,"Residents aren't allowed to go home, but tourists can visit freely"
15,The puppet calling his creator racist,https://www.bbc.com/culture/article/20220811-meet-the-puppet-who-has-called-out-his-creator-for-racism,Culture,How a ventriloquist's dummy is taking on bigotry in South Africa
16,The most sustainable way to eat fish,https://www.bbc.com/future/article/20220810-can-eating-fish-ever-be-sustainable,Future,Is sustainable seafood actually possible – or should we avoid fish altogether?
17,The major upside of gossip,https://www.bbc.com/worklife/article/20220804-the-surprising-benefits-of-gossip,Worklife,Why you should lean into gossiping in your work and social lives
18,Aggressive dolphin bites two more Japanese swimmers,https://www.bbc.com/news/world-asia-62508073,Asia,It is the latest in a string of attacks this summer - all believed to involve the same creature
19,McDonald's plans to reopen Ukraine restaurants,https://www.bbc.com/news/business-62508898,Business,"The burger chain says it hopes to support a ""small but important sense of normalcy"""
20,Dame Emma defends 'important' intimacy directors,https://www.bbc.com/news/entertainment-arts-62502506,Entertainment & Arts,"Thompson responds to Sean Bean, who said intimacy directors spoil the spontaneity of scenes"
21,The crab invading the Mediterranean,/future/article/20220809-how-the-mediterranean-became-the-worlds-most-invaded-sea,,
22,Scotland's most misunderstood landscape,/future/article/20220802-climate-change-the-promise-and-danger-of-scotlands-peat,,
23,How religion is saving species in India,/future/article/20220726-how-religious-worship-is-boosting-conservation-in-india,,
24,"'Every day it doesn't rain, the pressure mounts'",/news/science-environment-62495034,Science & Environment,The heatwave will make conditions on England's farms worse as experts warn of smaller harvests.
25,Rage Against the Machine scrap UK festival dates,/news/entertainment-arts-62510927,Entertainment & Arts,
26,NHS IT supplier held to ransom by hackers,/news/technology-62506039,Technology,
27,Looking for the next big thing at the Edinburgh Fringe,/news/entertainment-arts-62482111,Entertainment & Arts,
28,Climate scientists chase Arctic storms,/news/science-environment-62490130,Science & Environment,
29,US doctor warns of many undiagnosed polio cases,/news/health-62469534,Health,
30,Children tied up and men in cots in Ukraine orphanages,/news/disability-62226636,Disability,
31,"In pictures: Heatwaves, drought and wildfires",/news/in-pictures-62497772,In Pictures,
32,Picture of wild cat hunting flamingo wins award,/news/in-pictures-62492855,In Pictures,
33,Mexico indigenous groups celebrate their heritage,/news/world-latin-america-62491341,Latin America & Caribbean,
34,Issey Miyake's fashion in pictures,/news/in-pictures-62481031,In Pictures,
35,The bull that has stolen Brummie hearts,/news/uk-england-birmingham-62469114,Birmingham & Black Country,
