,title,href,tag,summary
0,BBC finds little foreign aid in flood-hit Derna,/news/live/world-africa-66815068,Africa,"Our team finds a devastated city, full of rescuers, ambulance crews and forensic teams, but aid agencies are not yet there in force."
1,Morocco quake kills entire class of schoolchildren,https://www.bbc.com/news/world-africa-66818257,Africa,
2,Three men cleared of plotting to kidnap US governor,https://www.bbc.com/news/world-us-canada-66814555,US,
3,Women's employment hangs by a thread,https://www.bbc.com/worklife/article/20230914-women-are-returning-to-work-but-theres-more-to-the-story,Worklife,
4,The brutal film on 'warped masculinity',https://www.bbc.com/culture/article/20230915-how-grisly-thriller-dead-mans-shoes-captured-british-small-town-violence,Culture,
5,'The riverbank was not next to this mosque a week ago',/news/world-africa-66823715,Africa,"In the Libyan city of Derna, Anna Foster describes the flood devastation and lack of international aid."
6,Diamonds and diplomacy: How a US envoy fell from grace,/news/world-us-canada-66790328,US & Canada,Career diplomat Robert Olson admits violating ethics laws after serving as US ambassador to Pakistan.
7,Biden says striking car workers deserve 'fair share',/news/business-66822558,Business,"The president urges Ford, General Motors and Stellantis to ""go further"" to meet the union demands."
8,All Blacks seek 50th World Cup win against Namibia,/sport/live/rugby-union/65867014,Rugby Union,Follow text updates as New Zealand face Namibia at the Rugby World Cup.
9,Car worse than expected in Singapore - Verstappen,/sport/formula1/66821464,Formula 1,"Max Verstappen said Red Bull were ""worse than we expected"" after he ended Friday practice at the Singapore Grand Prix in eighth."
10,Malan ton seals England series win over New Zealand,/sport/cricket/66821779,Cricket,Dawid Malan's sublime century inspires England to a series-clinching hammering of New Zealand in the fourth and final one-day international at Lord's.
11,Are businesses ready for a Covid wave?,https://www.bbc.com/worklife/article/20230913-are-businesses-ready-for-another-wave-of-covid-19-cases,Worklife,The pandemic caught companies and workers by surprise – are they prepared now?
12,How old is too old to lead?,https://www.bbc.com/future/article/20230913-should-we-be-worried-about-older-politicians,Future,There may be both pros and cons to having older politicians
13,Stunning music from an infamous US jail,https://www.bbc.com/culture/article/20230913-hear-stunning-music-recorded-inside-mississippis-infamous-parchman-prison,Culture,How the inmates of the infamous Parchman Farm prison made an album
14,The mystery of Siberia's exploding craters,/reel/video/p097w5p3/the-mystery-of-siberia-s-exploding-craters,,
15,"The place where no humans will tread for 100,000 years",/reel/video/p0g0s0rh/the-nuclear-waste-graveyard-that-will-last-100-000-years,,
16,Watch footage from inside the eye of a hurricane,/reel/video/p0gdfcqj/watch-footage-from-inside-the-eye-of-a-hurricane,,
17,The companies staying fully remote,https://www.bbc.com/worklife/article/20230912-the-companies-sticking-to-fully-remote-work,Worklife,"Measuring workers ""by results rather than an office parking lot"""
18,In search of the 'real' Coco Chanel,https://www.bbc.com/travel/article/20230914-the-true-story-of-coco-chanels-childhood-in-search-of-gabrielle,Travel,"Until Gabrielle Chanel became Coco, she left barely a footprint"
19,A new era of Jewish food in the US,https://www.bbc.com/travel/article/20230914-explore-new-york-citys-eight-best-jewish-eateries,World's Table,"Skip the lines at the ""must-see"" stops and head here instead"
20,Why men dominate Q&As so much,https://www.bbc.com/future/article/20230913-why-are-women-less-likely-to-ask-questions-in-public,Future,Women want to ask questions – but often don't
21,What Diana's sheep jumper really means,https://www.bbc.com/culture/article/20230913-what-princess-dianas-sheep-jumper-really-means,Culture,"The sweater sold for $1.14 million (£920,000) at a Sotheby's auction"
22,Trevor Noah jumps into fan's car to beat traffic,https://www.bbc.com/news/world-africa-66822835,Africa,The ordeal played out live on air as Noah ran late for an interview in Johannesburg
23,Mesmerising marine life photos scoop world prize,https://www.bbc.com/news/in-pictures-66810094,In Pictures,A blackwater shot of a paper nautilus floating on ocean debris wins top photo award
24,How sponges help Zanzibar women,/future/article/20230912-the-zanzibar-sea-sponges-helping-women-fight-climate-change,,
25,Why your laptop is a gold mine,/future/article/20230904-how-the-royal-mint-is-turning-electronic-waste-into-gold,,
26,Florida's first hurricane-proof town,/future/article/20230904-babcock-ranch-floridas-first-hurricane-proof-town,,
27,In pictures: Stars hit red carpet at Vogue World,/news/entertainment-arts-66808254,Entertainment & Arts,Baby bump-flashing Sienna Miller joins other stars like Kate Winslet and Stormzy at the fashion...
28,Guts and glory as Olivia Rodrigo tops album chart,/news/entertainment-arts-66824131,Entertainment & Arts,
29,UK butterfly numbers at highest level since 2019,/news/uk-66812657,UK,
30,Indie game studios warn Unity fees could cause delays,/news/newsbeat-66810296,Newsbeat,
31,UK's first school set up with orchestra opens,/news/entertainment-arts-66799608,Entertainment & Arts,
32,France sets out plan to ban disposable vapes,/news/world-europe-66797972,Europe,
33,"Fish, flares and faces: Africa’s top shots",/news/world-africa-66807540,Africa,
34,Stunning image of huge plasma arc wins award,/news/in-pictures-66807814,In Pictures,
35,In pictures: Desperate search for flood survivors,/news/in-pictures-66805006,In Pictures,
36,Photographs that shaped the urban landscape,/news/in-pictures-66784928,In Pictures,
37,Finding beauty in rugged sights of the Black Country,/news/uk-england-birmingham-66706259,Birmingham & Black Country,
38,Oriel luniau: Ras Cefn y Ddraig 2023 // Photo gallery: The 2023 Dragon’s Back Race,/newyddion/66786559,Cylchgrawn,
