,title,href,tag,summary
0,Global outcry after Russia seizes nuclear plant,/news/live/world-europe-60532634,Europe,"World leaders call the shelling - which led to a fire at the site - ""reckless"", ""horrific"" and ""unacceptable""."
1,How dangerous was the attack on Ukraine's nuclear plant?,https://www.bbc.com/news/world-60609633,World,
2,"'My city's being shelled, but mum won't believe me'",https://www.bbc.com/news/world-europe-60600487,Europe,
3,The rise of 'solo polyamory',https://www.bbc.com/worklife/article/20220301-does-solo-polyamory-mean-having-it-all,Worklife,
4,Hawaii's ultimate form of gratitude,https://www.bbc.com/travel/article/20220303-hawaiis-ultimate-form-of-gratitude,Travel,
5,Families run for cover as air strikes hit Chernihiv,/news/world-europe-60616946,Europe,"Residents of Chernihiv and other cities say apartments, hospitals and schools are being destroyed."
6,Russian TV staff walk off set after final broadcast,/news/world-europe-60615753,Europe,Channel TV Rain stops operating after coming under pressure over its coverage of the war in Ukraine.
7,Lyse Doucet: How a week of war has transformed lives,/news/world-europe-60604787,Europe,Our chief international correspondent on the seven days that sparked a burning patriotic resolve in Ukraine.
8,Premier League news conferences,/sport/live/football/60615119,Football,"The latest from Friday's Premier League news conferences including Jurgen Klopp, Steven Gerrard and Patrick Vieira."
9,China Premier League coverage pulled,/sport/football/60524865,Football,China's rights holders have pulled Premier League coverage for this weekend over support for Ukraine.
10,Australia legend Marsh dies aged 74,/sport/cricket/60508396,Cricket,Legendary Australia wicketkeeper Rod Marsh dies aged 74 after suffering a heart attack.
11,The 'shocking' male sacrifice made for a Roman goddess,/reel/video/p0bsfp1y/the-goddess-who-changed-the-course-of-roman-history,,
12,The deadly toxin found in the world's oldest mummies,/reel/video/p0br366s/life-beyond-death-in-the-driest-place-on-earth,,
13,Why pleasure is key to losing weight,/reel/video/p0brtrb1/why-pleasure-is-key-to-losing-weight,,
14,The myths of 21st Century friendship,https://www.bbc.com/future/article/20220302-the-myths-and-reality-of-modern-friendship,Future,Is modern life really changing how we connect with each other?
15,Why this iconic monster is so scary,https://www.bbc.com/culture/article/20220303-nosferatu-the-monster-who-still-terrifies-100-years-on,Culture,"How the vampire from silent horror Nosferatu still terrifies, 100 years on"
16,A paradise with too many palm trees,https://www.bbc.com/travel/article/20220302-seychelles-bird-island-a-paradise-with-too-many-palm-trees,Travel,Cutting them down had a surprising result
17,What happens when mindfulness backfires,https://www.bbc.com/worklife/article/20220302-how-mindfulness-can-make-you-a-darker-person,Worklife,"How meditation can derail your ""moral compass"" and make you darker"
18,Abandoned rocket part to hit Moon - scientists,https://www.bbc.com/news/science-environment-60596449,Science & Environment,The space junk has confused experts but is soon to crash at high speed
19,How your diet can treat diseases,https://www.bbc.com/future/bespoke/follow-the-food/how-your-diet-can-treat-diseases/,Follow The Food,The food we eat is one of the leading causes of illness
20,India TV host yells at wrong man on Ukraine debate,https://www.bbc.com/news/world-asia-india-60614274,India,Rahul Shivshankar only realised his mistake when his perplexed guest spoke up
21,The puzzle of Mexico's ageing oaks,/future/article/20220222-the-mystery-of-mexicos-vanishing-stream-oaks,,
22,The animal 'sixth sense' for disaster,/future/article/20220211-the-animals-that-predict-disasters,,
23,The country embracing life on water,/future/article/20220202-floating-homes-the-benefits-of-living-on-water,,
24,A shipping giant gambles on a green fuel take-off,https://www.bbc.co.uk/news/business-60433204,Business,Maersk has ordered 12 ships that run on methanol despite a shortage of fuel.
25,Bolton and Sisqó to compete in US Eurovision,/news/entertainment-arts-60619976,Entertainment & Arts,
26,Unite against climate change - Ukraine scientist,/news/science-environment-60592587,Science & Environment,
27,BBC News launches 'dark web' mirror,/news/technology-50150981,Technology,
28,Oxygen stocks running dangerously low in Ukraine,/news/health-60555228,Health,
29,Colombia decriminalises abortion in first 24 weeks,/news/world-latin-america-60477700,Latin America & Caribbean,
30,UK satellite firm suspends use of Russian rockets,/news/uk-politics-60602512,UK Politics,
31,In pictures: Russia intensifies attacks on Ukraine,/news/in-pictures-60601185,In Pictures,
32,"Africa's top shots: Bikes, blocks and borders",/news/world-africa-60599941,Africa,
33,In pictures: Kyiv under attack,/news/in-pictures-60536824,In Pictures,
34,In pictures: Destruction and fear as war hits Ukraine,/news/in-pictures-60505277,In Pictures,
35,Taking a photo every day at 12.34pm for 10 years,/news/uk-england-london-60471272,London,
