,title,href,tag,summary
0,"Belarus Olympian safe in Tokyo hotel, officials say",/news/world-europe-58052144,Europe,Krystsina Tsimanouskaya alleges she was almost forced on to a plane home after criticising her coaches.
1,New rules for fully jabbed US and EU arrivals begin,https://www.bbc.com/news/uk-58050538,UK,
2,Banking giant HSBC sees profit more than double,https://www.bbc.co.uk/news/business-58051818,Business,
3,Mexico's ancient underwater lifeforms,https://www.bbc.com/travel/article/20210801-mexicos-three-billion-year-old-underwater-lifeforms,Travel,
4,'Pink and plump' giant panda twins born in French zoo,https://www.bbc.com/news/world-europe-58052139,Europe,
5,"Tokyo 2020 – Sailing finals delayed, Kenny in track cycling action - watch, listen & follow text",/sport/live/olympics/50974151,Olympics,Live updates from day 10 of the Tokyo 2020 Olympics.
6,Concerns in China as Delta Covid outbreak spreads,/news/world-asia-china-58052894,China,Local headlines have been dominated by news on the outbreak with several provinces affected and millions getting tested.
7,What's behind Olympian Raven Saunders' X protest,/news/world-us-canada-58048727,US & Canada,The US shot-putter defies a ban on podium gestures after taking silver at the Tokyo Games.
8,Biles to compete in beam final,/sport/olympics/58054200,Olympics,Simone Biles will compete in the beam final as she takes up her final chance of an individual medal at an Olympics where she has withdrawn from four other finals.
9,Puerto Rico win first Olympic athletics gold,/sport/olympics/58052804,Olympics,Jasmine Camacho-Quinn wins Puerto Rico's first ever Olympic track and field gold as she cruises to victory in the women's 100m hurdles at Tokyo 2020.
10,India shock Australia to reach semi-final,/sport/olympics/58052924,Olympics,India claim a 1-0 win over Australia in the women's hockey to reach the semi-finals for the first time in their Olympic history.
11,Playing with FIRE: The millennial movement to quit work,/reel/video/p09qwdp6/playing-with-fire-the-millennial-movement-to-quit-work,,
12,Inside a jaw-dropping Nigerian mega church,/reel/video/p09qtf9r/the-mega-church-that-houses-1-million-christians,,
13,What happened to this island when the sea disappeared?,/reel/video/p09qnstb/the-nature-haven-in-the-middle-of-an-ecological-catastrophe,,
14,The ancient origins of the new nomads,https://www.bbc.com/culture/article/20210730-the-ancient-origins-of-the-new-nomads,Culture,Itinerant lifestyles feel new but the idea goes back millennia
15,The largest active volcano in Europe,https://www.bbc.com/future/article/20210730-the-enigma-of-europes-largest-active-volcano,Future,An enormous submarine volcano could trigger a tsunami on Italy's coasts
16,The rise of extreme job interviews,https://www.bbc.com/worklife/article/20210727-the-rise-of-never-ending-job-interviews,Worklife,Seven? Eight? Nine? How many interviews is too many for a job?
17,The shipwreck that changed the world,https://www.bbc.com/travel/article/20210729-the-british-shipwreck-that-changed-the-world,Travel,It led to two acts of parliament and the establishment of longitude
18,Finding answers to the world's drinking water crisis,https://www.bbc.com/news/business-57847654,Business,Scientists are racing to come up with technologies that can solve the world's clean water shortage
19,Why bonding over the Euros pushed up Covid cases in men,https://www.bbc.com/news/health-58015593,Health,Psychologists say men need to be part of a group in order to vent their feelings and emotions
20,The perfect storm striking World of Warcraft,https://www.bbc.com/news/technology-58017429,Technology,"All of a sudden, WoW players are in revolt, and its competitors are having a boom"
21,How to invite wildlife into your home,/future/article/20210727-how-to-boost-biodiversity-and-attract-wildlife-to-your-home,,
22,The neglected 'Galapagos of Europe',/future/article/20210720-europes-museum-of-living-fossils,,
23,The beavers returning to Utah's desert,/future/article/20210713-the-beavers-returning-to-the-desert,,
24,My schizophrenia is helping an EastEnders storyline,/news/newsbeat-57986350,Newsbeat,Antonio Ferreira is using his personal experience to advise the soap on a storyline.
25,Flagship UK telecommunications satellite launches,/news/science-environment-58032592,Science & Environment,
26,Elon Musk: 'I don't want to be CEO of anything',/news/technology-58035124,Technology,
27,China battles worst Covid outbreak since Wuhan,/news/world-asia-china-58021911,China,
28,What's to blame for Iran's water crisis?,/news/58012290,Reality Check,
29,Hollywood plans £700m film and TV studios in UK,/news/uk-england-beds-bucks-herts-58029042,"Beds, Herts & Bucks",
30,DaBaby dropped by US festival Lollapalooza,/news/world-us-canada-58048728,US & Canada,
31,Striking news pictures from around the world,/news/in-pictures-58025592,In Pictures,
32,Africa's top shots: Giant leaves and Olympic tattoos,/news/world-africa-58012834,Africa,
33,Global Tiger Day highlights decline of species,/news/in-pictures-58012200,In Pictures,
34,Knitting photo wins science-photography prize,/news/in-pictures-57989254,In Pictures,
35,In pictures: Summer storms over Scotland,/news/uk-scotland-south-scotland-57998429,South Scotland,
