,title,href,tag,summary
0,Ukraine moves step closer to EU membership,/news/live/world-europe-61839196,Europe,"The European Commission recommends candidate status for Ukraine, but says it must carry out reforms."
1,Republican Senate gun negotiator walks out of talks,https://www.bbc.com/news/world-us-canada-61835918,US,
2,Russian Foreign Minister Lavrov fact-checked,https://www.bbc.com/news/61829953,Reality Check,
3,Is remote work bad for wellbeing?,https://www.bbc.com/worklife/article/20220616-is-remote-work-worse-for-wellbeing-than-people-think,Worklife,
4,Why the US navy is listening to shrimp,https://www.bbc.com/future/article/20220616-the-new-sonar-built-from-sealife-noises,Future,
5,"Biden says American people 'really, really down'",/news/world-us-canada-61835919,US & Canada,"Mr Biden says the ""need for mental health in America has skyrocketed"" amid economic volatility."
6,Three American fighters reported missing in Ukraine,/news/world-us-canada-61835574,US & Canada,"If confirmed, these would be the first US fighters captured in Ukraine since the war began in February."
7,Powerful 'smoke twister' spotted in Arizona,/news/world-us-canada-61819613,US & Canada,"The twister formed from smoke from the Pipeline Fire in Flagstaff, Arizona."
8,Salt hits maiden ODI century for England against Netherlands,/sport/live/cricket/58748562,Cricket,Follow live text updates from the first ODI between England and the Netherlands at the VRA Cricket Ground in Amstelveen.
9,US Open round two - Fitzpatrick & Rose out early,/sport/live/golf/61813645,Golf,"Follow live text from round two of the US Open in Brookline, Massachusetts."
10,Warriors clinch fourth NBA title in eight years,/sport/basketball/61836898,Basketball,The Golden State Warriors beat the Boston Celtics to win game six of the NBA Finals and claim their fourth NBA title in eight years.
11,'When I see a police officer I cringe',/reel/video/p0cffg61/inside-the-huey-p-newton-gun-club,,
12,The ancient game making a surprising comeback,/reel/video/p0cdy0t3/mexico-revives-a-3-000-year-old-ball-game,,
13,The beautiful medieval 'ghost town' frozen in time,/reel/video/p0cdpdns/the-spanish-ghost-town-that-should-be-underwater,,
14,The cult fandom of a spicy street food,https://www.bbc.com/travel/article/20220616-jhal-muri-bangladeshs-fiery-inventive-spin-on-rice,Travel,It combines two of the nation's greatest loves: rice and spice
15,The films bringing sex work to life,https://www.bbc.com/culture/article/20220616-the-films-showing-sex-workers-in-a-new-light,Culture,Has cinema perpetuated damaging stereotypes?
16,The rise of digital nomad families,https://www.bbc.com/worklife/article/20220615-the-rise-of-digital-nomad-families,Worklife,"""We want our kids to have the benefit of seeing it all"""
17,Is progress slowing down?,https://www.bbc.com/future/article/20220615-do-we-need-a-better-understanding-of-progress,Future,"And if so, should we do something about it?"
18,Some polar bears adapt to hunt without sea ice,https://www.bbc.com/news/science-environment-61835778,Science & Environment,"Several hundred Greenland bears survive by hunting seals from freshwater ice instead, scientists say"
19,Cosmetics maker Revlon files for bankruptcy in US,https://www.bbc.com/news/business-61835796,Business,The 90-year-old firm says supply chain disruptions have driven up the cost of raw materials
20,France gears up for new battle: Macron v Mélenchon,https://www.bbc.com/news/world-europe-61825526,Europe,Macron could lose his majority in the National Assembly because of a left-green alliance
21,The English town that welcomed the dark,/future/article/20220614-the-crusade-for-darker-night-skies,,
22,Could we live without plastic?,/future/article/20220526-what-would-happen-if-we-stopped-using-plastic,,
23,Predicting famine before it strikes,/future/article/20220525-how-scientists-predict-famine-before-it-hits,,
24,People cut back on food and fuel as prices rise,/news/business-61813857,Business,"More than eight in 10 people say they are worried about the cost-of-living, a BBC survey suggests."
25,Everest base camp to be moved from melting glacier,/news/science-environment-61828753,Science & Environment,
26,Bitcoin: Will El Salvador's crypto gamble pay off?,/news/technology-61813845,Technology,
27,"UK could host Eurovision 2023, organisers say",/news/entertainment-arts-61841068,Entertainment & Arts,
28,First disabled Richard III is 'big gesture' from RSC,/news/entertainment-arts-61549419,Entertainment & Arts,
29,Surgeon convicted for fatal Swedish transplants,/news/world-europe-61836856,Europe,
30,Government set to miss air pollution goals - report,/news/science-environment-61825379,Science & Environment,
31,In pictures: Royal Ascot Ladies' Day 2022,/news/uk-england-berkshire-61823812,Berkshire,
32,'You can be visually impaired and artistic',/news/uk-england-norfolk-61530561,Norfolk,
33,Africa's top shots: Surfing stars and mellow mermaids,/news/world-africa-61745017,Africa,
34,In pictures: Platinum Jubilee pageant,/news/uk-61698428,UK,
35,In pictures: Stars throw party for Jubilee,/news/entertainment-arts-61693645,Entertainment & Arts,
