,title,href,tag,summary
0,Gunman kills three in twin Rotterdam shootings,/news/world-europe-66954233,Europe,A 14-year-old girl and her mother are among victims after attacks in two locations in the Dutch city.
1,Potter stars among tributes to Sir Michael Gambon,/news/entertainment-arts-66949848,Entertainment & Arts,
2,"Boy, 16, arrested after Hadrian's Wall tree felled",/news/uk-england-tyne-66952980,Tyne & Wear,
3,Four of the best countries for women,https://www.bbc.com/travel/article/20230927-the-worlds-most-gender-equal-countries,Travel,
4,The return of a divisive lingerie brand,https://www.bbc.com/culture/article/20230926-can-victorias-secret-fix-its-image,Culture,
5,Republicans lay out case at Biden impeachment inquiry,/news/world-us-canada-66954626,US & Canada,"Witnesses, called by Republicans, cautioned that evidence is lacking for impeaching the president."
6,A QAnon 'queen' and the town that wants her gone,/news/world-us-canada-66930536,US & Canada,Romana Didulo and her band of followers have hunkered down in a rural Canadian village.
7,The New York buildings that Trump could lose,/news/world-us-canada-66949606,US & Canada,A ruling from a New York judge has thrown the fate of Donald Trump's property empire into question.
8,Europe and US reveal opening Ryder Cup pairings,/sport/golf/66946579,Golf,Europe's Ludvig Aberg is thrust straight into Ryder Cup action by being paired with Viktor Hovland in Friday's opening session against the United States.
9,England reach quarter-finals after Japan beat Samoa,/sport/rugby-union/66952630,Rugby Union,England reach the quarter-finals of the Rugby World Cup thanks to a Japan win over Samoa which boosts the Brave Blossoms' own knockout chances.
10,Napoli 'never meant to offend' Osimhen but no apology,/sport/football/66955134,European Football,"Napoli say they ""never meant to offend or mock"" Victor Osimhen in a social media post but stop short of publicly apologising to him."
11,The world's quickest electric vehicle,/reel/video/p0gh2kvj/the-world-s-quickest-electric-vehicle,,
12,The unsolved problem as urgent as climate change,/reel/video/p0gfyls0/are-we-at-the-brink-of-a-bug-pocalypse-,,
13,The extraordinary feat of the first man to cycle the globe,/reel/video/p0gfp509/the-first-person-to-cycle-the-globe-on-a-penny-farthing,,
14,Why the US embraced 'strike culture',https://www.bbc.com/worklife/article/20230927-how-strike-culture-took-hold-in-the-us-in-2023,Worklife,How US labour stoppages have become so popular and effective
15,A 'jaw-droppingly distinctive' sci-fi,https://www.bbc.com/culture/article/20230926-the-creator-film-review-a-jaw-droppingly-distinctive-sci-fi,Culture,The Creator is 'a major new adventure'
16,The man who transformed a barren island,https://www.bbc.com/travel/article/20230926-lady-elliot-island-a-paradise-island-where-you-make-a-pledge,Travel,It's one of the best places in the world to swim with manta rays
17,Space travel's heavy toll on health,https://www.bbc.com/future/article/20230927-what-a-long-term-mission-in-space-does-to-the-human-body,Future,Astronaut Frank Rubio spent 371 days in space – what affect will it have on him?
18,Cher accused of hiring men to kidnap her son,https://www.bbc.com/news/world-us-canada-66946652,US,The claims are contained in court documents filed by the estranged wife of Cher's son
19,Suspect arrested in killing of Baltimore tech CEO,https://www.bbc.com/news/world-us-canada-66951410,US,Police say there was no forced entry into Pava LaPere's flat before she was killed on Friday night
20,Rina Sawayama: Therapy made me realise I was groomed at 17,https://www.bbc.com/news/entertainment-arts-66879351,Entertainment & Arts,"The pop star shares, for the first time, the traumatic story behind her second album"
21,"A 2,000-year-old method to water crops",/future/article/20230922-the-ancient-sri-lankan-tank-cascade-systems-tackling-drought,,
22,The goats fighting fires in LA,/future/article/20230922-these-la-goats-help-stop-wildfires,,
23,The city that went green to keep cool,/future/article/20230922-how-medellin-is-beating-the-heat-with-green-corridors,,
24,PlayStation boss Jim Ryan to retire next year,/news/technology-66925559,Technology,He said he took the decision due to issues he had living in Europe while working in North America.
25,One in six UK species at risk of extinction - report,/news/science-environment-66923930,Science & Environment,
26,"Ofcom investigates GB News after 7,300 complaints",/news/uk-66952284,UK,
27,Millions wrongly labelled with penicillin allergy,/news/health-66934909,Health,
28,Rosebank oil field given go-ahead by regulators,/news/uk-scotland-scotland-business-66933346,Scotland business,
29,Sir Michael Gambon: A career in pictures,/news/in-pictures-66950664,In Pictures,
30,My Dad Wrote a Porno enters podcasting Hall of Fame,/news/entertainment-arts-66934970,Entertainment & Arts,
31,The day sea-dipping elephants stunned a Welsh town,/news/uk-wales-66855122,Wales,
32,Ploughing: A snapshot of a disappearing skill,/news/uk-england-norfolk-66869691,Norfolk,
33,"Glasses, goats and goodbyes: Africa’s top shots",/news/world-africa-66877589,Africa,
34,Historic scenes for King and Queen on their French visit,/news/in-pictures-66867649,In Pictures,
35,Adeiladau anghofiedig Cymru // Wales' forgotten buildings,/newyddion/66858159,Cylchgrawn,
