,title,href,tag,summary
0,Harry and Meghan in 'near catastrophic car chase',/news/world-us-canada-65625886,US & Canada,A spokesperson says the incident happened after the couple attended an awards ceremony in New York.
1,"NYPD say no collisions, injuries or arrests in alleged chase",/news/live/world-us-canada-65620143,US & Canada,
2,Champions League: Man City in control against Real Madrid,/sport/live/football/65430666,Football,
3,How AI will transform your workday,https://www.bbc.com/worklife/article/20230515-workplace-ai-how-artificial-intelligence-will-transform-the-workday,Worklife,
4,Fast X: 'Preposterous from beginning to end' ★★★☆☆,https://www.bbc.com/culture/article/20230517-fast-x-review-preposterous-from-beginning-to-end,Culture,
5,Scans of Titanic reveal wreck as never seen before,/news/science-environment-65602182,Science & Environment,"Full-sized digital scans reveal shipwreck in stunning detail, showing unopened champagne bottles."
6,Critics lukewarm on Johnny Depp's comeback film,/news/entertainment-arts-65619877,Entertainment & Arts,The US actor appears in a new film which premiered on the opening night of the Cannes Film Festival.
7,What's at stake in abortion pill court case?,/news/world-us-canada-65320035,US & Canada,A court in New Orleans is hearing a case that may pull the commonly used drug mifepristone from the market.
8,Toney banned for eight months over betting,/sport/football/65626690,Football,Brentford striker Ivan Toney is banned from football for eight months after he accepted breaking Football Association betting rules.
9,Emilia Romagna GP called off after flooding,/sport/formula1/65621373,Formula 1,This weekend's Emilia Romagna Grand Prix at Imola is called off because of major flooding in the Italian region.
10,Milner & Firmino among four set to leave Liverpool,/sport/football/65627392,Football,"James Milner, Roberto Firmino, Naby Keita and Alex Oxlade-Chamberlain will all leave Liverpool at the end of the season."
11,An obscure 150-year-old law that could impact women’s rights,/reel/video/p0fnrdjs/the-victorian-era-anti-obscenity-law-used-to-ban-abortion,,
12,India's engineering time capsule that defeated European armies,/reel/video/p0fngc6l/a-marvel-of-engineering-on-india-s-west-coast,,
13,What if we all lived on two tonnes of carbon?,/reel/video/p0flfbbd/what-if-we-all-lived-on-two-tonnes-of-carbon-,,
14,Johnny Depp's comeback is a flop,https://www.bbc.com/culture/article/20230517-jeanne-du-barry-review-johnny-depp-is-subdued-to-the-point-where-hes-barely-conscious,Culture,"In the star's new film, he is 'subdued to the point where he's barely conscious'"
15,Tokyo's best public bathhouses,https://www.bbc.com/travel/article/20230516-tokyos-five-best-sento-public-bathhouses,Travel,"Soaking in a ""sento"" is one of Japan's great pleasures"
16,What did Apollo do for us?,https://www.bbc.com/future/article/20230516-apollo-how-moon-missions-changed-the-modern-world,Future,The race to the Moon as the mother of invention
17,Why workers feel they never make enough,https://www.bbc.com/worklife/article/20230512-why-workers-may-never-be-satisfied-with-their-pay,Worklife,"""I can't imagine not wanting to make more than I'm getting … it's human nature"""
18,"A 1,700-year-old 'zero waste' cuisine",https://www.bbc.com/travel/article/20230516-the-1700-year-legacy-of-korean-temple-cuisine,World's Table,"Here, mindful preparation of dishes is part of the path to enlightenment"
19,Court orders Elizabeth Holmes to go to prison,https://www.bbc.com/news/world-us-canada-65620371,US,Holmes was also ordered to pay $452m to the victims of the blood testing scandal
20,Musk: I will say what I want even if it costs me,https://www.bbc.com/news/technology-65609927,Technology,Twitter's owner has been criticised for spreading disinformation and conspiracy theories online
21,The 1968 photo that changed the world,/future/article/20230511-earthrise-the-photo-that-sparked-an-environmental-movement,,
22,What 1.5C living actually looks like,/future/article/20230504-the-people-living-ultra-low-carbon-lifestyles,,
23,The revival of a historic Italian fruit,/future/article/20230424-how-agrivoltaics-helped-save-italys-citron-and-lemon-trees,,
24,World likely to warm beyond key 1.5C limit by 2027,/news/science-environment-65602293,Science & Environment,The world is likely to hit 1.5C of warming within the next five years because of rising carbon...
25,Slowthai dropped by festivals after rape charge,/news/entertainment-arts-65619288,Entertainment & Arts,
26,Zelda game sells 10 million copies in three days,/news/technology-65609932,Technology,
27,North Carolina bans abortion after 12 weeks,/news/world-us-canada-65615310,US & Canada,
28,In pictures: Electric rally at an old coal mine,/news/uk-scotland-south-scotland-65596103,South Scotland,
29,Matt Willis: I’m nervous about my kids seeing my drug past,/news/uk-65603455,UK,
30,"Surfing must get greener, says top UK female champ",/news/science-environment-65563622,Science & Environment,
