,title,href,tag,summary
0,Republicans demand Biden visitor logs after documents find,/news/world-us-canada-64257918,US & Canada,"Republicans say they need to know who has access to the president as ""a clear matter of national security""."
1,Jawbone found in apparent unmarked Canada school grave,/news/world-us-canada-64225855,US & Canada,
2,Indonesia acknowledges gross human rights violations,https://www.bbc.com/news/world-asia-64245668,Asia,
3,Oil giant 'predicted climate change in 1970s',https://www.bbc.com/news/science-environment-64241994,Science & Environment,
4,Films that scare in unexplainable ways,https://www.bbc.com/culture/article/20230112-enys-men-the-films-that-frighten-us-in-unexplainable-ways,Culture,
5,"Lisa Marie Presley, daughter of Elvis, dies at 54",/news/entertainment-arts-64255117,Entertainment & Arts,"The US singer, who is rock'n'roll legend Elvis's only child, earlier reportedly suffered cardiac arrest."
6,Europe's biggest rare earth metals deposit found,/news/world-europe-64253708,Europe,"Nearly all of the metals, used in mobile phones, electric cars and wind turbines, come from China."
7,Punishment for skipping jury duty? A 30 page essay,/news/world-us-canada-64257108,US & Canada,A potential juror in the high-profile case of rapper Young Thug was reprimanded with a writing assignment.
8,Joao Felix sent off on debut as Chelsea lose at Fulham,/sport/football/62776438,Football,Joao Felix was sent off on his Chelsea debut as his new side lost to Fulham to increase the pressure on Blues boss Graham Potter.
9,Lionesses and Messi lead nominees for Fifa awards,/sport/football/64254793,Football,"Argentina forward Lionel Messi and England trio Leah Williamson, Beth Mead and Keira Walsh are among the nominees for the Fifa Best Awards."
10,Williams beats O'Sullivan to set up Lisowski tie,/sport/snooker/64251966,Snooker,"Seven-time champion Ronnie O'Sullivan is knocked out in the quarter-finals of the Masters, beaten 6-5 by Mark Williams in a thrilling contest."
11,Camilla's life before meeting Charles,/reel/video/p0dvg3jr/camilla-s-life-before-meeting-charles,,
12,The surprising power of whispering,/reel/video/p0d95c27/asmr-how-whispering-took-over-the-internet,,
13,The truth about newborn sleep,/reel/video/p0dvg85t/the-science-behind-healthy-baby-sleep,,
14,The hidden history of Versailles,https://www.bbc.com/travel/article/20230112-the-hidden-history-of-versailles,Travel,"To see the grand vision for Louis XIV's ultimate 'bachelor pad', grab a bike"
15,The simple error that 16% of us make,https://www.bbc.com/future/article/20230112-why-some-people-cant-tell-left-from-right,Future,Being unable to tell left from right can have serious consequences at times
16,The companies that burn out young grads,https://www.bbc.com/worklife/article/20230111-the-companies-that-churn-through-young-workers,Worklife,"""There was just a steady churn of young, impressionable workers"""
17,The most underrated TV gems of 2022,https://www.bbc.com/culture/article/20230111-seven-of-the-best-tv-shows-you-missed-in-2022,Culture,"The best under-the-radar series, including a spy thriller starring Gary Oldman"
18,Andrew Tate: The self-proclaimed misogynist,https://www.bbc.com/news/uk-64125045,UK,"The 36-year-old once said women should ""bear responsibility"" for sexual assault"
19,World's richest man promotes daughter to head Dior,https://www.bbc.com/news/business-64243318,Business,"Bernard Arnault made his fortunes as chief executive of French fashion giant, LVMH"
20,Webb telescope reveals theatrics of starbirth,https://www.bbc.com/news/science-environment-64249978,Science & Environment,"The new super space observatory probes a dynamic star factory 200,000 light years from Earth"
21,How far can vertical farming go?,/future/article/20230106-what-if-all-our-food-was-grown-in-indoor-vertical-farms,,
22,The batteries made from wood,/future/article/20221215-the-batteries-made-from-wood,,
23,An answer to India's flower waste,/future/article/20221208-fleather-the-vegan-leather-made-of-indias-flower-waste,,
24,'Forever chemicals' still in use in UK make-up,/news/science-environment-64192516,Science & Environment,PFAS substances linked with cancer discovered in UK cosmetics on day EU sets out to ban them.
25,Further delays to US flights expected after FAA issue,/news/world-us-canada-64236047,US & Canada,
26,Leftover Covid swabs to be tested for other viruses,/news/health-64209168,Health,
27,Harry Styles and Wet Leg lead Brits nominations,/news/entertainment-arts-64248726,Entertainment & Arts,
28,Twitter says leaked emails were not hacked,/news/technology-64243369,Technology,
29,China blocks S Korea and Japan visas over Covid,/news/world-asia-64220149,Asia,
30,Brit Awards 2023: Full list of nominees,/news/entertainment-arts-64251988,Entertainment & Arts,
31,Golden Globes: The red carpet in pictures,/news/entertainment-arts-64226431,Entertainment & Arts,
32,Repairing broken gadgets for a better future,/news/in-pictures-63737951,In Pictures,
33,Mastectomy photo project aims to empower women,/news/uk-england-manchester-64055153,Manchester,
34,In Pictures: Orthodox Christians mark Christmas,/news/world-64194408,World,
35,In photos: Severe cold wave grips north India,/news/world-asia-india-64143204,India,
