,title,href,tag,summary
0,North Koreans tell of neighbours starving to death,/news/world-asia-65881803,Asia,Rare interviews with ordinary people inside the secretive state reveal chronic food shortages and starvation.
1,Elizabeth Holmes says she cannot pay back victims,https://www.bbc.com/news/world-us-canada-65905923,US,
2,Israeli troops not charged over Palestinian's death,https://www.bbc.com/news/world-middle-east-65882070,Middle East,
3,The €1bn tomb for spent nuclear fuel,https://www.bbc.com/future/article/20230613-onkalo-has-finland-found-the-answer-to-spent-nuclear-fuel-waste-by-burying-it,Future Planet,
4,Paul McCartney’s unseen photographs,https://www.bbc.com/culture/article/20230613-the-ultimate-insider-view-of-the-beatles-and-beatlemania,Culture,
5,'Extremely fierce battles' as Ukraine tries to take ground,/news/live/world-europe-65898762,Europe,"Ukraine's ongoing counter-offensive has resulted in some further advances, a minister says."
6,Mystery over Chechen MP reported wounded in Ukraine,/news/world-europe-65900913,Europe,"Chechen commander and MP Adam Delimkhanov's whereabouts are unknown, but colleagues say he is alive."
7,Trump's court drama turbo-charges his campaign,/news/world-us-canada-65863401,US & Canada,The ex-president is often strongest when under attack - that's a problem for his Republican rivals.
8,England choose Broad for first Ashes Test,/sport/cricket/65906467,Cricket,England have preferred Stuart Broad over Mark Wood to join James Anderson and Ollie Robinson in their pace attack for the first Ashes Test.
9,Real Madrid sign Bellingham on six-year deal,/sport/football/65901078,European Football,Real Madrid complete the signing of England midfielder Jude Bellingham from Borussia Dortmund on a six-year deal.
10,Milner to join Brighton after Liverpool exit,/sport/football/65906011,Football,Brighton will welcome James Milner on a one-year contract when the midfielder's Liverpool deal expires at the end of the month.
11,Three ways Trump may try to delay or dismiss trial,https://www.bbc.com/news/world-us-canada-65897823,US,"After the former president pleads not guilty, legal experts explain what his strategy might be next"
12,Trump's day in Miami court - in pictures,https://www.bbc.com/news/in-pictures-65895959,In Pictures,Donald Trump's court appearance in Miami was captured by photographers and court artists
13,How big are Trump's legal problems?,https://www.bbc.com/news/world-us-canada-61084161,US,It can be difficult to keep track of the ex-president's legal battles - here's what you need to know
14,Should anyone be allowed to inherit $25 billion?,/reel/video/p0fv01m1/do-the-super-rich-deserve-their-wealth-,,
15,The little-known US territory in the middle of the UK,/reel/video/p0ftrxhx/the-tiny-piece-of-the-us-hidden-in-england,,
16,How to rewire your brain and tame your dark memories,/reel/video/p0ftnnbx/how-to-rewire-your-brain-and-tame-your-dark-memories,,
17,A rare cheese from an unforgiving land,https://www.bbc.com/travel/article/20230613-the-spanish-cheese-nearing-extinction,World's Table,"In a culinary landscape dominated by Manchego, its survival is an open question"
18,The hidden inflexibility of hybrid work,https://www.bbc.com/worklife/article/20230613-why-hybrid-return-to-office-mandates-arent-as-flexible-as-they-seem,Worklife,"""A fixed hybrid schedule risks us going backwards"""
19,Van Gogh's darkest symbol,https://www.bbc.com/culture/article/20230612-from-the-starry-night-to-a-wheatfield-van-goghs-darkest-symbol,Culture,Why the painter was drawn to cypress trees
20,"The temple feeding 100,000 people a day",https://www.bbc.com/travel/article/20230612-amritsar-the-indian-city-where-no-one-goes-hungry,Travel,Everybody is welcome to eat here for free
21,The new breed of 'stratoplanes',https://www.bbc.com/future/article/20230613-the-planes-that-will-fly-at-the-edge-of-space,Future,A challenging aviation frontier takes shape
22,Rust weapons expert likely hungover - prosecutors,https://www.bbc.com/news/entertainment-arts-65901426,Entertainment & Arts,The expert is facing an involuntary manslaughter charge after a cinematographer was fatally shot on...
23,Couple charged with murder of South Korean influencer,https://www.bbc.com/news/world-asia-65901004,Asia,A Chinese couple are accused of murdering BJ Ahyeong and dumping her body in Cambodia
24,Could hosepipe drones tackle wildfires?,/future/article/20230609-can-we-use-firefighting-drones-put-out-wildfires,,
25,A 'game changer' for tracking species,/future/article/20230606-how-air-pollution-sensors-can-find-wildlife,,
26,The birds ensnared by plastic,/future/article/20230531-the-photo-that-changed-the-worlds-response-to-the-plastics-crisis,,
27,ITV denies turning blind eye to Schofield affair,/news/entertainment-arts-65889240,Entertainment & Arts,The channel's executives are questioned by MPs over the former presenter's controversial departure.
28,Man trots globe blending scenes into film locations,/news/uk-england-essex-65786652,Essex,
29,What is AI and is it dangerous?,/news/technology-65855333,Technology,
30,India's health ministry denies Covid data breach,/news/world-asia-india-65880173,India,
31,Disney delays Avatar and Avengers films in shake-up,/news/entertainment-arts-65899276,Entertainment & Arts,
32,Flight turbulence increasing as planet heats up,/news/science-environment-65844901,Science & Environment,
33,Miriam Margolyes makes Vogue cover debut at 82,/news/entertainment-arts-65908540,Entertainment & Arts,
34,In pictures: Nottingham attack shakes city to core,/news/uk-65899897,UK,
35,Surreal skies grip New Yorkers - in pictures,/news/in-pictures-65843841,In Pictures,
36,In Pictures: The biggest music acts to play Wales,/news/uk-wales-65860650,Wales,
37,Mosque plasterers and rock cutters: Africa's top shots,/news/world-africa-65843357,Africa,
38,Strawberry Moon captured over England,/news/uk-england-leicestershire-65802574,Leicester,
