,title,href,tag,summary
0,Gunman kills up to 10 at Walmart store in Virginia,/news/world-us-canada-63724716,US & Canada,A man believed to be the store manager opened fire then turned the gun on himself.
1,Angry protests at giant iPhone factory in China,https://www.bbc.com/news/world-asia-china-63725812,China,
2,How Germany ended reliance on Russian gas,https://www.bbc.com/news/world-europe-63709352,Europe,
3,Japan's best are heading to Europe as J-League evolves,https://www.bbc.com/sport/football/63559988,World Cup,
4,How bad are air miles for the climate?,https://www.bbc.com/future/article/20221122-should-we-get-rid-of-air-miles-for-climate-change,Future Planet,
5,One killed in twin Jerusalem bus stop explosions,/news/world-middle-east-63726676,Middle East,Israeli police say the separate blasts at busy bus stops were suspected Palestinian attacks.
6,Biden extends freeze of student loan repayments,/news/world-us-canada-63724224,US & Canada,Repayments are put on hold for an eighth time as Republicans challenge the plan to forgive some debt.
7,Underdog Canada and its fans warm up for World Cup,/news/world-us-canada-63684672,US & Canada,"Canada will play for the first time in 36 years, ushering in a new era for football in the country."
8,"World Cup build-up, Wales & England updates, plus Man Utd & Ronaldo",/sport/live/football/63709607,Football,"Latest news and reaction from the 2022 Fifa World Cup in Qatar, build-up to Wednesday's games, plus what next for Man Utd and Cristiano Ronaldo?"
9,Australia players were 'cowards' - ex-coach Langer,/sport/cricket/63726442,Cricket,"Ex-Australia coach Justin Langer says some of his former players were ""cowards"" for making anonymous complaints about him in the media."
10,'Inevitable end' for Ronaldo 'ticking timebomb',/sport/football/63723639,Football,"Cristiano Ronaldo's situation at Manchester United was ""like a ticking timebomb"", says former United and England captain Rio Ferdinand."
11,"Ronaldo's off, Kane's scan & a Saudi shock win",https://www.bbc.co.uk/sounds/play/curation:p0crsr54/p0dj4nwr,Sounds,Kelly Cates presents the big football stories on the World Cup Daily
12,The team boss with imposter syndrome at World Cup,https://www.bbc.com/sport/football/63503980,World Cup,John Herdman says he will have imposter syndrome when he takes charge of Canada at the World Cup
13,Why is there so much added time at the World Cup?,https://www.bbc.com/sport/football/63710986,World Cup,The four matches at the World Cup so far have had lots of stoppage time added on
14,The ancient 'power couple' who changed the world,/reel/video/p0dj5xcx/justinian-and-theodora-the-byzantine-power-couple,,
15,The science behind our love of spicy food,/reel/video/p0dglbf7/spicy-chillies-behind-the-agonising-pleasure-of-capsaicin,,
16,The surprising trick to boost your sex appeal,/reel/video/p09jg3zy/why-we-re-so-attracted-to-the-non-conformists,,
17,Africa's stunning 80km safari train,https://www.bbc.com/travel/article/20221122-zimbabwes-stunning-80km-safari-train,Travel,"The ""Elephant Express"" offers visitors an utterly unique experience"
18,How our strangest dreams come to life,https://www.bbc.com/culture/article/20221122-how-our-strangest-dreams-come-to-life-in-art-and-design,Culture,Surrealism is no longer an art movement – it's an attitude to life and design
19,The twin flames of sister best friends,https://www.bbc.com/worklife/article/20221121-the-intertwined-lives-of-sister-best-friends,Worklife,"""If we lived further away, we'd live our lives in complete panic and anxiety"""
20,The benefits of being forgetful,https://www.bbc.com/future/article/20221121-the-benefits-of-being-forgetful,Future,Momentary lapses in memory may actually be good for us
21,Gambling my life away: Stories of addiction and recovery,https://www.bbc.co.uk/programmes/p0dhyw90,Sounds,Two women who lost everything to gambling share their stories of recovery
22,Man seeks new bowl after catching giant goldfish,https://www.bbc.com/news/uk-england-hereford-worcester-63707394,UK,"Andy Hackett lands the ""elusive"" beast while on a trip to France"
23,FTX boss ran crypto firm as his 'personal fiefdom',https://www.bbc.com/news/business-63720310,Business,"FTX's collapse was described in court as ""one of most abrupt and difficult"" in corporate America"
24,The floating solar revolution,/future/article/20221116-the-floating-solar-panels-that-track-the-sun,,
25,The doctors prescribing 'blue' therapy,/future/article/20221108-the-doctors-prescribing-blue-therapy,,
26,The world's first sand battery,/future/article/20221102-how-a-sand-battery-could-transform-clean-energy,,
27,Breakout novel A Little Life heads to the West End,/news/entertainment-arts-63663348,Entertainment & Arts,"The Booker-nominated novel, which developed a huge young fanbase, is coming to London's West End."
28,'I wouldn't leave South Africa I have a kid here',https://www.bbc.co.uk/news/business-63646696,Business,
29,Europe to commit billions to 'space race',/news/science-environment-63706880,Science & Environment,
30,How Covid is rising again in China,/news/59882774,Reality Check,
31,Chris Hemsworth pauses career over Alzheimer’s risk,/news/entertainment-arts-63668310,Entertainment & Arts,
32,Apple and Google face gaming and browser probe,/news/technology-63718495,Technology,
33,UK faces worst downturn of any advanced country,/news/business-63704841,Business,
34,Historic images show 'how we used to live' in city,/news/uk-england-tyne-63674925,Tyne & Wear,
35,"Africa's top shots: Silk, beads and gold beauty queens",/news/world-africa-63661322,Africa,
36,Inside the floating polar research laboratory,/news/uk-england-essex-63628208,Essex,
37,"Africa's top shots: Bullseye, birds and ballet",/news/world-africa-63542247,Africa,
38,Lensman recaptures city pub scenes 40 years on,/news/uk-england-humber-63549572,Humberside,
