,title,href,tag,summary
0,Russia ramps up security after Crimea bridge blast,/news/world-europe-63189627,Europe,Moscow moves to secure the key connector and repair it as soon as possible after the explosion.
1,'Russian attack' on city claimed by Moscow kills 17,/news/world-europe-63190844,Europe,
2,Iran state TV hacked during news broadcast,/news/world-middle-east-63188795,Middle East,
3,Gambia police probe deaths linked to cough syrup,/news/world-africa-63191406,Africa,
4,A new mission to see Titanic,https://www.bbc.com/travel/article/20221007-ocean-gate-a-new-mission-to-see-titanic,Travel,
5,New York declares emergency on migrant 'crisis',/news/world-us-canada-63177892,US & Canada,Mayor Eric Adams said the city is on track to spend $1bn this fiscal year to care for asylum seekers.
6,What Biden's cannabis review means for Americans,/news/world-us-canada-63175193,US & Canada,Marijuana stocks are ablaze after the president called for a rethink of US policy on the drug.
7,Verstappen seals title amid confusion after Japan win,/sport/formula1/63190934,Formula 1,Max Verstappen clinches a second title in extraordinary circumstances after dominating a Japanese Grand Prix truncated by heavy rain.
8,England drawn with Italy in Euro 2024 qualifying,/sport/football/63191282,Sport,England are drawn in the same group as Italy - the team that beat them in the Euro 2020 final - in qualifying for Euro 2024 in Germany.
9,Hales hammers 84 as England beat Australia,/sport/cricket/63191377,Cricket,Alex Hales whacks 84 off 51 balls as he spearheads England's eight-run victory over Australia in the first T20 in Perth.
10,Bevan kick seals dramatic Wales win over Scotland,/sport/rugby-union/63167585,Rugby Union,Wales' Keira Bevan kicks an 84th-minute penalty to clinch a thrilling 18-15 win against Scotland in their World Cup opener.
11,The Japanese plant impossible to kill,https://www.bbc.com/future/article/20221006-the-race-to-kill-the-worlds-most-invasive-weed,Future,Japanese knotweed was once the darling of gardeners – now it has to go.
12,The vast impact of endless green energy,https://www.bbc.com/future/article/20221006-what-would-happen-if-we-had-limitless-green-energy,Future Planet,An inexhaustible supply of renewables would transform the world
13,Is this the world's best beef?,https://www.bbc.com/travel/article/20221005-the-wagyu-olympics-the-quest-for-the-worlds-best-beef,Travel,"In Japan, achieving steak perfection is more about the journey than the goal"
14,The voices of survivors from the sinking of the SS Athenia,/reel/video/p0d4y9zs/the-voices-of-survivors-from-the-sinking-of-the-ss-athenia,,
15,My ‘Parasite’-style apartment was like a five-star hotel,/reel/video/p0cxqmc3/my-parasite-style-apartment-was-like-a-five-star-hotel,,
16,The shocking truth behind the 'most haunted' site in India,/reel/video/p0d3s2bf/the-secrets-of-india-s-haunted-fort,,
17,"The US' puzzling, paranormal mystery",https://www.bbc.com/travel/article/20221006-route-66s-glowing-mystery-orb,Travel,"It's the scariest tract of Route 66, with a name to match"
18,Why are global rates of myopia soaring?,https://www.bbc.com/future/article/20220927-can-you-prevent-short-sightedness-in-kids,Future,Short-sightedness has risen to over 80% in some parts of the world
19,The kids being raised without gender,https://www.bbc.com/worklife/article/20220929-the-parents-raising-their-children-without-gender,Worklife,Why some parents champion a 'gender-creative' parenting style
20,A controversial archaeological find,https://www.bbc.com/culture/article/20221006-the-controversy-over-an-incredible-archaeological-discovery,Culture,The war of words over the incredible discovery of an English king
21,Duo were 'privileged' to write new ending for 007,https://www.bbc.com/news/entertainment-arts-63143081,Entertainment & Arts,The screenwriters discuss what it takes to keep the James Bond franchise alive
22,Putin's dream of victory slips away in Ukraine,https://www.bbc.com/news/world-europe-63160354,Europe,"While Russia annexes large areas of Ukraine, the truth on the ground looks very different"
23,Homeowners 'tearing their hair out' over rising rates,https://www.bbc.com/news/business-63160377,Business,"Whether letting or living in their homes, mortgages are pushing up the cost for many people"
24,Will Venice succumb to the sea?,/future/article/20220927-italys-plan-to-save-venice-from-sinking,,
25,India's sustainable cooling solution,/future/article/20220920-how-indias-lattice-buildings-cool-without-air-con,,
26,The ignored potential of human poo,/future/article/20220830-the-new-science-of-recycling-human-poo,,
27,Elon Musk: Twitter won't 'take yes for an answer',/news/business-63166568,Business,Twitter said it did not trust the billionaire's promises to proceed with the takeover.
28,Pavement on their reunion: 'We're like an uncaged tiger',/news/entertainment-arts-63157311,Entertainment & Arts,
29,Dancers' moves help to power Glasgow music venue,/news/technology-63161838,Technology,
30,Wildlife abandons 'Europe's Amazon' nature reserve,/news/world-63011640,World,
31,Womb stem cell patch to fix babies' spines,/news/health-63155654,Health,
32,'We never knew who the photographer was',/news/uk-england-manchester-62561555,Manchester,
33,Protect elderly from rising Covid levels in UK,/news/health-63170006,Health,
34,"A human tower, a hug and a cocktail: Photos of the week",/news/in-pictures-63171345,In Pictures,
35,Your pictures on the theme of 'skylines',/news/in-pictures-63143453,In Pictures,
36,Africa's top shots: Patriotic portraits and red afros,/news/world-africa-63155899,Africa,
37,India celebrates Dussehra festival with pomp,/news/world-asia-india-63113937,India,
38,In pictures: Floridians take in Hurricane Ian’s impact,/news/world-us-canada-63080969,US & Canada,
