,title,href,tag,summary
0,Spanish prosecutors open investigation into Rubiales kiss,/sport/football/66640485,News,Spain's top criminal court opens a preliminary investigation into the country's football federation president Luis Rubiales after he kissed player Jenni Hermoso on the lips.
1,Trump faces trial a day before vital Republican vote,https://www.bbc.com/news/world-us-canada-66516718,US,
2,Mysterious military time capsule contents revealed,https://www.bbc.com/news/world-us-canada-66641401,US,
3,The European city with a bad reputation,https://www.bbc.com/travel/article/20230827-amsterdam-the-european-capital-fighting-bad-tourists,Travel,
4,The epic hurricane tug of war,https://www.bbc.com/future/article/20230825-the-other-nio-that-fuels-the-most-destructive-hurricanes,Future,
5,DeSantis booed at vigil for Jacksonville victims,/news/world-us-canada-66637476,US & Canada,Hundreds gathered on Sunday to remember the three victims of a racist shooting in the Florida city.
6,'He just went to the store - we lost him forever',/news/world-us-canada-66641143,US & Canada,"Florida mourns a young father, a caring mother and a teenage cashier who died in a racist shooting."
7,Maui woman visits burnt home each day to feed cats,/news/world-us-canada-66611957,US & Canada,Susie Richter did not expect all her cats to survive the wildfires and was elated when they did.
8,'Resilient Hovland chips away to hit new heights',/sport/golf/66635076,Golf,"Norwegian Viktor Hovland's spectacular end to the season is the result of many hours with his unorthodox new coach, writes Iain Carter."
9,Swiatek breezes into second round at US Open,/sport/tennis/66641001,Tennis,Iga Swiatek begins her defence of the US Open title with an emphatic first-round victory as eighth seed Maria Sakkari crashes out.
10,Lukaku closes in on Roma loan move,/sport/football/66642272,Football,Chelsea's Belgian striker Romelu Lukaku is close to joining Serie A side Roma on a season-long loan.
11,The mysterious Mormon alphabet that time (almost) forgot,/reel/video/p0g8vr7g/the-mysterious-mormon-alphabet-that-time-almost-forgot,,
12,Are we bracing for a new Sandy?,/reel/video/p0g8hx9j/are-we-bracing-for-a-new-hurricane-sandy-,,
13,Three lunar dilemmas unraveling the mysteries of our own planet,/reel/video/p0g8d11j/three-unsolved-mysteries-of-the-moon,,
14,TV's surprising new star,https://www.bbc.com/worklife/article/20230824-how-the-workplace-became-the-star-of-tv,Worklife,Peeking into others' work lives provides an experience like no other
15,10 churches given amazing new life,https://www.bbc.com/culture/article/20230825-10-churches-around-the-world-given-amazing-new-life,Culture,"From a library to a skatepark, church buildings are being repurposed"
16,The mystery of what causes ALS,https://www.bbc.com/future/article/20230825-the-mystery-of-why-some-people-develop-als,Future,Scientists are racing to find out what causes this progressive disease
17,The 7 best dive bars in New York City,https://www.bbc.com/travel/article/20230825-discover-new-york-citys-seven-best-dive-bars,Travel,These beloved holdouts embody NYC's spirit
18,France to ban wearing of abayas in state schools,https://www.bbc.com/news/world-europe-66634890,Europe,The education minister says female Muslim students will not be allowed to wear the loose-fitting...
19,Canadian Olympic figure skater dies in car crash,https://www.bbc.com/news/world-us-canada-66637282,Canada,"Alexandra Paul's baby, who was also in the car, survived the crash in Ontario"
20,Hannah Montana star arrested over crisps theft,https://www.bbc.com/news/entertainment-arts-66637782,Entertainment,"Mitchel Musso, who starred opposite Miley Cyrus in the show, spent a night in jail"
21,What is the greenest funeral option?,/future/article/20230821-how-to-plan-a-sustainable-funeral,,
22,Sound recordings from beneath the sea,/future/article/20230815-how-undersea-sounds-help-us-understand-ocean-life,,
23,The indigenous guardians healing Canada,/future/article/20230809-how-indigenous-guardians-are-protecting-canadas-environment,,
24,Trump breaks silence on X after Georgia arrest,/news/business-66612777,Business,Mr Trump's first post on the platform formerly called Twitter since January 2021 includes his...
25,China’s summer of climate destruction,/news/world-asia-china-66616699,China,
26,10 things we learned at Leeds Festival,/news/entertainment-arts-66361119,Entertainment & Arts,
27,The indigenous groups fighting the quest for 'white gold',/news/world-latin-america-66520097,Latin America & Caribbean,
28,88 UK deaths linked to Canadian 'poison seller',/news/world-us-canada-66609884,US & Canada,
29,How robotaxis are dividing San Francisco,/news/technology-66611513,Technology,
30,Elton John spends night in hospital after fall,/news/entertainment-arts-66640455,Entertainment & Arts,
31,Religion and reggae: Africa’s top shots,/news/world-africa-66603513,Africa,
32,Photo prize shortlist celebrates region's beauty,/news/uk-england-tyne-66594319,Tyne & Wear,
33,Sunflowers irresistible to Instagram photo hunters,/news/uk-wales-66514508,Wales,
34,In pictures: Michael Parkinson and his star guests,/news/entertainment-arts-66430865,Entertainment & Arts,
35,"Tricks, trials and salutes: Africa’s top shots",/news/world-africa-66532676,Africa,
