,title,href,tag,summary
0,Russian state TV takes aim at Wagner's Prigozhin,/news/world-europe-66127952,Europe,"Piles of cash, weapons and a giant sledgehammer seen in pictures allegedly showing a raid on his home."
1,"No heroes after Wagner mutiny, Lukashenko tells BBC",/news/world-europe-66122337,Europe,
2,'Almost every influencer will be hopping on Threads',/news/technology-66122246,Technology,
3,Is this the era of the 'flopbuster'?,https://www.bbc.com/culture/article/20230705-does-indiana-jones-and-the-dial-of-destiny-mark-the-era-of-the-flopbuster,Culture,
4,The next footprints on the Moon,https://www.bbc.com/future/article/20230705-what-will-the-next-footprints-on-the-moon-look-like,Future,
5,"El Paso survivor, 16, to gunman: 'I want you dead'",/news/world-us-canada-66124765,US & Canada,"Survivors of the 2019 shooting at a Walmart in El Paso, Texas, have addressed the attacker in court."
6,Is this largest jewellery heist in US history?,/news/66128700,US & Canada,Body cam footage shows the aftermath of a jewellery robbery in 2022 that could be valued at $100 million.
7,Tourist who carved on Colosseum 'unaware of age',/news/world-europe-66121000,Europe,The UK-based holidaymaker apologises and says he did not realise how old the Roman arena was.
8,Follow Wimbledon updates on day four,/sport/live/tennis/65583869,Tennis,Get the latest updates with live text coverage.
9,Wood thrills but crucial Ashes Test in the balance,/sport/cricket/66125249,Cricket,A rapid Mark Wood stars for England but Mitchell Marsh's ton means the third Ashes Test is in the balance after a gripping first day.
10,Murray leads Tsitsipas but stopped by 11pm curfew,/sport/tennis/66129245,Tennis,Andy Murray dazzles under the Wimbledon lights again as he leads Greek fifth seed Stefanos Tsitsipas in a thriller on Centre Court.
11,The surprising impact of heatwaves on the air we breathe,/reel/video/p0fz7y12/why-extreme-heat-makes-air-quality-worse,,
12,The surprising benefits of breaking up,/reel/video/p0fyvbnd/the-unexpected-benefits-of-breaking-up,,
13,Fermi Paradox: Are we alone in the Universe?,/reel/video/p0fyqh5s/fermi-paradox-are-we-alone-in-the-universe-,,
14,When layoffs turn into 'Hunger Games',https://www.bbc.com/worklife/article/20230703-it-brings-out-the-worst-in-everyone-why-some-workers-are-competing-for-their-own-jobs,Worklife,Why some companies pit colleagues and friends against each other
15,The dark past of the Chocolate Islands,https://www.bbc.com/travel/article/20230705-how-the-chocolate-islands-are-rediscovering-their-roots,World's Table,"""I'd never tasted anything like it"""
16,The bacteria living inside tumours,https://www.bbc.com/future/article/20230704-the-mystery-of-microbes-that-live-inside-tumours,Future,Microbes found lurking inside cancers offer new hope for treatments
17,Mission: Impossible 7 is 'ultra-modern',https://www.bbc.com/culture/article/20230705-mission-impossible-dead-reckoning-is-ideal-escapism,Culture,"Tom Cruise's latest is both ""high tech"" and ""defiantly traditional"""
18,The Viking spirit of Scotland's islands,https://www.bbc.com/travel/article/20230706-the-viking-spirit-of-a-remote-scottish-archipelago,Travel,Why are the Orkney Islands looking to leave Scotland?
19,Teenager died trying to save friend in US shooting,https://www.bbc.com/news/world-us-canada-66121634,US,Another victim of the shooting had been expecting to walk his daughter down the aisle this weekend
20,US Women's Open making history as 2023 edition begins,https://www.bbc.com/sport/golf/66117797,Golf,"The US Women's Open boasts an iconic venue, record purse and intriguing storylines"
21,Why white paint could cool India,/future/article/20230628-the-white-roofs-cooling-womens-homes-in-indian-slums,,
22,How a photo changed our view of chimps,/future/article/20230623-how-jane-goodall-chimp-iconic-photo-changed-our-view-of-nature,,
23,The homes built from cannabis,/future/article/20230614-the-buildings-constructed-from-cannabis,,
24,Winemakers learn firefighting to stay in business,https://www.bbc.co.uk/news/business-66096061,Business,Winemakers in the Napa Valley are having to battle wildfires affecting vineyards and wineries.
25,Star Wars original studios at risk of crumbling,/news/uk-england-beds-bucks-herts-66121521,"Beds, Herts & Bucks",
26,Threads could cause real problems for Twitter,/news/technology-66118168,Technology,
27,Greta Thunberg charged for blocking oil port,/news/science-environment-66120290,Science & Environment,
28,In pictures: Kings Charles III celebrations,/news/uk-scotland-66108829,Scotland,
29,Young adults see rise in severe distress - study,/news/health-66122386,Health,
30,"Irish broadcaster RTÉ spent €5,000 on flip-flops",https://www.bbc.co.uk/news/articles/cq5g5wv9k59o,Entertainment,
31,Mystery of Holocaust escape girls finally solved,/news/uk-england-tyne-66040197,Tyne & Wear,
32,Gigantic leaps and party people: Africa's top shots,/news/world-africa-66052642,Africa,
33,Eid al-Adha around the world in pictures,/news/world-66041087,World,
34,Photographer shares shots of famous musicians,/news/uk-wales-65989687,Wales,
35,Millinery masterpieces at Royal Ascot,https://www.bbc.co.uk/news/articles/c3g1e00xgy2o,News,
