,title,href,tag,summary
0,Four dead at 16th birthday party shooting in US,/news/world-us-canada-65293737,US & Canada,The shooting at a dance studio in the small town of Dadeville leaves 28 people injured.
1,Explosions and gunfire in Sudan's capital as fighting rages,/news/live/world-africa-65285254,Africa,
2,EU rejects Ukraine grain ban by Poland and Hungary,/news/world-europe-65292698,Europe,
3,Sonic the Hedgehog firm agrees to buy Angry Birds,/news/business-65295724,Business,
4,Britain's 'cool' new seaside towns,https://www.bbc.com/travel/article/20230416-a-new-life-for-britains-seaside-towns,Travel,
5,"Shock and anger in Khartoum, a city not used to war",/news/world-africa-65293537,Africa,Residents say stray bullets and threatened neighbourhood sweeps by armed forces mean nowhere is safe.
6,'We wish we could go back': Life under Myanmar's military rule,https://www.bbc.co.uk/news/world-asia-65248242,News,The BBC is given a rare chance to see inside Myanmar two years after the coup.
7,Musk's SpaceX set to fly biggest rocket ever,/news/science-environment-65294084,Science & Environment,Elon Musk's company is counting down to the debut launch of the most powerful rocket ever built.
8,Football latest: Arsenal drop points & Chelsea reach Women's FA Cup final,/sport/live/football/65296596,Football,"Arsenal drop more points, Manchester United win and Chelsea reach Women's FA Cup final - all the reaction to Sunday's football plus build-up to Leeds v Liverpool."
9,Nervous Arsenal 'still in great position' for title,/sport/football/65294212,Football,After two successive 2-2 draws Arsenal players are showing signs of self-doubt as the Gunners push to become champions for the first time since 2004.
10,Is Antony starting to live up to £81m price tag?,/sport/football/65295131,Football,Antony scores once and assists another as Manchester United move up to third in the Premier League - so is he finally starting to prove his worth?
11,The 'White Queen' at the heart of England's War of the Roses,/reel/video/p0fghd71/the-women-at-the-heart-of-the-bloody-war-of-the-roses,,
12,Why we're probably living in a Matrix-like simulation,/reel/video/p0ff9hkw/why-your-life-is-probably-a-simulation,,
13,"Mysterious 3,700-year-old sentence gets decoded",/reel/video/p0f3svrh/decoding-oldest-known-sentence-written-in-first-alphabet,,
14,Why some people's pain is ignored,https://www.bbc.com/future/article/20230414-the-search-for-an-objective-measure-of-pain,Future,Biomarkers for pain could help weed bias out of pain treatment
15,A new twist on working with friends,https://www.bbc.com/worklife/article/20230413-home-coworking-spaces-with-friends,Worklife,The workers creating co-working spaces in their homes
16,The man hunting down dead celebrities,https://www.bbc.com/culture/article/20230414-scott-covert-artist-mission-to-hunt-down-dead-celebrities,Culture,Why artist Scott Covert has devoted himself to finding famous people's graves
17,Japan's little-known drinking dens,https://www.bbc.com/travel/article/20230413-the-drinking-culture-hidden-inside-japans-liquor-stores,Travel,"They may be slightly intimidating for first timers, but everyone is welcome"
18,A simple guide to what's going on in Sudan,https://www.bbc.com/news/world-africa-65284948,Africa,The fighting is a direct result of a vicious power struggle within the military leadership
19,Sydney loses ranking as Australia's biggest city,https://www.bbc.com/news/world-australia-65261720,Australia,A boundary change means Sydney isn't Australia's biggest city for the first time in over a century
20,More people could have hidden bowel condition,https://www.bbc.com/news/health-65276600,Health,"People with microscopic colitis have frequent diarrhoea, stomach pain and fatigue"
21,A major positive climate tipping point,/future/article/20230414-climate-change-why-2023-is-a-clean-energy-milestone,,
22,The wool that could capture carbon,/future/article/20230413-can-regenerative-wool-make-fashion-more-sustainable,,
23,The rich worlds created by avalanches,/future/article/20230405-how-avalanche-management-could-help-wildlife-in-the-alps,,
24,How artificial intelligence is matching drugs to patients,https://www.bbc.co.uk/news/business-65260592,Business,Health-tech firms around the world are increasingly using AI to help tailor drugs for patients.
25,Is this the UK's most abused traffic bollard?,/news/uk-65243274,UK,
26,Landmark locations celebrate Ramadan,/news/uk-england-65266627,England,
27,Tech worker arrested in Cash App founder's killing,/news/world-us-canada-65257806,US & Canada,
28,Florida governor signs 6-week abortion ban into law,/news/world-us-canada-65271298,US & Canada,
29,Ford launches hands-free driving on UK motorways,/news/business-65272929,Business,
30,Final Eurovision pre-party before Liverpool,/news/entertainment-arts-65278612,Entertainment & Arts,
31,Homage to a friend wins 2023 Sony World Photography Awards,/news/in-pictures-65208363,In Pictures,
32,The miniskirt pioneer who defined 60s fashion,/news/in-pictures-65265873,In Pictures,
33,Jesus wigs and false bananas: Africa's top shots,/news/world-africa-65262841,Africa,
34,The ship graveyard which has claimed many lives,/news/uk-wales-57853220,Wales,
35,Green leaves and yawning soldiers: Africa's top shots,/news/world-africa-65200809,Africa,
